{
  "id": "9TMHC_1NR",
  "title": "Lemon Chicken Orzo Soup Recipe",
  "description": "This comforting lemon chicken orzo soup is packed with tender chunks of chicken in a fragrant lemon broth with orzo pasta and lots of wholesome veggies.",
  "body": "​ \n\n \n\n \n\n \n\n \n\n \n\n \n\n \n\n \n\n \n\n \n\n \n\n \n\n \n\n \n\n \n\n \n\n \n\n \n\n \n\n \n\n \n\n \n\n \n\n \n\n \n\n \n\n \n\n \n\n\n\n\n\u003ciframe src=\"//www.googletagmanager.com/ns.html?id=GTM-P3X3VT7\" height=\"0\" width=\"0\" style=\"display:none;visibility:hidden\"\u003e\u003c/iframe\u003e\n\nSkip to content\n\n\n\n\n\n\n\n\n\n\n\n\n\n\n Allrecipes\n\n\n \n \n\n\n\n\n\n\n \n\n\n\n\n\n\nSearch\n\n\n\n\n\n\n\n\n\n\n\n\n\n \n\n\n\nPlease fill out this field.\n\n\n\n\n\n\nSearch the site\n\n\n\n\n\n\n\n\n \n\n\n\nPlease fill out this field.\n\n\n\n\n\n \n\n\n\nLog In\n\n \n\n\nMy Account\n\n\n\n\n\n\n\n My Profile\n \n\n Add a Recipe\n \n\n Saved Recipes \u0026 Collections\n \n\n Account Settings\n \n\n Help\n \n\n Log Out\n \n\n\n\n\n\nMagazine\n\n\n\n\n\n\n\n Subscribe\n \n\n Manage Your Subscription\n \n\n Give a Gift Subscription\n \n\n Get Help\n \n\n\n\nNewsletters\n\n\n Sweepstakes\n \n\n\n\n\n\n\n\n\n\n\n\n\n\n\n\n\n\n\n\n\n\n Allrecipes\n\n\n \n\n\n\n\n\nSearch\n\n\n\n\n\n\n\n\n \n\n\n\nPlease fill out this field.\n\n\n\n\n\n\nDinners\n\n\n\n\n\n\n\n\n\n\n\nDinners\n\n\n\n 5-Ingredient Dinners\n \n\n One-Pot Meals\n \n\n Quick \u0026 Easy\n \n\n 30-Minute Meals\n \n\n Family Dinners\n \n\n Soups, Stews \u0026 Chili\n \n\n Comfort Food\n \n\n Main Dishes\n \n\n Sheet Pan Dinners\n \n\n View All\n \n\n\n\n\n\nMeals\n\n\n\n\n\n\n\n\n\n\n\nMeals\n\n\n\n Breakfast \u0026 Brunch\n \n\n Lunch\n \n\n Healthy\n \n\n Appetizers \u0026 Snacks\n \n\n Salads\n \n\n Side Dishes\n \n\n Soups\n \n\n Bread\n \n\n Drinks\n \n\n Desserts\n \n\n View All\n \n\n\n\n\n\nIngredients\n\n\n\n\n\n\n\n\n\n\n\nIngredients\n\n\n\n Chicken\n \n\n Beef\n \n\n Pork\n \n\n Seafood\n \n\n Pasta\n \n\n Fruits\n \n\n Vegetables\n \n\n View All\n \n\n\n\n\n\nOccasions\n\n\n\n\n\n\n\n\n\n\n\nOccasions\n\n\n\n Kentucky Derby Recipes\n \n\n Cinco de Mayo Recipes\n \n\n Mother's Day Recipes\n \n\n Memorial Day Recipes\n \n\n View All\n \n\n\n\n\n\nCuisines\n\n\n\n\n\n\n\n\n\n\n\nCuisines\n\n\n\n Mexican\n \n\n Italian\n \n\n Chinese\n \n\n Indian\n \n\n German\n \n\n Greek\n \n\n Filipino\n \n\n Japanese\n \n\n View All\n \n\n\n\n\n\nKitchen Tips\n\n\n\n\n\n\n\n\n\n\n\nKitchen Tips\n\n\n\n Instant Pot\n \n\n Air Fryer\n \n\n Slow Cooker\n \n\n Our Favorite Products\n \n\n BBQ \u0026 Grilling\n \n\n Cooking by Equipment\n \n\n Ingredient Substitutions\n \n\n View All\n \n\n\n\n\n\nNews\n\n\n\n\n\n\n\n\n\n\n\nNews\n\n\n\n Celebrity \u0026 Entertainment\n \n\n Fast Food\n \n\n Grocery\n \n\n Recalls\n \n\n Trends\n \n\n View All\n \n\n\n\n\n\nFeatures\n\n\n\n\n\n\n\n\n\n\n\nFeatures\n\n\n\n Dinner Fix\n \n\n Sweet Spot\n \n\n In the Kitchen\n \n\n\n\n\n\nAbout Us\n\n\n\n\n\n\n\n\n\n\n\nAbout Us\n\n\n\n About Allrecipes\n \n\n Allstars\n \n\n How to Add a Recipe\n \n\n\n\n\n GET THE MAGAZINE\n \n\n \n\n\n\n\n\n\n\n \n\n\n\nLog In\n\n \n\n\nMy Account\n\n\n\n\n\n\n\n\n\n\n\nMy Account\n\n\n\n My Profile\n \n\n Add a Recipe\n \n\n Saved Recipes \u0026 Collections\n \n\n Account Settings\n \n\n Help\n \n\n Log Out\n \n\n\n\n\n\nMagazine\n\n\n\n\n\n\n\n\n\n\n\nMagazine\n\n\n\n Subscribe\n \n\n Manage Your Subscription\n \n\n Give a Gift Subscription\n \n\n Get Help\n \n\n\n\nNewsletters\n\n\n Sweepstakes\n \n\n\n\n\n\n\n\n\n\n\n\n\n\nFollow Us\n\n\n \n\n\n \n\n \n\n\n \n\n \n\n\n \n\n \n\n\n \n\n \n\n\n \n\n \n\n\n \n\n\n \n\n\n\n\n Dinners\n\n\n\n 5-Ingredient Dinners\n \n\n One-Pot Meals\n \n\n Quick \u0026 Easy\n \n\n 30-Minute Meals\n \n\n Family Dinners\n \n\n Soups, Stews \u0026 Chili\n \n\n Comfort Food\n \n\n Main Dishes\n \n\n Sheet Pan Dinners\n \n\n View All\n \n\n\n\n Meals\n\n\n\n Breakfast \u0026 Brunch\n \n\n Lunch\n \n\n Healthy\n \n\n Appetizers \u0026 Snacks\n \n\n Salads\n \n\n Side Dishes\n \n\n Soups\n \n\n Bread\n \n\n Drinks\n \n\n Desserts\n \n\n View All\n \n\n\n\n Ingredients\n\n\n\n Chicken\n \n\n Beef\n \n\n Pork\n \n\n Seafood\n \n\n Pasta\n \n\n Fruits\n \n\n Vegetables\n \n\n View All\n \n\n\n\n Occasions\n\n\n\n Kentucky Derby Recipes\n \n\n Cinco de Mayo Recipes\n \n\n Mother's Day Recipes\n \n\n Memorial Day Recipes\n \n\n View All\n \n\n\n\n Cuisines\n\n\n\n Mexican\n \n\n Italian\n \n\n Chinese\n \n\n Indian\n \n\n German\n \n\n Greek\n \n\n Filipino\n \n\n Japanese\n \n\n View All\n \n\n\n\n Kitchen Tips\n\n\n\n Instant Pot\n \n\n Air Fryer\n \n\n Slow Cooker\n \n\n Our Favorite Products\n \n\n BBQ \u0026 Grilling\n \n\n Cooking by Equipment\n \n\n Ingredient Substitutions\n \n\n View All\n \n\n\n\n News\n\n\n\n Celebrity \u0026 Entertainment\n \n\n Fast Food\n \n\n Grocery\n \n\n Recalls\n \n\n Trends\n \n\n View All\n \n\n\n\n Features\n\n\n\n Dinner Fix\n \n\n Sweet Spot\n \n\n In the Kitchen\n \n\n\n\n\n\n About Us\n\n\n\n The Allrecipes Allstars\n \n\n How to Add a Recipe\n \n\n\nGET THE MAGAZINE\n\n\n\n\n\n\n\nRecipes\n\n\n\nSoups, Stews and Chili Recipes\n\n\n\nSoup Recipes\n\n\n\nChicken Soup Recipes\n\nLemon Chicken Orzo Soup\n\n\n\n\n\n\n\n\n\n\n\n\n\n\n\n\n\n4.8\n(511)\n398 Reviews\n107 Photos\nThis lemon chicken orzo soup is comfort in a bowl! It is so flavorful with tender pieces of chicken in a lemony broth with orzo pasta, carrots, onions, celery, and baby spinach. This has quickly become one of my family's favorite soup recipes.\n\nSubmitted by\nReneePaj\n\nUpdated on February 11, 2025\n\n\n\nTested by\n Allrecipes Test Kitchen\n \n\n\n\nTested by\nAllrecipes Test Kitchen\n \nThe Allrecipes Test Kitchen staff are a team of culinary pros who make and vet recipes using only equipment you'd find in a home kitchen. Staff credentials vary but include training at the Culinary Institute of America; kitchen stints in fine dining restaurants; and countless hours in the test kitchen itself.\n\n\n\nMeet the Allrecipes Test Kitchen\n\n\n\n\n \n \nSave\n\n\n\n\n\n\n\n\nRate\n\n\n\n\n\n \nPrint\n\n\n\n\n\n\n\n\n\n\nShare\n\n\n\n\n\n \n\n\n\n\n\n\n\n\n\n\n\n\n\n\n\n\n\n\n\n\n\n\n\n\n\n\n\n\n \n\n \n\n Add Photo\n\n\n\n\n107\n\n\n\n\u003cimg\nsrc=\"https://www.allrecipes.com/thmb/lnMvmDSm4MzV2StUDc0Uy7jTP7c=/160x90/filters:no_upscale():max_bytes(150000):strip_icc():format(webp)/233968-lemon-chicken-orzo-soup-DDMFS-beauty-4x3-147-b050c9a6240d42458babf9296fa25289.jpg\"\nwidth=\"160\"\nheight=\"90\"\nclass=\"img--noscript photo mntl-image universal-image__image\"\nalt=\"looking down at a white bowl of lemon chicken orzo soup\"\n/\u003e\n\n\n107\n\n\n\n107\n\n\n\n107\n\n\n\n \n\nPrep Time:\n20 mins\n\n\nCook Time:\n30 mins\n\n\nTotal Time:\n50 mins\n\n\nServings:\n12 \n\n\nYield:\n6 quarts\n\n\nJump to Nutrition Facts\n\n Jump to recipe\n\n\n\n\n This comforting lemon chicken orzo soup recipe will brighten up even the gloomiest winter day. \n\n\n  Lemon Chicken Orzo Soup Ingredients  \n These are the ingredients you’ll need to make this lemon chicken orzo soup recipe: \n\n\n\nOrzo: Boil and drain 8 ounces of orzo pasta. \nOil: Cook the vegetables in a teaspoon of olive oil.  \nVegetables: This veggie-packed soup features onion, carrots, celery, and baby spinach. \nSeasonings: Season the soup with fresh garlic, dried thyme, dried oregano, salt and pepper, and a bay leaf. \nBroth: Use store-bought chicken broth or make your own at home. \nLemon: You’ll need fresh lemon juice, the zest of a lemon, and lemon slices for garnish. \nChicken: This soup is a great way to use leftover cooked chicken or rotisserie chicken. \nParmesan: Parmesan cheese is optional, but it’s a great finishing touch. \n\n\n  How to Make Lemon Chicken Orzo Soup  \n You’ll find the full, step-by-step recipe below — but here’s a brief overview of what you can expect when you make lemon chicken orzo soup: \n\n\n Boil, drain, and rinse the orzo. Cook the veggies, then stir in the garlic. Add the seasonings. Add the broth, bring to a boil, reduce the heat, and simmer until the veggies are tender. Stir in the orzo, lemon juice, lemon zest, and chicken. Cook until chicken and orzo are heated through, then stir in the spinach.Cook until spinach wilts into broth and orzo is tender.\n\n\n  What to Serve With Lemon Chicken Orzo Soup  \n This lemon chicken orzo soup pairs perfectly with French bread. A nice side salad would also work well. \n\n\n  How to Store Lemon Chicken Orzo Soup  \n Store your leftover lemon chicken orzo soup in an airtight container in the refrigerator for up to four days. \n\n\n  Allrecipes Community Tips and Praise  \n “Remarkably flavorful and easy to prepare,” raves Stacy in Sisters. “I knew I’d have leftover soup, so I listened to other reviews and did not combine the orzo to the soup. I spooned some in the bowl and covered with the soup.”\n\n\n \"This soup was soooo good,\" says another reviewer. \"Love that it called for fresh squeezed lemon juice and zest. It definitely makes a difference. I didn’t change a thing! The family loved the flavor - will definitely make again!\"\n\n\n “Great,” according to shelia. “Especially when I’m feeling under the weather. The lemon is perky and all the other ingredients build upon each other to an absolutely delicious meal.”\n\n\n Editorial contributions by Corey Williams\n\n\n\n\n \n\n\n\nCook Mode\n(Keep screen awake)\n\nIngredients\n \n\n\n\n\n\n\n1x\n\n\n\n\n\n\n\n\n2x\n\n\n\n\n\n\n\n\n4x\n\n\n\n \n\n\n\nOops! Something went wrong. Our team is working on it.\n\n\n\nOriginal recipe (1X) yields 12 servings\n \n\n8 ounces orzo pasta\n\n\n1 teaspoon olive oil\n\n\n3 medium carrots, chopped, or more to taste\n\n\n3 ribs celery, chopped\n\n\n1 medium onion, chopped\n\n\n2 cloves garlic, minced\n\n\n½ teaspoon dried thyme\n\n\n½ teaspoon dried oregano\n\n\n  salt and ground black pepper to taste\n\n\n1  bay leaf\n\n\n3 (32 ounce) cartons fat-free, low-sodium chicken broth\n\n\n½ cup fresh lemon juice\n\n\n1  lemon, zested\n\n\n8 ounces cooked chicken breast, chopped\n\n\n1 (8 ounce) package baby spinach leaves\n\n\n1  lemon, sliced for garnish (Optional)\n\n\n¼ cup grated Parmesan cheese (Optional)\n\n\n\nDirections\n\n\n Gather the ingredients.\n\n \n\n\n\n\u003cimg\nsrc=\"https://www.allrecipes.com/thmb/mWlannXA_LqZRJv-nQqHz_nyS0w=/1500x0/filters:no_upscale():max_bytes(150000):strip_icc():format(webp)/233968-lemon-chicken-orzo-soup-DDMFS-step-1-4x3-119-009039814fb5476ea2cc81367950411a.jpg\"\nwidth=\"4000\"\nheight=\"3000\"\nclass=\"img--noscript mntl-image mntl-image universal-image__image\"\nsrcset=\"https://www.allrecipes.com/thmb/YTCFa9Q7kndzNKUXDOLTySprESM=/750x0/filters:no_upscale():max_bytes(150000):strip_icc():format(webp)/233968-lemon-chicken-orzo-soup-DDMFS-step-1-4x3-119-009039814fb5476ea2cc81367950411a.jpg 750w\"\nsizes=\"750px\"\nalt=\"ingredients gathered in bowls to make lemon chicken orzo soup\"\n/\u003e\n\n \n Jen Causey / Food Styling: Margaret Monroe Dickey / Prop Styling: Josh Hoggle \n\n\n\n\n Bring a large pot of lightly salted water to a boil. Stir in orzo and return to a boil. Cook pasta uncovered until partially cooked through but not yet soft, about 5 minutes; drain and rinse with cold water until cooled completely.\n\n \n\n\n\n\u003cimg\nsrc=\"https://www.allrecipes.com/thmb/_rVw4q5q53HvfSxAg7IdjQ9vGKE=/1500x0/filters:no_upscale():max_bytes(150000):strip_icc():format(webp)/233968-lemon-chicken-orzo-soup-DDMFS-step-2-4x3-127-63dc0a52e3ec44e2a9658fdb77a592b6.jpg\"\nwidth=\"4000\"\nheight=\"3000\"\nclass=\"img--noscript mntl-image mntl-image universal-image__image\"\nsrcset=\"https://www.allrecipes.com/thmb/Af6ir2MsjypNumqVK7_y_Xtnwxk=/750x0/filters:no_upscale():max_bytes(150000):strip_icc():format(webp)/233968-lemon-chicken-orzo-soup-DDMFS-step-2-4x3-127-63dc0a52e3ec44e2a9658fdb77a592b6.jpg 750w\"\nsizes=\"750px\"\nalt=\"orzo cooked and draining in a colander \"\n/\u003e\n\n \n Jen Causey / Food Styling: Margaret Monroe Dickey / Prop Styling: Josh Hoggle \n\n\n\n\n Meanwhile, heat olive oil in a large pot over medium heat. Add carrots, celery, and onion; cook and stir until vegetables begin to soften and onion becomes translucent, about 5 minutes. Add garlic; cook and stir until fragrant, about 1 minute more. Season mixture with thyme, oregano, bay leaf, salt, and black pepper; continue cooking another 30 seconds before pouring chicken broth into the pot.\n\n \n\n\n\n\u003cimg\nsrc=\"https://www.allrecipes.com/thmb/MefU-Bb51cHAgghYaXq1yIl9TnE=/1500x0/filters:no_upscale():max_bytes(150000):strip_icc():format(webp)/233968-lemon-chicken-orzo-soup-DDMFS-step-3-4x3-121-410e3b2e733a4382a665cb6d015d001c.jpg\"\nwidth=\"4000\"\nheight=\"3000\"\nclass=\"img--noscript mntl-image mntl-image universal-image__image\"\nsrcset=\"https://www.allrecipes.com/thmb/8FU7Bnuwzi0iYrU74dNVepKl11Y=/750x0/filters:no_upscale():max_bytes(150000):strip_icc():format(webp)/233968-lemon-chicken-orzo-soup-DDMFS-step-3-4x3-121-410e3b2e733a4382a665cb6d015d001c.jpg 750w\"\nsizes=\"750px\"\nalt=\"ingredients added to a stock pot\"\n/\u003e\n\n \n Jen Causey / Food Styling: Margaret Monroe Dickey / Prop Styling: Josh Hoggle \n\n\n\n\n Bring broth to a boil. Partially cover the pot, reduce heat to medium-low, and simmer until vegetables are just tender, about 10 minutes.\n\n \n\n\n\n\u003cimg\nsrc=\"https://www.allrecipes.com/thmb/1bl2TKxmCeFh_Sitz7mNbb9NmjE=/1500x0/filters:no_upscale():max_bytes(150000):strip_icc():format(webp)/233968-lemon-chicken-orzo-soup-DDMFS-step-4-4x3-124-a8b5b360990a42058fcf10816c1f4b81.jpg\"\nwidth=\"4000\"\nheight=\"3000\"\nclass=\"img--noscript mntl-image mntl-image universal-image__image\"\nsrcset=\"https://www.allrecipes.com/thmb/u4NJGw9RSasT5eM3Jlx4fxDS9Xs=/750x0/filters:no_upscale():max_bytes(150000):strip_icc():format(webp)/233968-lemon-chicken-orzo-soup-DDMFS-step-4-4x3-124-a8b5b360990a42058fcf10816c1f4b81.jpg 750w\"\nsizes=\"750px\"\nalt=\"soup coming to a boil \"\n/\u003e\n\n \n Jen Causey / Food Styling: Margaret Monroe Dickey / Prop Styling: Josh Hoggle \n\n\n\n\n Stir orzo, lemon juice, and lemon zest into broth; add chicken. Cook until chicken and orzo are heated through, about 5 minutes. Add baby spinach; cook until spinach wilts into broth and orzo is tender, 2 to 3 minutes.\n\n \n\n\n\n\u003cimg\nsrc=\"https://www.allrecipes.com/thmb/-_e6TXV2lZdVr_cGZEEWcfsdfn8=/1500x0/filters:no_upscale():max_bytes(150000):strip_icc():format(webp)/233968-lemon-chicken-orzo-soup-DDMFS-step-5-4x3-126-8025c468e9a841388ed8264a183dba50.jpg\"\nwidth=\"4000\"\nheight=\"3000\"\nclass=\"img--noscript mntl-image mntl-image universal-image__image\"\nsrcset=\"https://www.allrecipes.com/thmb/CRXBjTMo1cmQbnSObyPtag6hzx4=/750x0/filters:no_upscale():max_bytes(150000):strip_icc():format(webp)/233968-lemon-chicken-orzo-soup-DDMFS-step-5-4x3-126-8025c468e9a841388ed8264a183dba50.jpg 750w\"\nsizes=\"750px\"\nalt=\"spinach stirred into the soup\"\n/\u003e\n\n \n Jen Causey / Food Styling: Margaret Monroe Dickey / Prop Styling: Josh Hoggle \n\n\n\n\n Ladle soup into bowls; garnish with lemon slices and Parmesan cheese.\n\n \n\n\n\n\u003cimg\nsrc=\"https://www.allrecipes.com/thmb/s_48wYuqjgBpVR7BGoi8KvHD33w=/1500x0/filters:no_upscale():max_bytes(150000):strip_icc():format(webp)/233968-lemon-chicken-orzo-soup-DDMFS-step-6-4x3-129-25dd2cc1c682477d8e7d1e35aed85f7c.jpg\"\nwidth=\"4000\"\nheight=\"3000\"\nclass=\"img--noscript mntl-image mntl-image universal-image__image\"\nsrcset=\"https://www.allrecipes.com/thmb/7lgUvVWvebpB1CDuN5_e7Yp3Jdc=/750x0/filters:no_upscale():max_bytes(150000):strip_icc():format(webp)/233968-lemon-chicken-orzo-soup-DDMFS-step-6-4x3-129-25dd2cc1c682477d8e7d1e35aed85f7c.jpg 750w\"\nsizes=\"750px\"\nalt=\"soup ladled into a small bowl\"\n/\u003e\n\n \n Jen Causey / Food Styling: Margaret Monroe Dickey / Prop Styling: Josh Hoggle \n\n\n\n\n Enjoy!\n\n \n\n\n\n\u003cimg\nsrc=\"https://www.allrecipes.com/thmb/UQ0mQZTT0JVR277_-4xOeOFkcKM=/1500x0/filters:no_upscale():max_bytes(150000):strip_icc():format(webp)/233968-lemon-chicken-orzo-soup-DDMFS-beauty-4x3-147-b050c9a6240d42458babf9296fa25289.jpg\"\nwidth=\"4000\"\nheight=\"3000\"\nclass=\"img--noscript mntl-image mntl-image universal-image__image\"\nsrcset=\"https://www.allrecipes.com/thmb/dugpJo6AdaRYbuQ1tk5KIVnc-zo=/750x0/filters:no_upscale():max_bytes(150000):strip_icc():format(webp)/233968-lemon-chicken-orzo-soup-DDMFS-beauty-4x3-147-b050c9a6240d42458babf9296fa25289.jpg 750w\"\nsizes=\"750px\"\nalt=\"looking down at a white bowl of lemon chicken orzo soup\"\n/\u003e\n\n \n Jen Causey / Food Styling: Margaret Monroe Dickey / Prop Styling: Josh Hoggle \n\n\n\n\n From the Editor\nPlease note the differences in yield and ingredient amounts when using the magazine version of this recipe.\n\n\n\n\n I Made It\n\n\n\n\n \nPrint\n\n\n\n\n\n\n\n1,084\nhome cooks made it!\n\nNutrition Facts (per serving)\n\n\n\n167\nCalories\n\n\n4g \nFat\n\n\n22g \nCarbs\n\n\n12g \nProtein\n\n\n\n\n\n \nShow Full Nutrition Label\nHide Full Nutrition Label\n\n\n\n\n\n\nNutrition Facts\n\n\n\nServings Per Recipe\n12\n\n\n\n\nCalories\n167\n\n\n\n\n\n% Daily Value *\n\n\n\nTotal Fat\n4g\n\n\n5%\n\n\n\n\nSaturated Fat\n2g\n\n\n8%\n\n\n\n\nCholesterol\n20mg\n\n\n7%\n\n\n\n\nSodium\n187mg\n\n\n8%\n\n\n\n\nTotal Carbohydrate\n22g\n\n\n8%\n\n\n\n\nDietary Fiber\n3g\n\n\n9%\n\n\n\n\nTotal Sugars\n4g\n\n\n\n\nProtein\n12g\n\n\n24%\n\n\n\n\nVitamin C\n20mg\n\n\n23%\n\n\n\n\nCalcium\n69mg\n\n\n5%\n\n\n\n\nIron\n2mg\n\n\n9%\n\n\n\n\nPotassium\n321mg\n\n\n7%\n\n\n\n\n* Percent Daily Values are based on a 2,000 calorie diet. Your daily values may be higher or lower depending on your calorie needs.\n** Nutrient information is not available for all ingredients. Amount is based on available nutrient data.\n(-) Information is not currently available for this nutrient. If you are following a medically restrictive diet, please consult your doctor or registered dietitian before preparing this recipe for personal consumption. \n\n\n\n\n\n\n\n\n\n\n\n\n\n\n\n\n\n\n\n\n\n\n\n\n\n\n\n\n \n\n\n\n\n\n\n\n\n Add Your Photo\n\n\n\n\n \nPhotos of Lemon Chicken Orzo Soup\n \n01\nof 107\n\n\n\n\n\n\n\u003cimg\nsrc=\"https://www.allrecipes.com/thmb/b-6KeGV36a8_DBUUUiPSgReqx6I=/0x512/filters:no_upscale():max_bytes(150000):strip_icc():format(webp)/233968-lemon-chicken-orzo-soup-DDMFS-beauty-4x3-147-b050c9a6240d42458babf9296fa25289.jpg\"\nwidth=\"4000\"\nheight=\"3000\"\nclass=\"img--noscript universal-image__image\"\nalt=\"looking down at a white bowl of lemon chicken orzo soup\"\n/\u003e\n\n\n\n\n\n\n\nPhoto by \nJen Causey / Food Styling: Margaret Monroe Dickey / Prop Styling: Josh Hoggle \n\n \n\n \n02\nof 107\n\n\n\n\n\n\n\n\n\n\n\nPhoto by \nPMtz19\n\n\n\n\n\n\n\n\n\n\n\n\n\n\n\n\n\n01/03/2024\n\n\n\nMight try again\nI really wanted to love this recipe but it was just ok.Unfortuately I didn't have spinach on hand so I made the recipe without it. (I didn't think it would make that big of a difference in taste). It was good but it wasn't what I had hoped it to be. I'll have to try it again next time it gets cold. \n\n \n03\nof 107\n\n\n\n\n\n\n\n\n\n\n\nPhoto by \nlutzflcat\n\n\n\n\n\n\n\n\n\n\n\n\n\n\n\n\n\n11/22/2023\nI’ve had this recipe saved for a long time, and I’m sorry that it’s taken me this long to make it. It lived up to my expectations, it’s delicious! We’re heading into soup season (even in Florida), and I can see this reappearing soon on my menu. \n\n \n04\nof 107\n\n\n\n\n\n\n\n\n\n\n\nPhoto by \nPaul Bell\n\n\n\n\n\n\n\n\n\n\n\n\n\n\n\n\n\n04/27/2022\nCame out exactly as expected, light lemon flavor. Orzo is a nice change of pace. Will make again. I heavily salted and peppered the chicken with a bit of poultry seasoning and that was enough salt/ pepper for the soup. \n\n \n05\nof 107\n\n\n\n\n\n\n\n\n\n\n\nPhoto by \nppills3\n\n\n\n\n\n\n\n\n\n\n\n\n\n\n\n\n\n02/04/2022\nAmazing recipe and we all loved it. I doubled the recipe for extras. Changes I made were to use fennel instead of onion and some green onion. Added a touch of dill as well. Great flavor. \n\n \n06\nof 107\n\n\n\n\n\n\n\n\n\n\n\nPhoto by \nBruce Lieb\n\n\n\n\n\n\n\n\n\n\n\n\n\n\n\n\n\n02/04/2022\nIt is delicious! \n\n \n07\nof 107\n\n\n\n\n\n\n\n\n\n\n\nPhoto by \nStacy in Sisters\n\n\n\n\n\n\n\n\n\n\n\n\n\n\n\n\n\n10/21/2021\nRemarkably flavorful and easy to prepare. I knew I’d have leftover soup, so I listened to other reviews and did not combine the orzo to the soup. I spooned some in the bowl and covered with the soup. \n\n \n08\nof 107\n\n\n\n\n\n\n\n\n\n\n\nPhoto by \nAndrea\n\n\n\n\n\n\n\n\n\n\n\n\n\n\n\n\n\n09/18/2021\nAbsolutely delicious! Flavor is on point!\nI cut the recipe in half. I made my own chicken broth using “Better than Boullion, and instead of fresh garlic, I used Better than Boullion Roasted Garlic. Since I was too lazy to cook chicken, I added small matzo balls that I had made yesterday! Absolute Perfection! \n\n \n09\nof 107\n\n\n\n\n\n\n\n\n\n\n\nPhoto by \nJennifer Chandler\n05/11/2021\n \n\n \n10\nof 107\n\n\n\n\n\n\n\n\n\n\n\nPhoto by \nKris W\n04/24/2021\n \n\n\n1\n\n\n2\n\n\n3\n\n\n4\n\n\n5\n\n\n\nNext\n\n\n\n\n\n\n \n\n\n\n\n\nYou’ll Also Love\n\n\n\n\n\n\u003cimg\nsrc=\"https://www.allrecipes.com/thmb/Y9vE_MVEX4ZGH69YjpndhUQ4BWs=/282x188/filters:no_upscale():max_bytes(150000):strip_icc():format(webp)/461976-4e0266a96cdc4e558279d9abe31a618e.jpg\"\nwidth=\"282\"\nheight=\"188\"\nclass=\"img--noscript card__img universal-image__image\"\n/\u003e\n\n\n\n \n\n\n\n\n\n\n\n\nMandarin Chicken Pasta Salad\n\n\n\n\n\n\n\n\n\n\n\n\n\n\n\n\n\n\n\n356\n\nRatings\n\n\n \n\n\n\n\n\n\n\u003cimg\nsrc=\"https://www.allrecipes.com/thmb/RZlGMFzYyDCxqUg2wLyaLNO0Fb0=/282x188/filters:no_upscale():max_bytes(150000):strip_icc():format(webp)/590796-d17e7c7b175b4bfb8344d4bc31eca482.jpg\"\nwidth=\"282\"\nheight=\"188\"\nclass=\"img--noscript card__img universal-image__image\"\n/\u003e\n\n\n\n \n\n\n\n\n\n\n\n\nChicken Gumbo Soup\n\n\n\n\n\n\n\n\n\n\n\n\n\n\n\n\n\n\n\n30\n\nRatings\n\n\n \n\n\n\n\n\n\n\u003cimg\nsrc=\"https://www.allrecipes.com/thmb/SOWMtW4XSa-4lLI_E19Lmu2GhhU=/282x188/filters:no_upscale():max_bytes(150000):strip_icc():format(webp)/468948-a7eab60eaede46e38936b4f35d80b967.jpg\"\nwidth=\"282\"\nheight=\"188\"\nclass=\"img--noscript card__img universal-image__image\"\n/\u003e\n\n\n\n \n\n\n\n\n\n\n\n\nAdas bil Hamod (Lebanese Lentil Lemon Soup)\n\n\n\n\n\n\n\n\n\n\n\n\n\n\n\n\n\n\n\n53\n\nRatings\n\n\n \n\n\n\n\n\n\n\u003cimg\nsrc=\"https://www.allrecipes.com/thmb/kRqJ6HRVzTZVyRRlMgs4jaRkCLk=/282x188/filters:no_upscale():max_bytes(150000):strip_icc():format(webp)/1089036-0b9b3a224a794056af91a66d281cec64.jpg\"\nwidth=\"282\"\nheight=\"188\"\nclass=\"img--noscript card__img universal-image__image\"\n/\u003e\n\n\n\n \n\n\n\n\n\n\n\n\nPeruvian Chicken Soup (Aguadito de Pollo)\n\n\n\n\n\n\n\n\n\n\n\n\n\n\n\n\n\n\n\n109\n\nRatings\n\n\n \n\n\n\n\n\n\n\u003cimg\nsrc=\"https://www.allrecipes.com/thmb/2m7gKpmhvKeUvDe9eEro181jgjA=/282x188/filters:no_upscale():max_bytes(150000):strip_icc():format(webp)/5795826-50a4cf24ce38481f9190daa45a1e8ec3.jpg\"\nwidth=\"282\"\nheight=\"188\"\nclass=\"img--noscript card__img universal-image__image\"\n/\u003e\n\n\n\n \n\n\n\n\n\n\n\n\nGreek Lemon Chicken Soup\n\n\n\n\n\n\n\n\n\n\n\n\n\n\n\n\n\n\n\n590\n\nRatings\n\n\n \n\n\n\n\n\n\n\u003cimg\nsrc=\"https://www.allrecipes.com/thmb/EFR6Z5WCk9VNwJYz9oDYds8623Q=/282x188/filters:no_upscale():max_bytes(150000):strip_icc():format(webp)/1135965-97ce2ebe073b4491ad8c03e429af6a54.jpg\"\nwidth=\"282\"\nheight=\"188\"\nclass=\"img--noscript card__img universal-image__image\"\n/\u003e\n\n\n\n \n\n\n\n\n\n\n\n\nTarragon Chicken and Rice Soup\n\n\n\n\n\n\n\n\n\n\n\n\n\n\n\n\n\n\n\n41\n\nRatings\n\n\n \n\n\n\n\n\n\n\u003cimg\nsrc=\"https://www.allrecipes.com/thmb/A6_bN_ZCUf7UH0yPp1rvD2ybenI=/282x188/filters:no_upscale():max_bytes(150000):strip_icc():format(webp)/28332-0d07cfdeab2d4a0a975f7425abdea275.jpg\"\nwidth=\"282\"\nheight=\"188\"\nclass=\"img--noscript card__img universal-image__image\"\n/\u003e\n\n\n\n \n\n\n\n\n\n\n\n\nLemon Soup\n\n\n\n\n\n\n\n\n\n\n\n\n\n\n\n\n\n\n\n56\n\nRatings\n\n\n \n\n\n\n\n\n\n\u003cimg\nsrc=\"https://www.allrecipes.com/thmb/pUDTlqDaFxGKryYEVpexl9doJnI=/282x188/filters:no_upscale():max_bytes(150000):strip_icc():format(webp)/3411910-shrimp-noodle-soup-Melanie-Cruz-4x3-1-35d31e441f894df79a915a7143b86853.jpg\"\nwidth=\"282\"\nheight=\"188\"\nclass=\"img--noscript card__img universal-image__image\"\nalt=\"close up view of Shrimp Noodle Soup in a glass bowl with a spoon\"\n/\u003e\n\n\n\n \n\n\n\n\n\n\n\n\nShrimp Noodle Soup\n\n\n\n\n\n\n\n\n\n\n\n\n\n\n\n\n\n\n\n95\n\nRatings\n\n\n \n\n\n\n\n\n\n\n\n\n\u003cimg\nsrc=\"https://www.allrecipes.com/thmb/Ywu2LdxVtBaCa3VrXVlkMBIRusk=/282x188/filters:no_upscale():max_bytes(150000):strip_icc():format(webp)/2405235-b940760e63e84b6f963f684b56f0e34c.jpg\"\nwidth=\"282\"\nheight=\"188\"\nclass=\"img--noscript card__img universal-image__image\"\n/\u003e\n\n\n\n \n\n\n\n\n\n\n\n\nChicken Piccata with Fettuccine\n\n\n\n\n\n\n\n\n\n\n\n\n\n\n\n\n\n\n\n13\n\nRatings\n\n\n \n\n\n\n\n\n\n\u003cimg\nsrc=\"https://www.allrecipes.com/thmb/tOfKDsBVZgaYXKtWgwfp7MdoxbA=/282x188/filters:no_upscale():max_bytes(150000):strip_icc():format(webp)/152227-greek-avgolemono-chicken-soup-Allrecipes-1x1-1-bc6164d50c1f4fef9165531bbedc8f0f.jpg\"\nwidth=\"282\"\nheight=\"188\"\nclass=\"img--noscript card__img universal-image__image\"\nalt=\"close up view of Greek Avgolemono Chicken Soup garnished with fresh herbs in a white bowl, served with bread\"\n/\u003e\n\n\n\n \n\n\n\n\n\n\n\n\nGreek Avgolemono Chicken Soup\n\n\n\n\n\n\n\n\n\n\n\n\n\n\n\n\n\n\n\n152\n\nRatings\n\n\n \n\n\n\n\n\n\n\u003cimg\nsrc=\"https://www.allrecipes.com/thmb/HZHjRXLjEOYNA4NaMBsTpZ96mjo=/282x188/filters:no_upscale():max_bytes(150000):strip_icc():format(webp)/218794-chicken-and-gnocchi-soup-ddmfs-3X4-0192-a7deecdd70cf4aef87c0410565f0dfd6.jpg\"\nwidth=\"282\"\nheight=\"188\"\nclass=\"img--noscript card__img universal-image__image\"\nalt=\"looking down at a large stock pot of chicken and gnocchi soup with a spoonful above\"\n/\u003e\n\n\n\n \n\n\n\n\n\n\n\n\nChicken and Gnocchi Soup\n\n\n\n\n\n\n\n\n\n\n\n\n\n\n\n\n\n\n\n1,175\n\nRatings\n\n\n \n\n\n\n\n\n\n\u003cimg\nsrc=\"https://www.allrecipes.com/thmb/jAapyYdzzeqhhrnIIldWKvaVZqk=/282x188/filters:no_upscale():max_bytes(150000):strip_icc():format(webp)/ALR-26277-lemon-cream-pasta-with-chicken-VAT-4x3-2d38451e9936482b90fb9ab40003c4cb.jpg\"\nwidth=\"282\"\nheight=\"188\"\nclass=\"img--noscript card__img universal-image__image\"\nalt=\"Creamy lemon chicken pasta served in a green bowl.\"\n/\u003e\n\n\n\n \n\n\n\n\n\n\n\n\nLemon Cream Chicken Pasta Recipe\n\n\n\n\n\n\n\n\n\n\n\n\n\n\n\n\n\n\n\n853\n\nRatings\n\n\n \n\n\n\n\n\n\n\u003cimg\nsrc=\"https://www.allrecipes.com/thmb/VSATgbC0y7I-sN0gQWzw3u7jZ5A=/282x188/filters:no_upscale():max_bytes(150000):strip_icc():format(webp)/1775233-2028be58d2294df5a0ca4447261a381a.jpg\"\nwidth=\"282\"\nheight=\"188\"\nclass=\"img--noscript card__img universal-image__image\"\n/\u003e\n\n\n\n \n\n\n\n\n\n\n\n\nSeattle's Favorite Kale Salad\n\n\n\n\n\n\n\n\n\n\n\n\n\n\n\n\n\n\n\n21\n\nRatings\n\n\n \n\n\n\n\n\n\n\u003cimg\nsrc=\"https://www.allrecipes.com/thmb/LqMjL1lpt86uLCONarZ2pIuyAcc=/282x188/filters:no_upscale():max_bytes(150000):strip_icc():format(webp)/9434470-0fcfa0e56d1848e3be2e0466b24521bd.jpg\"\nwidth=\"282\"\nheight=\"188\"\nclass=\"img--noscript card__img universal-image__image\"\n/\u003e\n\n\n\n \n\n\n\n\n\n\n\n\nThai Hot and Sour Soup\n\n\n\n\n\n\n\n\n\n\n\n\n\n\n\n\n\n\n\n65\n\nRatings\n\n\n \n\n\n\n\n\n\n\u003cimg\nsrc=\"https://www.allrecipes.com/thmb/vIQSG9ff1UWz1ZUSFzjyVMuqR2M=/282x188/filters:no_upscale():max_bytes(150000):strip_icc():format(webp)/Barley-Lime-Fiesta-Salad-91ec6ac68acb41e4840c93d430607253.jpg\"\nwidth=\"282\"\nheight=\"188\"\nclass=\"img--noscript card__img universal-image__image\"\nalt=\"Barley Lime Fiesta Salad\"\n/\u003e\n\n\n\n \n\n\n\n\n\n\n\n\nBarley Lime Fiesta Salad\n\n\n\n\n\n\n\n\n\n\n\n\n\n\n\n\n\n\n\n51\n\nRatings\n\n\n \n\n\n\n\n\n\n\u003cimg\nsrc=\"https://www.allrecipes.com/thmb/zZK8ODY6gY4DI75eSg7QCREd6Xk=/282x188/filters:no_upscale():max_bytes(150000):strip_icc():format(webp)/Thai-Chicken-Noodle-Soup-lutzflcat-1x1-1-2000-f249e053c3254193bc1bbe06059f2a15.jpg\"\nwidth=\"282\"\nheight=\"188\"\nclass=\"img--noscript card__img universal-image__image\"\nalt=\"Thai Chicken Noodle Soup\"\n/\u003e\n\n\n\n \n\n\n\n\n\n\n\n\nThai Chicken Noodle Soup\n\n\n\n\n\n\n\n\n\n\n\n\n\n\n\n\n\n\n\n31\n\nRatings\n\n\n \n\n\n\n\n \n\n\n Allrecipes\n\n\n \nNewsletters\n \n\nFollow Us\n\n\n \n\n\n \n\n \n\n\n \n\n \n\n\n \n\n \n\n\n \n\n \n\n\n \n\n \n\n\n \n\n \n\n\nDinners\nMeals\nIngredients\nOccasions\nCuisines\nKitchen Tips\nNews\nFeatures \n About Us\n \n\n Editorial Process\n \n\n Privacy Policy\n \n\n Product Vetting\n \n\n Terms of Service\n \n\n Advertise\n \n\n Careers\n \n\n Contact\n \n\n Your Privacy Choices\n  \n\n\n\n \n\n \n\n \n \n\n \n\n\n\n\n\nAllrecipes\nis part of the Dotdash Meredith publishing family.\n\n\n\n\n \n\n\nDialog Heading\n\n\n\n\n\n\n\n \n\n\n \n\n\nNewsletter Sign Up\n\n\n\n\n\n\n\n \n\n \n\n\nNewsletter Sign Up\n\n\n\n\n\n\n\n \n\n\n\n\n\n\n\n\n\n\nMntl.utilities.scriptsOnLoad(document.querySelectorAll('script[data-glb-js=\"bottom\"]'), function() {\nvar Mntl = window.Mntl || {};\nwindow.Mntl = window.Mntl || {};\nwindow.Mntl.affiliatePlugins = window.Mntl.affiliatePlugins || [];\nwindow.Mntl.affiliateLinkRewriter.setMappings( {\nDOC_ID: '6579367'\n,SITE: 'allrecipes'\n,REQUEST_ID: 'n393ed0f8cc384c949bd0b8524b52736304'\n}\n);\nwindow.Mntl.affiliatePlugins.push(window.Mntl.affiliateLinkRewriter.processLink);window.Mntl.externalizeLinks.init();(function (Mntl) {\nMntl.digioh = {\nscript: null,\nbrandId: null,\ninitialized: false,\ninit() {\nif (this.initialized) return;\nconst brandId = '47b4a4dd-ffd7-43db-8118-8002b7c15352';\nconst digiohFastActivation = 'false';\nconst lightboxJs = digiohFastActivation === 'true' ? '/lightbox_speed.js' : '/lightbox_inline.js';\n// eslint-disable-next-line prefer-template\nconst script = 'https://www.lightboxcdn.com/vendor/' + brandId + lightboxJs;\nthis.brandId = brandId;\nthis.script = script;\nthis.initialized = true;\n},\nload(callback) {\nthis.init();\nif (callback) {\nMntl.utilities.loadExternalJS({ src: this.script }, callback);\n} else {\nMntl.utilities.loadExternalJS({ src: this.script });\n}\n}\n};\n})(window.Mntl || {});\nMntl.digiohTimerDelay = parseFloat('0') * 1000;\n(function(Mntl) {\nconst setup = {\"clickToInitialize\":false,\"skin\":{\"name\":\"mantle\"},\"mute\":true,\"advertising\":{\"client\":\"googima\",\"vpaidmode\":\"enabled\",\"rules\":{\"frequency\":1},\"forceNonLinearFullSlot\":true,\"vpaidcontrols\":true,\"autoplayadsmuted\":true},\"autostart\":true,\"mediaid\":\"WYlh2XHC\",\"preload\":\"metadata\",\"autoPause\":{\"pauseAds\":true,\"viewability\":true},\"aspectratio\":\"16:9\",\"pauseotherplayers\":\"true\",\"cast\":{},\"recsPlaylistId\":\"ZBQZ5egR\",\"width\":\"100%\"};\n// JW player requires `playlist` to be populated for contextual playlists\nsetup.playlist = setup.playlistUrl;\nconst isImmediateAutoplay = true;\nconst playInView = 30;\nconst encodedPageURL = encodeURIComponent(window.location);\nconst domain = Mntl.utilities.getDomain();\nconst iuPath = '/' + Mntl.GPT.getDfpId() + '/ddm.' + domain.replace('.com', '.video') + (Mntl.GPT.isMobile() ? '.mob' : '');\nfunction formatAdSizeArray(sizeArr) {\nreturn sizeArr.map(function(sz) {\nreturn sz.join('x');\n}).join('|');\n}\n// Assign a randomly-generated, eight character, alpha-numeric value to this property.\nsetup.advertising.adscheduleid = Math.random().toString(36).substr(2,8);\n// muid - used for audience targeting\nsetup.advertising.ppid = '0b28e3a9-d303-446b-815f-bd59ceedcb0a';\nlet custParams = '';\ncustParams += '\u0026' + encodeURIComponent('slot') + '=' + encodeURIComponent('primary');\nconst inFocus = window \u0026\u0026 window.document \u0026\u0026 window.document.hasFocus();\nconst durationParams = Mntl.JWPlayer.getDurationParams(59627, false);\ncustParams += '\u0026ttid=' + setup.mediaid;\ncustParams += '\u0026play=' + Mntl.JWPlayer.getCustomPlayValue(setup.autostart, isImmediateAutoplay, playInView);\ncustParams += '\u0026in_focus=' + inFocus;\ncustParams += '\u0026videoduration=' + durationParams.duration;\ncustParams += '\u0026duration_over=' + durationParams.durationOver;\ncustParams += '\u0026duration_under=' + durationParams.durationUnder;\ncustParams += '\u0026frnch=' + 'Community Recipes';\ncustParams += '\u0026tags=' + encodeURIComponent(\"Allrecipes,allrecipes.com,video,16x9,3play_asr,food,cooking,recipe,how to,how to make,community recipes,lemon chicken orzo soup,baby spinach,veggies,vegetables,aromatics,celery,carrots,onions,stovetop,stove cooking,soup,stew,simmer,boil,lunch,dinner,comfort food,comforting,healthy,poultry,chicken,pasta,orzo\");\nsetup.advertising.schedule = [{\n\"offset\": \"pre\",\n\"tag\": [\n'https://securepubads.g.doubleclick.net/gampad/ads?',\n'sz=',\nformatAdSizeArray([[640, 360]]),\n'\u0026iu=',\niuPath,\n'\u0026env=vp\u0026hl=en\u0026gdfp_req=1\u0026impl=s\u0026output=xml_vast2\u0026unviewed_position_start=1\u0026lid=',\n'\u0026url=',\nencodedPageURL,\n'\u0026description_url=',\nencodedPageURL,\n'\u0026correlator=',\nMath.floor(Date.now() / 1000),\n'\u0026cust_params=',\nMntl.GPT.serializeAllTargeting(),\nencodeURIComponent(custParams),\n'\u0026ad_rule=1'\n].join('')\n}];\nMntl.JWPlayer.init({\naccountKey: \"oxY0/BqWBX09BISmLN4/xuTz4IdZy713Cdjj4GyHOiYCUCyJ\",\nadSizes: [[640, 360]],\ndefer: true,\ndeferOnRFDS: true,\ndisplayMode: \"none\",\ndivId: \"article__primary-video-jw_1-0\",\nenableBiddingWithTCData: false,\nenableTVPEngagementBtns: false,\neventCategoryType: \"Primary\",\nintersectionMargin: \"250px\",\nisImmediateAutoplay: isImmediateAutoplay,\nisImmediateStickyDisabled: false,\nisIntersectionDisabled: true,\nisMobileAdhesive: false,\nisBroadVideo: false,\nisPlaylist: false,\nmediaSize: 1080,\nplayerId: \"aiy6MJ4O\",\nplayInView: playInView,\nshowCaptions: true,\nslot: \"primary\",\nrtbVideoConfig: {\"maxduration\":60,\"minduration\":0,\"plcmt\":2},\nuseDynamicVideoSizes: true,\nskipExistingMediaContent: false,\nstickyplay: true,\nuseMotionThumbnails: false\n}, setup );\n}(window.Mntl || {}));\n(function(Mntl) {\nMntl.Tooltip.init({\ndefaultPositionX: \"auto\",\ndefaultPositionY: \"auto\"\n});\n})(window.Mntl || {});\n});\n\n\nBy clicking “Accept All Cookies”, you agree to the storing of cookies on your device to enhance site navigation, analyze site usage, and assist in our marketing efforts. Cookies Settings Accept All Cookies",
  "url": "https://www.allrecipes.com/recipe/233968/lemon-chicken-orzo-soup",
  "image": "https://www.allrecipes.com/thmb/1fq_pct3xSR4hEqxRFPVjY_JWIA=/1500x0/filters:no_upscale():max_bytes(150000):strip_icc()/233968-lemon-chicken-orzo-soup-DDMFS-beauty-2x1-152-126ac035249049da9fd812c6a52fb046.jpg",
  "name": "ReneePaj",
  "prep_time": "20 min",
  "cook_time": "30 min",
  "total_time": "50 min",
  "calories": "167",
  "servings": "",
  "ingredients": "Orzo: Boil and drain 8 ounces of orzo pasta.;Oil: Cook the vegetables in a teaspoon of olive oil.;Vegetables: This veggie-packed soup features onion, carrots, celery, and baby spinach.;Seasonings: Season the soup with fresh garlic, dried thyme, dried oregano, salt and pepper, and a bay leaf.;Broth: Use store-bought chicken broth or make your own at home.;Lemon: You’ll need fresh lemon juice, the zest of a lemon, and lemon slices for garnish.;Chicken: This soup is a great way to use leftover cooked chicken or rotisserie chicken.;Parmesan: Parmesan cheese is optional, but it’s a great finishing touch.",
  "instructions": "Boil, drain, and rinse the orzo.;Cook the veggies, then stir in the garlic. Add the seasonings.;Add the broth, bring to a boil, reduce the heat, and simmer until the veggies are tender.;Stir in the orzo, lemon juice, lemon zest, and chicken.;Cook until chicken and orzo are heated through, then stir in the spinach.;Cook until spinach wilts into broth and orzo is tender.;Gather the ingredients. \u003cimg src=\"https://www.allrecipes.com/thmb/mWlannXA_LqZRJv-nQqHz_nyS0w=/1500x0/filters:no_upscale():max_bytes(150000):strip_icc():format(webp)/233968-lemon-chicken-orzo-soup-DDMFS-step-1-4x3-119-009039814fb5476ea2cc81367950411a.jpg\" width=\"4000\" height=\"3000\" class=\"img--noscript mntl-image mntl-image universal-image__image\" srcset=\"https://www.allrecipes.com/thmb/YTCFa9Q7kndzNKUXDOLTySprESM=/750x0/filters:no_upscale():max_bytes(150000):strip_icc():format(webp)/233968-lemon-chicken-orzo-soup-DDMFS-step-1-4x3-119-009039814fb5476ea2cc81367950411a.jpg 750w\" sizes=\"750px\" alt=\"ingredients gathered in bowls to make lemon chicken orzo soup\" /\u003e Jen Causey / Food Styling: Margaret Monroe Dickey / Prop Styling: Josh Hoggle;Bring a large pot of lightly salted water to a boil. Stir in orzo and return to a boil. Cook pasta uncovered until partially cooked through but not yet soft, about 5 minutes; drain and rinse with cold water until cooled completely. \u003cimg src=\"https://www.allrecipes.com/thmb/_rVw4q5q53HvfSxAg7IdjQ9vGKE=/1500x0/filters:no_upscale():max_bytes(150000):strip_icc():format(webp)/233968-lemon-chicken-orzo-soup-DDMFS-step-2-4x3-127-63dc0a52e3ec44e2a9658fdb77a592b6.jpg\" width=\"4000\" height=\"3000\" class=\"img--noscript mntl-image mntl-image universal-image__image\" srcset=\"https://www.allrecipes.com/thmb/Af6ir2MsjypNumqVK7_y_Xtnwxk=/750x0/filters:no_upscale():max_bytes(150000):strip_icc():format(webp)/233968-lemon-chicken-orzo-soup-DDMFS-step-2-4x3-127-63dc0a52e3ec44e2a9658fdb77a592b6.jpg 750w\" sizes=\"750px\" alt=\"orzo cooked and draining in a colander \" /\u003e Jen Causey / Food Styling: Margaret Monroe Dickey / Prop Styling: Josh Hoggle;Meanwhile, heat olive oil in a large pot over medium heat. Add carrots, celery, and onion; cook and stir until vegetables begin to soften and onion becomes translucent, about 5 minutes. Add garlic; cook and stir until fragrant, about 1 minute more. Season mixture with thyme, oregano, bay leaf, salt, and black pepper; continue cooking another 30 seconds before pouring chicken broth into the pot. \u003cimg src=\"https://www.allrecipes.com/thmb/MefU-Bb51cHAgghYaXq1yIl9TnE=/1500x0/filters:no_upscale():max_bytes(150000):strip_icc():format(webp)/233968-lemon-chicken-orzo-soup-DDMFS-step-3-4x3-121-410e3b2e733a4382a665cb6d015d001c.jpg\" width=\"4000\" height=\"3000\" class=\"img--noscript mntl-image mntl-image universal-image__image\" srcset=\"https://www.allrecipes.com/thmb/8FU7Bnuwzi0iYrU74dNVepKl11Y=/750x0/filters:no_upscale():max_bytes(150000):strip_icc():format(webp)/233968-lemon-chicken-orzo-soup-DDMFS-step-3-4x3-121-410e3b2e733a4382a665cb6d015d001c.jpg 750w\" sizes=\"750px\" alt=\"ingredients added to a stock pot\" /\u003e Jen Causey / Food Styling: Margaret Monroe Dickey / Prop Styling: Josh Hoggle;Bring broth to a boil. Partially cover the pot, reduce heat to medium-low, and simmer until vegetables are just tender, about 10 minutes. \u003cimg src=\"https://www.allrecipes.com/thmb/1bl2TKxmCeFh_Sitz7mNbb9NmjE=/1500x0/filters:no_upscale():max_bytes(150000):strip_icc():format(webp)/233968-lemon-chicken-orzo-soup-DDMFS-step-4-4x3-124-a8b5b360990a42058fcf10816c1f4b81.jpg\" width=\"4000\" height=\"3000\" class=\"img--noscript mntl-image mntl-image universal-image__image\" srcset=\"https://www.allrecipes.com/thmb/u4NJGw9RSasT5eM3Jlx4fxDS9Xs=/750x0/filters:no_upscale():max_bytes(150000):strip_icc():format(webp)/233968-lemon-chicken-orzo-soup-DDMFS-step-4-4x3-124-a8b5b360990a42058fcf10816c1f4b81.jpg 750w\" sizes=\"750px\" alt=\"soup coming to a boil \" /\u003e Jen Causey / Food Styling: Margaret Monroe Dickey / Prop Styling: Josh Hoggle;Stir orzo, lemon juice, and lemon zest into broth; add chicken. Cook until chicken and orzo are heated through, about 5 minutes. Add baby spinach; cook until spinach wilts into broth and orzo is tender, 2 to 3 minutes. \u003cimg src=\"https://www.allrecipes.com/thmb/-_e6TXV2lZdVr_cGZEEWcfsdfn8=/1500x0/filters:no_upscale():max_bytes(150000):strip_icc():format(webp)/233968-lemon-chicken-orzo-soup-DDMFS-step-5-4x3-126-8025c468e9a841388ed8264a183dba50.jpg\" width=\"4000\" height=\"3000\" class=\"img--noscript mntl-image mntl-image universal-image__image\" srcset=\"https://www.allrecipes.com/thmb/CRXBjTMo1cmQbnSObyPtag6hzx4=/750x0/filters:no_upscale():max_bytes(150000):strip_icc():format(webp)/233968-lemon-chicken-orzo-soup-DDMFS-step-5-4x3-126-8025c468e9a841388ed8264a183dba50.jpg 750w\" sizes=\"750px\" alt=\"spinach stirred into the soup\" /\u003e Jen Causey / Food Styling: Margaret Monroe Dickey / Prop Styling: Josh Hoggle;Ladle soup into bowls; garnish with lemon slices and Parmesan cheese. \u003cimg src=\"https://www.allrecipes.com/thmb/s_48wYuqjgBpVR7BGoi8KvHD33w=/1500x0/filters:no_upscale():max_bytes(150000):strip_icc():format(webp)/233968-lemon-chicken-orzo-soup-DDMFS-step-6-4x3-129-25dd2cc1c682477d8e7d1e35aed85f7c.jpg\" width=\"4000\" height=\"3000\" class=\"img--noscript mntl-image mntl-image universal-image__image\" srcset=\"https://www.allrecipes.com/thmb/7lgUvVWvebpB1CDuN5_e7Yp3Jdc=/750x0/filters:no_upscale():max_bytes(150000):strip_icc():format(webp)/233968-lemon-chicken-orzo-soup-DDMFS-step-6-4x3-129-25dd2cc1c682477d8e7d1e35aed85f7c.jpg 750w\" sizes=\"750px\" alt=\"soup ladled into a small bowl\" /\u003e Jen Causey / Food Styling: Margaret Monroe Dickey / Prop Styling: Josh Hoggle;Enjoy! \u003cimg src=\"https://www.allrecipes.com/thmb/UQ0mQZTT0JVR277_-4xOeOFkcKM=/1500x0/filters:no_upscale():max_bytes(150000):strip_icc():format(webp)/233968-lemon-chicken-orzo-soup-DDMFS-beauty-4x3-147-b050c9a6240d42458babf9296fa25289.jpg\" width=\"4000\" height=\"3000\" class=\"img--noscript mntl-image mntl-image universal-image__image\" srcset=\"https://www.allrecipes.com/thmb/dugpJo6AdaRYbuQ1tk5KIVnc-zo=/750x0/filters:no_upscale():max_bytes(150000):strip_icc():format(webp)/233968-lemon-chicken-orzo-soup-DDMFS-beauty-4x3-147-b050c9a6240d42458babf9296fa25289.jpg 750w\" sizes=\"750px\" alt=\"looking down at a white bowl of lemon chicken orzo soup\" /\u003e Jen Causey / Food Styling: Margaret Monroe Dickey / Prop Styling: Josh Hoggle",
  "source_site": "www.allrecipes.com",
  "crawl_date": "2025-04-26T00:16:48.6362968-04:00"
}