{
  "id": "Blgtj_JNR",
  "title": "Brownie Cupcakes with Hazelnut Buttercream",
  "description": "These easy brownies are loaded with chopped hazelnuts, then they're topped with swirls of creamy chocolate-hazelnut frosting.",
  "body": "​ \n\n \n\n \n\n \n\n \n\n \n\n \n\n \n\n \n\n \n\n \n\n \n\n \n\n \n\n \n\n \n\n \n\n \n\n \n\n \n\n \n\n \n\n \n\n \n\n \n\n \n\n \n\n\n\n\n\u003ciframe src=\"//www.googletagmanager.com/ns.html?id=GTM-P3X3VT7\" height=\"0\" width=\"0\" style=\"display:none;visibility:hidden\"\u003e\u003c/iframe\u003e\n\nSkip to content\n\n\n\n\n\n\n\n\n\n\n\n\n\n\n Allrecipes\n\n\n \n \n\n\n\n\n\n\n \n\n\n\n\n\n\nSearch\n\n\n\n\n\n\n\n\n\n\n\n\n\n \n\n\n\nPlease fill out this field.\n\n\n\n\n\n\nSearch the site\n\n\n\n\n\n\n\n\n \n\n\n\nPlease fill out this field.\n\n\n\n\n\n \n\n\n\nLog In\n\n \n\n\nMy Account\n\n\n\n\n\n\n\n My Profile\n \n\n Add a Recipe\n \n\n Saved Recipes \u0026 Collections\n \n\n Account Settings\n \n\n Help\n \n\n Log Out\n \n\n\n\n\n\nMagazine\n\n\n\n\n\n\n\n Subscribe\n \n\n Manage Your Subscription\n \n\n Give a Gift Subscription\n \n\n Get Help\n \n\n\n\nNewsletters\n\n\n Sweepstakes\n \n\n\n\n\n\n\n\n\n\n\n\n\n\n\n\n\n\n\n\n\n\n Allrecipes\n\n\n \n\n\n\n\n\nSearch\n\n\n\n\n\n\n\n\n \n\n\n\nPlease fill out this field.\n\n\n\n\n\n\nDinners\n\n\n\n\n\n\n\n\n\n\n\nDinners\n\n\n\n 5-Ingredient Dinners\n \n\n One-Pot Meals\n \n\n Quick \u0026 Easy\n \n\n 30-Minute Meals\n \n\n Family Dinners\n \n\n Soups, Stews \u0026 Chili\n \n\n Comfort Food\n \n\n Main Dishes\n \n\n Sheet Pan Dinners\n \n\n View All\n \n\n\n\n\n\nMeals\n\n\n\n\n\n\n\n\n\n\n\nMeals\n\n\n\n Breakfast \u0026 Brunch\n \n\n Lunch\n \n\n Healthy\n \n\n Appetizers \u0026 Snacks\n \n\n Salads\n \n\n Side Dishes\n \n\n Soups\n \n\n Bread\n \n\n Drinks\n \n\n Desserts\n \n\n View All\n \n\n\n\n\n\nIngredients\n\n\n\n\n\n\n\n\n\n\n\nIngredients\n\n\n\n Chicken\n \n\n Beef\n \n\n Pork\n \n\n Seafood\n \n\n Pasta\n \n\n Fruits\n \n\n Vegetables\n \n\n View All\n \n\n\n\n\n\nOccasions\n\n\n\n\n\n\n\n\n\n\n\nOccasions\n\n\n\n Kentucky Derby Recipes\n \n\n Cinco de Mayo Recipes\n \n\n Mother's Day Recipes\n \n\n Memorial Day Recipes\n \n\n View All\n \n\n\n\n\n\nCuisines\n\n\n\n\n\n\n\n\n\n\n\nCuisines\n\n\n\n Mexican\n \n\n Italian\n \n\n Chinese\n \n\n Indian\n \n\n German\n \n\n Greek\n \n\n Filipino\n \n\n Japanese\n \n\n View All\n \n\n\n\n\n\nKitchen Tips\n\n\n\n\n\n\n\n\n\n\n\nKitchen Tips\n\n\n\n Instant Pot\n \n\n Air Fryer\n \n\n Slow Cooker\n \n\n Our Favorite Products\n \n\n BBQ \u0026 Grilling\n \n\n Cooking by Equipment\n \n\n Ingredient Substitutions\n \n\n View All\n \n\n\n\n\n\nNews\n\n\n\n\n\n\n\n\n\n\n\nNews\n\n\n\n Celebrity \u0026 Entertainment\n \n\n Fast Food\n \n\n Grocery\n \n\n Recalls\n \n\n Trends\n \n\n View All\n \n\n\n\n\n\nFeatures\n\n\n\n\n\n\n\n\n\n\n\nFeatures\n\n\n\n Dinner Fix\n \n\n Sweet Spot\n \n\n In the Kitchen\n \n\n\n\n\n\nAbout Us\n\n\n\n\n\n\n\n\n\n\n\nAbout Us\n\n\n\n About Allrecipes\n \n\n Allstars\n \n\n How to Add a Recipe\n \n\n\n\n\n GET THE MAGAZINE\n \n\n \n\n\n\n\n\n\n\n \n\n\n\nLog In\n\n \n\n\nMy Account\n\n\n\n\n\n\n\n\n\n\n\nMy Account\n\n\n\n My Profile\n \n\n Add a Recipe\n \n\n Saved Recipes \u0026 Collections\n \n\n Account Settings\n \n\n Help\n \n\n Log Out\n \n\n\n\n\n\nMagazine\n\n\n\n\n\n\n\n\n\n\n\nMagazine\n\n\n\n Subscribe\n \n\n Manage Your Subscription\n \n\n Give a Gift Subscription\n \n\n Get Help\n \n\n\n\nNewsletters\n\n\n Sweepstakes\n \n\n\n\n\n\n\n\n\n\n\n\n\n\nFollow Us\n\n\n \n\n\n \n\n \n\n\n \n\n \n\n\n \n\n \n\n\n \n\n \n\n\n \n\n \n\n\n \n\n\n \n\n\n\n\n Dinners\n\n\n\n 5-Ingredient Dinners\n \n\n One-Pot Meals\n \n\n Quick \u0026 Easy\n \n\n 30-Minute Meals\n \n\n Family Dinners\n \n\n Soups, Stews \u0026 Chili\n \n\n Comfort Food\n \n\n Main Dishes\n \n\n Sheet Pan Dinners\n \n\n View All\n \n\n\n\n Meals\n\n\n\n Breakfast \u0026 Brunch\n \n\n Lunch\n \n\n Healthy\n \n\n Appetizers \u0026 Snacks\n \n\n Salads\n \n\n Side Dishes\n \n\n Soups\n \n\n Bread\n \n\n Drinks\n \n\n Desserts\n \n\n View All\n \n\n\n\n Ingredients\n\n\n\n Chicken\n \n\n Beef\n \n\n Pork\n \n\n Seafood\n \n\n Pasta\n \n\n Fruits\n \n\n Vegetables\n \n\n View All\n \n\n\n\n Occasions\n\n\n\n Kentucky Derby Recipes\n \n\n Cinco de Mayo Recipes\n \n\n Mother's Day Recipes\n \n\n Memorial Day Recipes\n \n\n View All\n \n\n\n\n Cuisines\n\n\n\n Mexican\n \n\n Italian\n \n\n Chinese\n \n\n Indian\n \n\n German\n \n\n Greek\n \n\n Filipino\n \n\n Japanese\n \n\n View All\n \n\n\n\n Kitchen Tips\n\n\n\n Instant Pot\n \n\n Air Fryer\n \n\n Slow Cooker\n \n\n Our Favorite Products\n \n\n BBQ \u0026 Grilling\n \n\n Cooking by Equipment\n \n\n Ingredient Substitutions\n \n\n View All\n \n\n\n\n News\n\n\n\n Celebrity \u0026 Entertainment\n \n\n Fast Food\n \n\n Grocery\n \n\n Recalls\n \n\n Trends\n \n\n View All\n \n\n\n\n Features\n\n\n\n Dinner Fix\n \n\n Sweet Spot\n \n\n In the Kitchen\n \n\n\n\n\n\n About Us\n\n\n\n The Allrecipes Allstars\n \n\n How to Add a Recipe\n \n\n\nGET THE MAGAZINE\n\n\n\n\n\n\n\nRecipes\n\n\n\nIngredients\n\n\n\nNuts and Seed Recipes\n\n\n\nHazelnut Recipes\n\nBrownie Cupcakes with Hazelnut Buttercream\n\n\n\n\n\n\n\n\n\n\n\n\n\n\n\n\n\n4.5\n(15)\n9 Reviews\n6 Photos\nThese easy brownies are loaded with chopped hazelnuts, then they're topped with swirls of creamy chocolate-hazelnut frosting.\n\nSubmitted by\nJif® Hazelnut\n\nUpdated on August 22, 2022\n\n \n \nSave\n\n\n\n\n\n\n\n\nRate\n\n\n\n\n\n \nPrint\n\n\n\n\n\n\n\n\n\n\nShare\n\n\n\n\n\n \n\n\n\n\n\n\n\n\n\n\n\n\n\n\n\n\n\n\n\n\n\n\n\n\n\n\n\n\n \n\n\n\n\nClose\n\n\n\n \n\n\n\n\u003cimg\nsrc=\"https://www.allrecipes.com/thmb/mBHDk-yGryW4otDGWzQsZmY2Swk=/1500x0/filters:no_upscale():max_bytes(150000):strip_icc():format(webp)/986374-a45129acb1804dd9bac9590877a4818b.jpg\"\nwidth=\"250\"\nheight=\"250\"\nclass=\"loaded primary-img--noscript primary-image__image mntl-primary-image--blurry\"\nsrcset=\"https://www.allrecipes.com/thmb/CYtPQxgCt6paTLq0g9O9cqsrZVo=/750x0/filters:no_upscale():max_bytes(150000):strip_icc():format(webp)/986374-a45129acb1804dd9bac9590877a4818b.jpg 750w\"\nsizes=\"750px\"\n/\u003e\n\n \n\n Add Photo\n\n\n\n\n6\n\n\n\n6\n\n\n\n6\n\n\n\n6\n\n\n\n \n\nPrep Time:\n15 mins\n\n\nCook Time:\n35 mins\n\n\nTotal Time:\n50 mins\n\n\nServings:\n12 \n\n\nYield:\n12 servings\n\n\nJump to Nutrition Facts\n\n\n\n\n\n \n\n\n\nCook Mode\n(Keep screen awake)\n\nIngredients\n Brownies:\n\n\n1 (19.5 ounce) box Pillsbury® Family Size Chocolate Fudge Brownie Mix\n\n\n½ cup Crisco® Pure Vegetable Oil\n\n\n¼ cup water\n\n\n2  large eggs\n\n\n½ cup chopped hazelnuts, plus\n\n\n  additional chopped hazelnuts, for garnish\n\n\nHazelnut Frosting:\n\n\n¼ cup Crisco® All-Vegetable Shortening\n\n\n¼ cup butter, softened\n\n\n⅓ cup Jif® Chocolate Flavored Hazelnut Spread\n\n\n1 ¼ cups powdered sugar\n\n\n½ teaspoon vanilla extract\n\n\n⅛ teaspoon salt\n\n\n1 tablespoon milk, or more as needed\n\n\n\nDirections\n\n\n Heat oven to 350 degrees F. Line 12 muffin cups with paper baking cups. Prepare brownie mix according to package directions using oil, water and eggs. Stir in 1/2 cup of chopped hazelnuts. Fill baking cups 3/4 full.\n\n\n\n\n Bake 30 to 32 minutes or until centers are set. Cool 2 minutes. Remove from pan. Cool completely on wire racks.\n\n\n\n\n For Frosting: Beat shortening, butter and chocolate hazelnut spread in a large bowl, with an electric mixer on medium speed until smooth. Add powdered sugar, vanilla, salt and 1 tablespoon of milk. Beat slowly until combined. Beat on high, 3 to 5 minutes, adding an additional 1 tablespoon milk at a time until desired consistency is achieved.\n\n\n\n\n Frost cupcakes by placing frosting into corner of resealable plastic bag. Cut 1/2-inch off corner of bag. Starting at outside edge, work in circular motion to build up frosting moving towards center, creating a swirl effect. Sprinkle with reserved chopped hazelnuts.\n\n\n\n\n I Made It\n\n\n\n\n \nPrint\n\n\n\n\n\n\n\n26\nhome cooks made it!\n\nNutrition Facts (per serving)\n\n\n\n483\nCalories\n\n\n29g \nFat\n\n\n57g \nCarbs\n\n\n4g \nProtein\n\n\n\n\n\n \nShow Full Nutrition Label\nHide Full Nutrition Label\n\n\n\n\n\n\nNutrition Facts\n\n\n\nServings Per Recipe\n12\n\n\n\n\nCalories\n483\n\n\n\n\n\n% Daily Value *\n\n\n\nTotal Fat\n29g\n\n\n37%\n\n\n\n\nSaturated Fat\n6g\n\n\n29%\n\n\n\n\nCholesterol\n41mg\n\n\n14%\n\n\n\n\nSodium\n214mg\n\n\n9%\n\n\n\n\nTotal Carbohydrate\n57g\n\n\n21%\n\n\n\n\nDietary Fiber\n1g\n\n\n4%\n\n\n\n\nTotal Sugars\n13g\n\n\n\n\nProtein\n4g\n\n\n8%\n\n\n\n\nVitamin C\n0mg\n\n\n0%\n\n\n\n\nCalcium\n14mg\n\n\n1%\n\n\n\n\nIron\n0mg\n\n\n2%\n\n\n\n\nPotassium\n52mg\n\n\n1%\n\n\n\n\n* Percent Daily Values are based on a 2,000 calorie diet. Your daily values may be higher or lower depending on your calorie needs.\n** Nutrient information is not available for all ingredients. Amount is based on available nutrient data.\n(-) Information is not currently available for this nutrient. If you are following a medically restrictive diet, please consult your doctor or registered dietitian before preparing this recipe for personal consumption. \n\n\n\n\n\n\n\n\n\n\n\n\n\n\n\n\n\n\n\n\n\n\n\n\n\n\n\n\n \n\n\n\n\n\n\n\n\n Add Your Photo\n\n\n\n\n \nPhotos of Brownie Cupcakes with Hazelnut Buttercream\n \n01\nof 06\n\n\n\n\n\n\n\n\n\nPhoto by \nAllrecipes Member\n\n \n\n \n02\nof 06\n\n\n\n\n\n\n\n\n\n\n\nPhoto by \nbrittnic99\n04/10/2017\n \n\n \n03\nof 06\n\n\n\n\n\n\n\n\n\n\n\nPhoto by \nJoanna Hunter\n09/28/2016\n \n\n \n04\nof 06\n\n\n\n\n\n\n\n\n\n\n\nPhoto by \nbrookeroni\n\n\n\n\n\n\n\n\n\n\n\n\n\n\n\n\n\n04/06/2016\nfrosting is good but missing a kick. I'll try adding more nutella next time. the brownies overpower the frosting and it really can't be detected. may be better with a cupcake but with a brownie it is not flavorful enough. \n\n \n05\nof 06\n\n\n\n\n\n\n\n\n\n\n\nPhoto by \nLindsay Anderson\n08/20/2014\n \n\n\n1\n\n\n \n\n\n\n\n\nYou’ll Also Love\n\n\n\n\n\n\u003cimg\nsrc=\"https://www.allrecipes.com/thmb/m1k3s5OBSYkauYfDBauaynKAzUs=/282x188/filters:no_upscale():max_bytes(150000):strip_icc():format(webp)/1245928-5b3a3fa01aa249febacc33fd306f9116.jpg\"\nwidth=\"282\"\nheight=\"188\"\nclass=\"img--noscript card__img universal-image__image\"\n/\u003e\n\n\n\n \n\n\n\n\n\n\n\n\nChocolate-Orange Cupcakes with Pistachio Buttercream\n\n\n\n\n\n\n\n\n\n\n\n\n\n\n\n\n\n\n\n7\n\nRatings\n\n\n \n\n\n\n\n\n\n\u003cimg\nsrc=\"https://www.allrecipes.com/thmb/ZZA-s2kaZkkvavdp96TeDVUzEWA=/282x188/filters:no_upscale():max_bytes(150000):strip_icc():format(webp)/6443534-381cb11257b24e26b4c967448e1088fe.jpg\"\nwidth=\"282\"\nheight=\"188\"\nclass=\"img--noscript card__img universal-image__image\"\n/\u003e\n\n\n\n \n\n\n\n\n\n\n\n\nChocolate Cupcakes with Cream Cheese-Oreo-Buttercream Frosting\n\n\n\n\n\n\n\n\n\n\n\n\n\n\n\n\n\n\n\n8\n\nRatings\n\n\n \n\n\n\n\n\n\n\u003cimg\nsrc=\"https://www.allrecipes.com/thmb/6P0sTa8Ce65yXbrgxYixCneMxTI=/282x188/filters:no_upscale():max_bytes(150000):strip_icc():format(webp)/5511095-be9807b4cc29415f837436b6d409ec0b.jpg\"\nwidth=\"282\"\nheight=\"188\"\nclass=\"img--noscript card__img universal-image__image\"\n/\u003e\n\n\n\n \n\n\n\n\n\n\n\n\nLemon Cupcake with Blackberry Buttercream\n\n\n\n\n\n\n\n\n\n\n\n\n\n\n\n\n\n\n\n305\n\nRatings\n\n\n \n\n\n\n\n\n\n\u003cimg\nsrc=\"https://www.allrecipes.com/thmb/W4Scp1A9Tg3UyIUFtNSSRwBBlYA=/282x188/filters:no_upscale():max_bytes(150000):strip_icc():format(webp)/662460-cinco-de-chili-chocolate-cupcakes-with-chili-cream-cheese-frosting-CookinBug-4x3-1-f08f8549de94484e907d62114c38b8d6.jpg\"\nwidth=\"282\"\nheight=\"188\"\nclass=\"img--noscript card__img universal-image__image\"\nalt=\"close up view of Cinco de Chili Chocolate Cupcakes with Chili Cream Cheese Frosting, garnished with red chili peppers on a white platter\"\n/\u003e\n\n\n\n \n\n\n\n\n\n\n\n\nCinco de Chili Chocolate Cupcakes with Chili Cream Cheese Frosting\n\n\n\n\n\n\n\n\n\n\n\n\n\n\n\n\n\n\n\n120\n\nRatings\n\n\n \n\n\n\n\n\n\n\u003cimg\nsrc=\"https://www.allrecipes.com/thmb/VPU7sbGKqNP2PbdPO4hTT5lSu6E=/282x188/filters:no_upscale():max_bytes(150000):strip_icc():format(webp)/1645318150DSC_1989203-2000-705baece70d24b55a829fef1a707644a.jpg\"\nwidth=\"282\"\nheight=\"188\"\nclass=\"img--noscript card__img universal-image__image\"\nalt=\"1645318150DSC_1989203.JPG\"\n/\u003e\n\n\n\n \n\n\n\n\n\n\n\n\nLemon-Blueberry Cupcakes with Blueberry-Lemon Buttercream Frosting\n\n\n\n\n\n\n\n\n\n\n\n\n\n\n\n\n\n\n\n6\n\nRatings\n\n\n \n\n\n\n\n\n\n\u003cimg\nsrc=\"https://www.allrecipes.com/thmb/K8xJdOynlHZNfX-tk2pTj2bkX4E=/282x188/filters:no_upscale():max_bytes(150000):strip_icc():format(webp)/852259-411890ca601943b0929ec5ec258dad3f.jpg\"\nwidth=\"282\"\nheight=\"188\"\nclass=\"img--noscript card__img universal-image__image\"\n/\u003e\n\n\n\n \n\n\n\n\n\n\n\n\nSwiss Hazelnut Taler\n\n\n\n\n\n\n\n\n\n\n\n\n\n\n\n\n\n\n\n2\n\nRatings\n\n\n \n\n\n\n\n\n\n\u003cimg\nsrc=\"https://www.allrecipes.com/thmb/_5VIgaW0pGQxewVfiXmc9kBBIG4=/282x188/filters:no_upscale():max_bytes(150000):strip_icc():format(webp)/4557731-ba47f4f47ec2425eaae772a1f66c388b.jpg\"\nwidth=\"282\"\nheight=\"188\"\nclass=\"img--noscript card__img universal-image__image\"\n/\u003e\n\n\n\n \n\n\n\n\n\n\n\n\nChristmas Santa Cupcakes\n\n\n\n\n\n\n\n\n\n\n\n\n\n\n\n\n\n\n\n4\n\nRatings\n\n\n \n\n\n\n\n\n\n\u003cimg\nsrc=\"https://www.allrecipes.com/thmb/TmybgvWDp-EgelL0lzeZU2foyns=/282x188/filters:no_upscale():max_bytes(150000):strip_icc():format(webp)/734465-76bb57ac3bc54d6a9b71ae7018d9ac26.jpg\"\nwidth=\"282\"\nheight=\"188\"\nclass=\"img--noscript card__img universal-image__image\"\n/\u003e\n\n\n\n \n\n\n\n\n\n\n\n\nGingerbread Cupcakes with Cream Cheese Frosting\n\n\n\n\n\n\n\n\n\n\n\n\n\n\n\n\n\n\n\n149\n\nRatings\n\n\n \n\n\n\n\n\n\n\n\n\n\u003cimg\nsrc=\"https://www.allrecipes.com/thmb/_a5Vqw25nsTAdGUs2zt6VS3yjjA=/282x188/filters:no_upscale():max_bytes(150000):strip_icc():format(webp)/273910-best-ever-nutella-frosting-4x3-b4aed15f8ed1463f9faea49634b666d7.jpg\"\nwidth=\"282\"\nheight=\"188\"\nclass=\"img--noscript card__img universal-image__image\"\nalt=\"chocolate cupcakes decorated with nutella frosting\"\n/\u003e\n\n\n\n \n\n\n\n\n\n\n\n\nBest Ever Nutella Frosting\n\n\n\n\n\n\n\n\n\n\n\n\n\n\n\n\n\n\n\n4\n\nRatings\n\n\n \n\n\n\n\n\n\n\u003cimg\nsrc=\"https://www.allrecipes.com/thmb/dl2v1a8TiUMSBv-f8ykz5dl_snI=/282x188/filters:no_upscale():max_bytes(150000):strip_icc():format(webp)/962588-d3132e6ec4d04567828767d96cbdabca.jpg\"\nwidth=\"282\"\nheight=\"188\"\nclass=\"img--noscript card__img universal-image__image\"\n/\u003e\n\n\n\n \n\n\n\n\n\n\n\n\nChocolate Cupcakes with Caramel Frosting\n\n\n\n\n\n\n\n\n\n\n\n\n\n\n\n\n\n\n\n85\n\nRatings\n\n\n \n\n\n\n\n\n\n\u003cimg\nsrc=\"https://www.allrecipes.com/thmb/UE0ejETCXeIxRs-qH3ejqGV95XQ=/282x188/filters:no_upscale():max_bytes(150000):strip_icc():format(webp)/1036913-adfd0d78e8ff46cab9710e016c830f52.jpg\"\nwidth=\"282\"\nheight=\"188\"\nclass=\"img--noscript card__img universal-image__image\"\n/\u003e\n\n\n\n \n\n\n\n\n\n\n\n\nPeanut Butter Cup Chocolate Cupcakes with Toasted Peanut Butter Meringue Frosting\n\n\n\n\n\n\n\n\n\n\n\n\n\n\n\n\n\n\n\n3\n\nRatings\n\n\n \n\n\n\n\n\n\n\u003cimg\nsrc=\"https://www.allrecipes.com/thmb/blPKwX_QmzsnJg1JlVlQcQs6TZ0=/282x188/filters:no_upscale():max_bytes(150000):strip_icc():format(webp)/810142-861fd87df8d241178009e492cf490537.jpg\"\nwidth=\"282\"\nheight=\"188\"\nclass=\"img--noscript card__img universal-image__image\"\n/\u003e\n\n\n\n \n\n\n\n\n\n\n\n\nRaspberry White Chocolate Buttercream Cupcakes\n\n\n\n\n\n\n\n\n\n\n\n\n\n\n\n\n\n\n\n46\n\nRatings\n\n\n \n\n\n\n\n\n\n\u003cimg\nsrc=\"https://www.allrecipes.com/thmb/qI8OELXZ4ReleiX2UnAZwHlWipk=/282x188/filters:no_upscale():max_bytes(150000):strip_icc():format(webp)/4581395-1d542ed33cad41abba9e7dddb0971b5b.jpg\"\nwidth=\"282\"\nheight=\"188\"\nclass=\"img--noscript card__img universal-image__image\"\n/\u003e\n\n\n\n \n\n\n\n\n\n\n\n\nGingerbread Men Cookies with Nutella® hazelnut spread\n\n\n\n\n\n\n\n\n\n\n\n\n\n\n\n\n\n\n\n2\n\nRatings\n\n\n \n\n\n\n\n\n\n\u003cimg\nsrc=\"https://www.allrecipes.com/thmb/igv_IcDBVC7wj542bjJqj6Hehp0=/282x188/filters:no_upscale():max_bytes(150000):strip_icc():format(webp)/5018896-8a7da3ec0e2b44fea93436b87f683885.jpg\"\nwidth=\"282\"\nheight=\"188\"\nclass=\"img--noscript card__img universal-image__image\"\n/\u003e\n\n\n\n \n\n\n\n\n\n\n\n\nCustard Buttercream\n\n\n\n\n\n\n\n\n\n\n\n\n\n\n\n\n\n\n\n15\n\nRatings\n\n\n \n\n\n\n\n\n\n\u003cimg\nsrc=\"https://www.allrecipes.com/thmb/wl4PSnny4VNz5PYj84F8NSjGgOE=/282x188/filters:no_upscale():max_bytes(150000):strip_icc():format(webp)/586455-aef5e626514f4ffc808cf726ed31e14b.jpg\"\nwidth=\"282\"\nheight=\"188\"\nclass=\"img--noscript card__img universal-image__image\"\n/\u003e\n\n\n\n \n\n\n\n\n\n\n\n\nStrawberry-Chocolate Mini Cupcakes with White Chocolate Ganache\n\n\n\n\n\n\n\n\n\n\n\n\n\n\n\n\n\n\n\n6\n\nRatings\n\n\n \n\n\n\n\n\n\n\u003cimg\nsrc=\"https://www.allrecipes.com/thmb/DLQRXIoK_8MEGayEUGzwoucqu9w=/282x188/filters:no_upscale():max_bytes(150000):strip_icc():format(webp)/ar_defaultPlaceHolderImage-01ff595bb5c043819991b30b49bbb057.png\"\nwidth=\"282\"\nheight=\"188\"\nclass=\"img--noscript card__img universal-image__image\"\nalt=\"Card Placeholder Image\"\n/\u003e\n\n\n\n \n\n\n\n\n\n\n\n\nHazelnut and Almond Cookies\n\n\n\n\n\n\n\n\n\n\n\n\n\n\n\n\n\n\n\n8\n\nRatings\n\n\n \n\n\n\n\n \n\n\n Allrecipes\n\n\n \nNewsletters\n \n\nFollow Us\n\n\n \n\n\n \n\n \n\n\n \n\n \n\n\n \n\n \n\n\n \n\n \n\n\n \n\n \n\n\n \n\n \n\n\nDinners\nMeals\nIngredients\nOccasions\nCuisines\nKitchen Tips\nNews\nFeatures \n About Us\n \n\n Editorial Process\n \n\n Privacy Policy\n \n\n Product Vetting\n \n\n Terms of Service\n \n\n Advertise\n \n\n Careers\n \n\n Contact\n \n\n Your Privacy Choices\n  \n\n\n\n \n\n \n\n \n \n\n \n\n\n\n\n\nAllrecipes\nis part of the Dotdash Meredith publishing family.\n\n\n\n\n \n\n\nDialog Heading\n\n\n\n\n\n\n\n \n\n\n \n\n\nNewsletter Sign Up\n\n\n\n\n\n\n\n \n\n \n\n\nNewsletter Sign Up\n\n\n\n\n\n\n\n \n\n\n\n\n\n\n\n\n\n\nMntl.utilities.scriptsOnLoad(document.querySelectorAll('script[data-glb-js=\"bottom\"]'), function() {\nvar Mntl = window.Mntl || {};\nwindow.Mntl = window.Mntl || {};\nwindow.Mntl.affiliatePlugins = window.Mntl.affiliatePlugins || [];\nwindow.Mntl.affiliateLinkRewriter.setMappings( {\nDOC_ID: '6569401'\n,SITE: 'allrecipes'\n,REQUEST_ID: 'nbe0e17dbcfbc47f0a1f33ccdfff2ca7804'\n}\n);\nwindow.Mntl.affiliatePlugins.push(window.Mntl.affiliateLinkRewriter.processLink);window.Mntl.externalizeLinks.init();(function (Mntl) {\nMntl.digioh = {\nscript: null,\nbrandId: null,\ninitialized: false,\ninit() {\nif (this.initialized) return;\nconst brandId = '47b4a4dd-ffd7-43db-8118-8002b7c15352';\nconst digiohFastActivation = 'false';\nconst lightboxJs = digiohFastActivation === 'true' ? '/lightbox_speed.js' : '/lightbox_inline.js';\n// eslint-disable-next-line prefer-template\nconst script = 'https://www.lightboxcdn.com/vendor/' + brandId + lightboxJs;\nthis.brandId = brandId;\nthis.script = script;\nthis.initialized = true;\n},\nload(callback) {\nthis.init();\nif (callback) {\nMntl.utilities.loadExternalJS({ src: this.script }, callback);\n} else {\nMntl.utilities.loadExternalJS({ src: this.script });\n}\n}\n};\n})(window.Mntl || {});\nMntl.digiohTimerDelay = parseFloat('0') * 1000;\n(function(Mntl) {\nconst setup = {\"clickToInitialize\":false,\"playlistUrl\":\"https:\\/\\/cdn.jwplayer.com\\/v2\\/playlists\\/fV1m0Jmn\",\"documentDescription\":\"These+easy+brownies+are+loaded+with+chopped+hazelnuts%2C+then+they%26%2339%3Bre+topped+with+swirls+of+creamy+chocolate-hazelnut+frosting.\",\"skin\":{\"name\":\"mantle\"},\"mute\":true,\"advertising\":{\"client\":\"googima\",\"vpaidmode\":\"enabled\",\"rules\":{\"frequency\":1},\"forceNonLinearFullSlot\":true,\"vpaidcontrols\":true,\"autoplayadsmuted\":true},\"autostart\":true,\"nextUpDisplay\":true,\"preload\":\"metadata\",\"aspectratio\":\"16:9\",\"pauseotherplayers\":\"true\",\"cast\":{},\"recsPlaylistId\":\"ZBQZ5egR\",\"width\":\"100%\",\"documentTitle\":\"Brownie+Cupcakes+with+Hazelnut+Buttercream\"};\n// JW player requires `playlist` to be populated for contextual playlists\nsetup.playlist = setup.playlistUrl;\nconst isImmediateAutoplay = false;\nconst playInView = 0;\nconst encodedPageURL = encodeURIComponent(window.location);\nconst domain = Mntl.utilities.getDomain();\nconst iuPath = '/' + Mntl.GPT.getDfpId() + '/ddm.' + domain.replace('.com', '.video') + (Mntl.GPT.isMobile() ? '.mob' : '');\nfunction formatAdSizeArray(sizeArr) {\nreturn sizeArr.map(function(sz) {\nreturn sz.join('x');\n}).join('|');\n}\n// Assign a randomly-generated, eight character, alpha-numeric value to this property.\nsetup.advertising.adscheduleid = Math.random().toString(36).substr(2,8);\n// muid - used for audience targeting\nsetup.advertising.ppid = 'd33b8d38-8314-4f22-9ebb-1156690bad90';\nlet custParams = '';\ncustParams += '\u0026' + encodeURIComponent('slot') + '=' + encodeURIComponent('broadmatch');\nconst inFocus = window \u0026\u0026 window.document \u0026\u0026 window.document.hasFocus();\nconst durationParams = Mntl.JWPlayer.getDurationParams(0, true);\ncustParams += '\u0026ttid=' + setup.mediaid;\ncustParams += '\u0026play=' + Mntl.JWPlayer.getCustomPlayValue(setup.autostart, isImmediateAutoplay, playInView);\ncustParams += '\u0026in_focus=' + inFocus;\ncustParams += '\u0026videoduration=' + durationParams.duration;\ncustParams += '\u0026duration_over=' + durationParams.durationOver;\ncustParams += '\u0026duration_under=' + durationParams.durationUnder;\nsetup.advertising.schedule = [{\n\"offset\": \"pre\",\n\"tag\": [\n'https://securepubads.g.doubleclick.net/gampad/ads?',\n'sz=',\nformatAdSizeArray([[640, 360]]),\n'\u0026iu=',\niuPath,\n'\u0026env=vp\u0026hl=en\u0026gdfp_req=1\u0026impl=s\u0026output=xml_vast2\u0026unviewed_position_start=1\u0026lid=',\n'\u0026url=',\nencodedPageURL,\n'\u0026description_url=',\nencodedPageURL,\n'\u0026correlator=',\nMath.floor(Date.now() / 1000),\n'\u0026cust_params=',\nMntl.GPT.serializeAllTargeting(),\nencodeURIComponent(custParams),\n'\u0026ad_rule=1'\n].join('')\n}];\nMntl.JWPlayer.init({\naccountKey: \"oxY0/BqWBX09BISmLN4/xuTz4IdZy713Cdjj4GyHOiYCUCyJ\",\nadSizes: [[640, 360]],\ndefer: true,\ndeferOnRFDS: false,\ndisplayMode: \"none\",\ndivId: \"mntl-jwplayer-broad__video_1-0\",\nenableBiddingWithTCData: false,\nenableTVPEngagementBtns: false,\neventCategoryType: \"Trending\",\nintersectionMargin: \"250px\",\nisImmediateAutoplay: isImmediateAutoplay,\nisImmediateStickyDisabled: false,\nisIntersectionDisabled: false,\nisMobileAdhesive: false,\nisBroadVideo: true,\nisPlaylist: true,\nmediaSize: 1080,\nplayerId: \"aiy6MJ4O\",\nplayInView: playInView,\nshowCaptions: true,\nslot: \"broadmatch\",\nrtbVideoConfig: {\"maxduration\":60,\"minduration\":0,\"plcmt\":2},\nuseDynamicVideoSizes: true,\nskipExistingMediaContent: false,\nstickyplay: false,\nuseMotionThumbnails: false\n}, setup );\n}(window.Mntl || {}));\n});\n\n\nBy clicking “Accept All Cookies”, you agree to the storing of cookies on your device to enhance site navigation, analyze site usage, and assist in our marketing efforts. Cookies Settings Accept All Cookies",
  "url": "https://www.allrecipes.com/recipe/222228/brownie-cupcakes-with-hazelnut-buttercream",
  "image": "https://www.allrecipes.com/thmb/W8ZLbqDF4U_NlxySbFHdSOpif_E=/1500x0/filters:no_upscale():max_bytes(150000):strip_icc()/986374-a45129acb1804dd9bac9590877a4818b.jpg",
  "name": "Jif® Hazelnut",
  "prep_time": "15 min",
  "cook_time": "35 min",
  "total_time": "50 min",
  "calories": "483",
  "servings": "",
  "ingredients": "Ingredients mentioned in page",
  "instructions": "Heat oven to 350 degrees F. Line 12 muffin cups with paper baking cups. Prepare brownie mix according to package directions using oil, water and eggs. Stir in 1/2 cup of chopped hazelnuts. Fill baking cups 3/4 full.;Bake 30 to 32 minutes or until centers are set. Cool 2 minutes. Remove from pan. Cool completely on wire racks.;For Frosting: Beat shortening, butter and chocolate hazelnut spread in a large bowl, with an electric mixer on medium speed until smooth. Add powdered sugar, vanilla, salt and 1 tablespoon of milk. Beat slowly until combined. Beat on high, 3 to 5 minutes, adding an additional 1 tablespoon milk at a time until desired consistency is achieved.;Frost cupcakes by placing frosting into corner of resealable plastic bag. Cut 1/2-inch off corner of bag. Starting at outside edge, work in circular motion to build up frosting moving towards center, creating a swirl effect. Sprinkle with reserved chopped hazelnuts.",
  "source_site": "www.allrecipes.com",
  "crawl_date": "2025-04-26T00:19:28.7246836-04:00"
}