{
  "id": "dO5KC_1NR",
  "title": "Bacon \u0026 Cheddar Green Bean Casserole",
  "description": "This green bean casserole with bacon and Cheddar is the perfect holiday side dish, but your family will enjoy it as part of any weeknight dinner.",
  "body": "​ \n\n \n\n \n\n \n\n \n\n \n\n \n\n \n\n \n\n \n\n \n\n \n\n \n\n \n\n \n\n \n\n \n\n \n\n \n\n \n\n \n\n \n\n \n\n \n\n \n\n \n\n \n\n \n\n \n\n\n\n\n\u003ciframe src=\"//www.googletagmanager.com/ns.html?id=GTM-P3X3VT7\" height=\"0\" width=\"0\" style=\"display:none;visibility:hidden\"\u003e\u003c/iframe\u003e\n\nSkip to content\n\n\n\n\n\n\n\n\n\n\n\n\n\n\n Allrecipes\n\n\n \n \n\n\n\n\n\n\n \n\n\n\n\n\n\nSearch\n\n\n\n\n\n\n\n\n\n\n\n\n\n \n\n\n\nPlease fill out this field.\n\n\n\n\n\n\nSearch the site\n\n\n\n\n\n\n\n\n \n\n\n\nPlease fill out this field.\n\n\n\n\n\n \n\n\n\nLog In\n\n \n\n\nMy Account\n\n\n\n\n\n\n\n My Profile\n \n\n Add a Recipe\n \n\n Saved Recipes \u0026 Collections\n \n\n Account Settings\n \n\n Help\n \n\n Log Out\n \n\n\n\n\n\nMagazine\n\n\n\n\n\n\n\n Subscribe\n \n\n Manage Your Subscription\n \n\n Give a Gift Subscription\n \n\n Get Help\n \n\n\n\nNewsletters\n\n\n Sweepstakes\n \n\n\n\n\n\n\n\n\n\n\n\n\n\n\n\n\n\n\n\n\n\n Allrecipes\n\n\n \n\n\n\n\n\nSearch\n\n\n\n\n\n\n\n\n \n\n\n\nPlease fill out this field.\n\n\n\n\n\n\nDinners\n\n\n\n\n\n\n\n\n\n\n\nDinners\n\n\n\n 5-Ingredient Dinners\n \n\n One-Pot Meals\n \n\n Quick \u0026 Easy\n \n\n 30-Minute Meals\n \n\n Family Dinners\n \n\n Soups, Stews \u0026 Chili\n \n\n Comfort Food\n \n\n Main Dishes\n \n\n Sheet Pan Dinners\n \n\n View All\n \n\n\n\n\n\nMeals\n\n\n\n\n\n\n\n\n\n\n\nMeals\n\n\n\n Breakfast \u0026 Brunch\n \n\n Lunch\n \n\n Healthy\n \n\n Appetizers \u0026 Snacks\n \n\n Salads\n \n\n Side Dishes\n \n\n Soups\n \n\n Bread\n \n\n Drinks\n \n\n Desserts\n \n\n View All\n \n\n\n\n\n\nIngredients\n\n\n\n\n\n\n\n\n\n\n\nIngredients\n\n\n\n Chicken\n \n\n Beef\n \n\n Pork\n \n\n Seafood\n \n\n Pasta\n \n\n Fruits\n \n\n Vegetables\n \n\n View All\n \n\n\n\n\n\nOccasions\n\n\n\n\n\n\n\n\n\n\n\nOccasions\n\n\n\n Kentucky Derby Recipes\n \n\n Cinco de Mayo Recipes\n \n\n Mother's Day Recipes\n \n\n Memorial Day Recipes\n \n\n View All\n \n\n\n\n\n\nCuisines\n\n\n\n\n\n\n\n\n\n\n\nCuisines\n\n\n\n Mexican\n \n\n Italian\n \n\n Chinese\n \n\n Indian\n \n\n German\n \n\n Greek\n \n\n Filipino\n \n\n Japanese\n \n\n View All\n \n\n\n\n\n\nKitchen Tips\n\n\n\n\n\n\n\n\n\n\n\nKitchen Tips\n\n\n\n Instant Pot\n \n\n Air Fryer\n \n\n Slow Cooker\n \n\n Our Favorite Products\n \n\n BBQ \u0026 Grilling\n \n\n Cooking by Equipment\n \n\n Ingredient Substitutions\n \n\n View All\n \n\n\n\n\n\nNews\n\n\n\n\n\n\n\n\n\n\n\nNews\n\n\n\n Celebrity \u0026 Entertainment\n \n\n Fast Food\n \n\n Grocery\n \n\n Recalls\n \n\n Trends\n \n\n View All\n \n\n\n\n\n\nFeatures\n\n\n\n\n\n\n\n\n\n\n\nFeatures\n\n\n\n Dinner Fix\n \n\n Sweet Spot\n \n\n In the Kitchen\n \n\n\n\n\n\nAbout Us\n\n\n\n\n\n\n\n\n\n\n\nAbout Us\n\n\n\n About Allrecipes\n \n\n Allstars\n \n\n How to Add a Recipe\n \n\n\n\n\n GET THE MAGAZINE\n \n\n \n\n\n\n\n\n\n\n \n\n\n\nLog In\n\n \n\n\nMy Account\n\n\n\n\n\n\n\n\n\n\n\nMy Account\n\n\n\n My Profile\n \n\n Add a Recipe\n \n\n Saved Recipes \u0026 Collections\n \n\n Account Settings\n \n\n Help\n \n\n Log Out\n \n\n\n\n\n\nMagazine\n\n\n\n\n\n\n\n\n\n\n\nMagazine\n\n\n\n Subscribe\n \n\n Manage Your Subscription\n \n\n Give a Gift Subscription\n \n\n Get Help\n \n\n\n\nNewsletters\n\n\n Sweepstakes\n \n\n\n\n\n\n\n\n\n\n\n\n\n\nFollow Us\n\n\n \n\n\n \n\n \n\n\n \n\n \n\n\n \n\n \n\n\n \n\n \n\n\n \n\n \n\n\n \n\n\n \n\n\n\n\n Dinners\n\n\n\n 5-Ingredient Dinners\n \n\n One-Pot Meals\n \n\n Quick \u0026 Easy\n \n\n 30-Minute Meals\n \n\n Family Dinners\n \n\n Soups, Stews \u0026 Chili\n \n\n Comfort Food\n \n\n Main Dishes\n \n\n Sheet Pan Dinners\n \n\n View All\n \n\n\n\n Meals\n\n\n\n Breakfast \u0026 Brunch\n \n\n Lunch\n \n\n Healthy\n \n\n Appetizers \u0026 Snacks\n \n\n Salads\n \n\n Side Dishes\n \n\n Soups\n \n\n Bread\n \n\n Drinks\n \n\n Desserts\n \n\n View All\n \n\n\n\n Ingredients\n\n\n\n Chicken\n \n\n Beef\n \n\n Pork\n \n\n Seafood\n \n\n Pasta\n \n\n Fruits\n \n\n Vegetables\n \n\n View All\n \n\n\n\n Occasions\n\n\n\n Kentucky Derby Recipes\n \n\n Cinco de Mayo Recipes\n \n\n Mother's Day Recipes\n \n\n Memorial Day Recipes\n \n\n View All\n \n\n\n\n Cuisines\n\n\n\n Mexican\n \n\n Italian\n \n\n Chinese\n \n\n Indian\n \n\n German\n \n\n Greek\n \n\n Filipino\n \n\n Japanese\n \n\n View All\n \n\n\n\n Kitchen Tips\n\n\n\n Instant Pot\n \n\n Air Fryer\n \n\n Slow Cooker\n \n\n Our Favorite Products\n \n\n BBQ \u0026 Grilling\n \n\n Cooking by Equipment\n \n\n Ingredient Substitutions\n \n\n View All\n \n\n\n\n News\n\n\n\n Celebrity \u0026 Entertainment\n \n\n Fast Food\n \n\n Grocery\n \n\n Recalls\n \n\n Trends\n \n\n View All\n \n\n\n\n Features\n\n\n\n Dinner Fix\n \n\n Sweet Spot\n \n\n In the Kitchen\n \n\n\n\n\n\n About Us\n\n\n\n The Allrecipes Allstars\n \n\n How to Add a Recipe\n \n\n\nGET THE MAGAZINE\n\n\n\n\n\n\n\nRecipes\n\n\n\nTrusted Brands: Recipes and Tips\n\n\n\nDel Monte\n\nBacon \u0026 Cheddar Green Bean Casserole\n\n\n\n\n\n\n\n\n\n\n\n\n\n\n\n\n\n4.8\n(22)\n16 Reviews\n4 Photos\nThis green bean casserole with bacon and Cheddar is proof that everything's better with bacon and cheese! Make your favorite green bean casserole more delicious just by adding these two ingredients. This recipe is the perfect addition to your Thanksgiving or Christmas holiday feast, but it's also a nice comfort-food casserole that works alongside any weeknight dinner.\n\nSubmitted by\nDel Monte\n\nUpdated on September 13, 2023\n\n \n \nSave\n\n\n\n\n\n\n\n\nRate\n\n\n\n\n\n \nPrint\n\n\n\n\n\n\n\n\n\n\nShare\n\n\n\n\n\n \n\n\n\n\n\n\n\n\n\n\n\n\n\n\n\n\n\n\n\n\n\n\n\n\n\n\n\n\n \n\n\n\n\nClose\n\n\n\n \n\n\n\n\u003cimg\nsrc=\"https://www.allrecipes.com/thmb/qsL30EsRhj1sXXhBjIaQpSPai48=/1500x0/filters:no_upscale():max_bytes(150000):strip_icc():format(webp)/4528705-bacon-cheddar-green-bean-casserole-Del-Monte-4x3-1-48958c6f695d4ab7827fecb82ec3b00d.jpg\"\nwidth=\"2000\"\nheight=\"1500\"\nclass=\"loaded primary-img--noscript primary-image__image mntl-primary-image--blurry\"\nsrcset=\"https://www.allrecipes.com/thmb/WaJUzJXYbkx9GTcgbCnCVA6S5R0=/750x0/filters:no_upscale():max_bytes(150000):strip_icc():format(webp)/4528705-bacon-cheddar-green-bean-casserole-Del-Monte-4x3-1-48958c6f695d4ab7827fecb82ec3b00d.jpg 750w\"\nsizes=\"750px\"\nalt=\"close up view of a Bacon \u0026amp; Cheddar Green Bean Casserole in a white baking dish\"\n/\u003e\n\n \n\n Add Photo\n\n\n\n\n4\n\n\n\n4\n\n\n\n4\n\n\n\n \n\nPrep Time:\n10 mins\n\n\nCook Time:\n30 mins\n\n\nTotal Time:\n40 mins\n\n\nServings:\n12 \n\n\nYield:\n1 3-quart casserole\n\n\nJump to Nutrition Facts\n\n Jump to recipe\n\n\n\n\n This green bean casserole with bacon is easy to make with cheap ingredients. Since it comes together in just a little more than half an hour, it's the perfect low-maintenance Thanksgiving side dish.\n\n\n  Green Bean Casserole Ingredients  \n All the ingredients for this casserole are super convenient — and you may already have them all on hand. Here's what you'll need:\n\n\n\nGreen beans: You'll need four cans of green beans (use your favorite variety, such as French-style or farmhouse cut).\nCanned soup: Two cans of cream of mushroom soup add richness and savory flavor.\nFrench-fried onions: French-fried onions lend flavor and welcome crunch.\nMilk: Use whole, low-fat, or your favorite milk alternative.\nCheese: Pre-shredded Cheddar cheese will work, but it's always best to grate your own block.\nBacon: This green bean casserole calls for six strips of cooked bacon. Try baking the bacon in the oven to ensure it's extra crispy (and to cut down on mess).\nPepper: The casserole is simply seasoned with black pepper. There's no need to add salt, as canned soup contains plenty.\n\n\n  How to Make Green Bean Casserole With Bacon  \n It's so simple to make this green bean casserole with bacon. You'll find the full, step-by-step recipe below — but here's a brief overview of what you can expect:\n\n\n Make the casserole: Combine the beans, soup, milk, and pepper in a bowl. Add 1 ⅓ cups French-fried onions and ½ of the Cheddar cheese. Crumble five slices of bacon and stir into the green bean mixture.Bake the casserole: Transfer to a baking dish and bake in a preheated oven until the casserole is hot and bubbly. Remove from the oven and stir.Add topping and finish: Sprinkle with the remaining cheese and onions. Crumble the remaining piece of bacon, then sprinkle the crumbles on top. Return to the oven and continue baking until the onions are golden brown.\n\n\n  How to Store Green Bean Casserole With Bacon  \n Store your cooled leftovers in an airtight container in the refrigerator. Use within four days. Reheat in the microwave or in the oven.\n\n\n  Can You Freeze Green Bean Casserole With Bacon?  \n Yes! If you plan to freeze it, it's best to cook this green bean casserole in a foil pan. Once it has cooled, wrap it in one layer of storage wrap followed by one layer of aluminum foil. Freeze for up to six months. Thaw in the fridge and reheat in the oven.\n\n\n  Allrecipes Community Tips and Praise  \n \"I used fresh green beans and cooked them prior to baking,\" says Evi Holley. \"Everyone in my family could not stop eating it!!\"\n\n\n \"Green bean casserole has been a tradition in my family for generations,\" according to David Jordan. \"I found that if I don't want to cook bacon if I'm on a time crunch, I use Hormel bacon pieces from the bacon bits section at the grocery store.\"\n\n\n Editorial contributions by Corey Williams\n\n\n\n\n \n\n\n\nCook Mode\n(Keep screen awake)\n\nIngredients\n \n\n\n\n\n\n\n1x\n\n\n\n\n\n\n\n\n2x\n\n\n\n\n\n\n\n\n4x\n\n\n\n \n\n\n\nOops! Something went wrong. Our team is working on it.\n\n\n\nOriginal recipe (1X) yields 12 servings\n \n\n4 (14.5 ounce) cans Del Monte Green Beans, any style, drained\n\n\n2 (10.5 ounce) cans Campbell's Condensed Cream of Mushroom Soup\n\n\n2 ⅔ cups French's French Fried Onions, divided\n\n\n1 cup milk\n\n\n½ cup shredded Cheddar cheese, divided\n\n\n6 slices cooked bacon, divided\n\n\n¼ teaspoon ground black pepper\n\n\n\nDirections\n\n\n Preheat the oven to 350 degrees F (175 degrees C).\n\n\n\n\n Combine green beans, condensed soup, milk, and pepper in a large bowl. Add 1 1/3 cups French-fried onions and 1/2 of the Cheddar cheese.\n\n\n\n\n Crumble 5 slices of bacon; add to the green bean mixture and mix until well combined. Transfer to a 3-quart baking dish.\n\n\n\n\n Bake in the preheated oven for until hot and bubbly, about 25 minutes.\n\n\n\n\n Remove from the oven and stir. Sprinkle with the remaining Cheddar and onions. Crumble remaining slice of bacon over top.\n\n\n\n\n Return to the oven and bake until onions are golden brown, about 5 more minutes.\n\n\n\n\n I Made It\n\n\n\n\n \nPrint\n\n\n\n\n\n\n\n37\nhome cooks made it!\n\nNutrition Facts (per serving)\n\n\n\n195\nCalories\n\n\n12g \nFat\n\n\n14g \nCarbs\n\n\n5g \nProtein\n\n\n\n\n\n \nShow Full Nutrition Label\nHide Full Nutrition Label\n\n\n\n\n\n\nNutrition Facts\n\n\n\nServings Per Recipe\n12\n\n\n\n\nCalories\n195\n\n\n\n\n\n% Daily Value *\n\n\n\nTotal Fat\n12g\n\n\n16%\n\n\n\n\nSaturated Fat\n5g\n\n\n26%\n\n\n\n\nCholesterol\n14mg\n\n\n5%\n\n\n\n\nSodium\n1028mg\n\n\n45%\n\n\n\n\nTotal Carbohydrate\n14g\n\n\n5%\n\n\n\n\nDietary Fiber\n3g\n\n\n11%\n\n\n\n\nTotal Sugars\n4g\n\n\n\n\nProtein\n5g\n\n\n10%\n\n\n\n\nCalcium\n58mg\n\n\n4%\n\n\n\n\nIron\n0mg\n\n\n1%\n\n\n\n\nPotassium\n62mg\n\n\n1%\n\n\n\n\n* Percent Daily Values are based on a 2,000 calorie diet. Your daily values may be higher or lower depending on your calorie needs.\n** Nutrient information is not available for all ingredients. Amount is based on available nutrient data.\n(-) Information is not currently available for this nutrient. If you are following a medically restrictive diet, please consult your doctor or registered dietitian before preparing this recipe for personal consumption. \n\n\n\n\n\n\n\n\n\n\n\n\n\n\n\n\n\n\n\n\n\n\n\n\n\n\n\n\n \n\n\n\n\n\n\n\n\n Add Your Photo\n\n\n\n\n \nPhotos of Bacon \u0026 Cheddar Green Bean Casserole\n \n01\nof 04\n\n\n\n\n\n\n\n\n\n\n\nPhoto by \nDel Monte\n\n \n\n \n02\nof 04\n\n\n\n\n\n\n\n\n\n\n\nPhoto by \nDiane\n\n\n\n\n\n\n\n\n\n\n\n\n\n\n\n\n\n11/30/2023\nExcellent green bean casserole! A step above the classic green bean casserole. I knew the bacon would give it that extra something, but wasn’t sure about the cheese. I did mix the cheese in as the recipe called for, but I did not top it with cheese. I let the bacon and cheese be a surprise when you tasted it. Next time I may add a little more bacon for more bacon flavor — this wasn’t quite enough to taste among all the other flavor — but I will do everything else the same. I may not wait for another holiday before making it again! \n\n \n03\nof 04\n\n\n\n\n\n\n\n\n\n\n\nPhoto by \nRebecca Hudson\n11/22/2018\n \n\n \n04\nof 04\n\n\n\n\n\n\n\n\n\n\n\nPhoto by \nDel Monte\n06/21/2017\n \n\n\n1\n\n\n \n\n\n\n\n\nYou’ll Also Love\n\n\n\n\n\n\u003cimg\nsrc=\"https://www.allrecipes.com/thmb/SgV5e01fhXJM_ICqXv4a6l8kosw=/282x188/filters:no_upscale():max_bytes(150000):strip_icc():format(webp)/102197green-bean-casserole-remixlutzflcat4x3-a2a7780a6dae46f181393cf96b1fab90.jpg\"\nwidth=\"282\"\nheight=\"188\"\nclass=\"img--noscript card__img universal-image__image\"\nalt=\"Green bean casserole in small casserole dish topped with bacon and cheese\"\n/\u003e\n\n\n\n \n\n\n\n\n\n\n\n\nGreen Bean Casserole Remix\n\n\n\n\n\n\n\n\n\n\n\n\n\n\n\n\n\n\n\n52\n\nRatings\n\n\n \n\n\n\n\n\n\n\u003cimg\nsrc=\"https://www.allrecipes.com/thmb/iaPrAFThRJRH3eaJnJe9LmcH9e0=/282x188/filters:no_upscale():max_bytes(150000):strip_icc():format(webp)/418379-best-green-bean-casserole-mfs_122-2f99e660f7b6486583388e9d7a80a218.jpg\"\nwidth=\"282\"\nheight=\"188\"\nclass=\"img--noscript card__img universal-image__image\"\nalt=\"a high angle view looking into a green casserole dish of green bean casserole with a scoop taken out.\"\n/\u003e\n\n\n\n \n\n\n\n\n\n\n\n\nBest Green Bean Casserole\n\n\n\n\n\n\n\n\n\n\n\n\n\n\n\n\n\n\n\n1,127\n\nRatings\n\n\n \n\n\n\n\n\n\n\u003cimg\nsrc=\"https://www.allrecipes.com/thmb/_tq7trNhIBi7sQObHgKfaYCuJlQ=/282x188/filters:no_upscale():max_bytes(150000):strip_icc():format(webp)/75458-green-beans-with-feta-and-bacon-RebeccaD-4x3.jpg-71f12ebcca6545a693fe6cc3abce4089.png\"\nwidth=\"282\"\nheight=\"188\"\nclass=\"img--noscript card__img universal-image__image\"\nalt=\"Green beans with crumbled bacon and feta cheese\"\n/\u003e\n\n\n\n \n\n\n\n\n\n\n\n\nGreen Beans with Feta and Bacon\n\n\n\n\n\n\n\n\n\n\n\n\n\n\n\n\n\n\n\n123\n\nRatings\n\n\n \n\n\n\n\n\n\n\u003cimg\nsrc=\"https://www.allrecipes.com/thmb/DLQRXIoK_8MEGayEUGzwoucqu9w=/282x188/filters:no_upscale():max_bytes(150000):strip_icc():format(webp)/ar_defaultPlaceHolderImage-01ff595bb5c043819991b30b49bbb057.png\"\nwidth=\"282\"\nheight=\"188\"\nclass=\"img--noscript card__img universal-image__image\"\nalt=\"Card Placeholder Image\"\n/\u003e\n\n\n\n \n\n\n\n\n\n\n\n\nTeriyaki Beef \u0026 Bean Rice Bowls from Del Monte\n\n\n\n\n\n\n\n\n\n\n\n\n\n\n\n\n\n\n\n1\n\nRating\n\n\n \n\n\n\n\n\n\n\u003cimg\nsrc=\"https://www.allrecipes.com/thmb/3-So8iUNxuy0CNtbuOvUl7lxMLI=/282x188/filters:no_upscale():max_bytes(150000):strip_icc():format(webp)/24745-sweet-green-bean-bundles-DDMFS-075-4x3-beauty-087e774ff3a5462685351e359a1f3296.jpg\"\nwidth=\"282\"\nheight=\"188\"\nclass=\"img--noscript card__img universal-image__image\"\nalt=\"Sweet green bean bundles served on plate with rustic table\"\n/\u003e\n\n\n\n \n\n\n\n\n\n\n\n\nSweet Green Bean Bundles\n\n\n\n\n\n\n\n\n\n\n\n\n\n\n\n\n\n\n\n482\n\nRatings\n\n\n \n\n\n\n\n\n\n\u003cimg\nsrc=\"https://www.allrecipes.com/thmb/gebFzvEvAk4PWiChhqBLgzVIoI4=/282x188/filters:no_upscale():max_bytes(150000):strip_icc():format(webp)/5750098-c97c60661771403eae32564281d9c13c.jpg\"\nwidth=\"282\"\nheight=\"188\"\nclass=\"img--noscript card__img universal-image__image\"\n/\u003e\n\n\n\n \n\n\n\n\n\n\n\n\nInstant Pot® Green Bean Casserole\n\n\n\n\n\n\n\n\n\n\n\n\n\n\n\n\n\n\n\n14\n\nRatings\n\n\n \n\n\n\n\n\n\n\u003cimg\nsrc=\"https://www.allrecipes.com/thmb/lFQiB8-QWkFqg7Aw4otDrmeCUhA=/282x188/filters:no_upscale():max_bytes(150000):strip_icc():format(webp)/5980621-6dc718916c0d4f619ee44ba5c5972725.jpg\"\nwidth=\"282\"\nheight=\"188\"\nclass=\"img--noscript card__img universal-image__image\"\n/\u003e\n\n\n\n \n\n\n\n\n\n\n\n\nGreen Beans with Cheese and Bacon\n\n\n\n\n\n\n\n\n\n\n\n\n\n\n\n\n\n\n\n37\n\nRatings\n\n\n \n\n\n\n\n\n\n\u003cimg\nsrc=\"https://www.allrecipes.com/thmb/ynr88ycfJzA1Wl_cx6zb7-XDpek=/282x188/filters:no_upscale():max_bytes(150000):strip_icc():format(webp)/8898218-2fd6f50787ad4fb0b5d06b77046b8dd1.jpg\"\nwidth=\"282\"\nheight=\"188\"\nclass=\"img--noscript card__img universal-image__image\"\n/\u003e\n\n\n\n \n\n\n\n\n\n\n\n\nThree-Ingredient Green Bean Casserole\n\n\n\n\n\n\n\n\n\n\n\n\n\n\n\n\n\n\n\n12\n\nRatings\n\n\n \n\n\n\n\n\n\n\n\n\n\u003cimg\nsrc=\"https://www.allrecipes.com/thmb/gDAALLTPki9p1JcNPV98NEYgHjE=/282x188/filters:no_upscale():max_bytes(150000):strip_icc():format(webp)/54073sweet-and-sour-green-beansSoupLovingNicole4x3-9f06ddeecdbb4463aa6b34d8b904cec0.jpg\"\nwidth=\"282\"\nheight=\"188\"\nclass=\"img--noscript card__img universal-image__image\"\nalt=\"Sweet and sour green beans with onons in orange dish\"\n/\u003e\n\n\n\n \n\n\n\n\n\n\n\n\nSweet and Sour Green Beans\n\n\n\n\n\n\n\n\n\n\n\n\n\n\n\n\n\n\n\n86\n\nRatings\n\n\n \n\n\n\n\n\n\n\u003cimg\nsrc=\"https://www.allrecipes.com/thmb/7awnbdcfZvdURbjfTZYPnwzVENw=/282x188/filters:no_upscale():max_bytes(150000):strip_icc():format(webp)/1868773-1e0583182d83447db3c26c1621dbfd5c.jpg\"\nwidth=\"282\"\nheight=\"188\"\nclass=\"img--noscript card__img universal-image__image\"\n/\u003e\n\n\n\n \n\n\n\n\n\n\n\n\nBrown Sugar n' Bacon Green Beans\n\n\n\n\n\n\n\n\n\n\n\n\n\n\n\n\n\n\n\n6\n\nRatings\n\n\n \n\n\n\n\n\n\n\u003cimg\nsrc=\"https://www.allrecipes.com/thmb/2Xh1svyGVgRr7BjMtBaufrhI62s=/282x188/filters:no_upscale():max_bytes(150000):strip_icc():format(webp)/94099southern-fried-green-beansTammyLynn44x3-3bc07a383c064e938cf8513caf2d1fd9.jpg\"\nwidth=\"282\"\nheight=\"188\"\nclass=\"img--noscript card__img universal-image__image\"\nalt=\"Southern fried green beans with bacon on colorful plate\"\n/\u003e\n\n\n\n \n\n\n\n\n\n\n\n\nSouthern Fried Green Beans\n\n\n\n\n\n\n\n\n\n\n\n\n\n\n\n\n\n\n\n95\n\nRatings\n\n\n \n\n\n\n\n\n\n\u003cimg\nsrc=\"https://www.allrecipes.com/thmb/4Dbz2ARQ8LQtrJuRUVhHbrcI3PU=/282x188/filters:no_upscale():max_bytes(150000):strip_icc():format(webp)/Green-Bean-Casserole-with-Frozen-Green-Beans-1-by-1-2000-7988f7fe62df4539ad406db26536c1dd.jpg\"\nwidth=\"282\"\nheight=\"188\"\nclass=\"img--noscript card__img universal-image__image\"\nalt=\"green bean casserole\"\n/\u003e\n\n\n\n \n\n\n\n\n\n\n\n\nGreen Bean Casserole with Frozen Green Beans\n\n\n\n\n\n\n\n\n\n\n\n\n\n\n\n\n\n\n\n9\n\nRatings\n\n\n \n\n\n\n\n\n\n\u003cimg\nsrc=\"https://www.allrecipes.com/thmb/zW3FZJ-4jIOBgO1zsb4xyiUca_s=/282x188/filters:no_upscale():max_bytes(150000):strip_icc():format(webp)/5477878-33f745db632841c7a704bcdde8b3f828.jpg\"\nwidth=\"282\"\nheight=\"188\"\nclass=\"img--noscript card__img universal-image__image\"\n/\u003e\n\n\n\n \n\n\n\n\n\n\n\n\nBacon and Brown Sugar Green Bean Casserole\n\n\n\n\n\n\n\n\n\n\n\n\n\n\n\n\n\n\n\n1\n\nRating\n\n\n \n\n\n\n\n\n\n\u003cimg\nsrc=\"https://www.allrecipes.com/thmb/nv9z51u5lQ8vncDttAtbXzCFAR4=/282x188/filters:no_upscale():max_bytes(150000):strip_icc():format(webp)/7072053-d1fc258f019d4697bafa73498eab484d.jpg\"\nwidth=\"282\"\nheight=\"188\"\nclass=\"img--noscript card__img universal-image__image\"\n/\u003e\n\n\n\n \n\n\n\n\n\n\n\n\nHealthier Homemade Green Bean Casserole\n\n\n\n\n\n\n\n\n\n\n\n\n\n\n\n\n\n\n\n5\n\nRatings\n\n\n \n\n\n\n\n\n\n\u003cimg\nsrc=\"https://www.allrecipes.com/thmb/5-rioSsaa513RVR4SxEKZ4MJ0as=/282x188/filters:no_upscale():max_bytes(150000):strip_icc():format(webp)/2202272-bacon-garlic-green-beans-Magnolia-Blossom-4x3-1-b7dc42018ff24084a0fb98e556e6aab9.jpg\"\nwidth=\"282\"\nheight=\"188\"\nclass=\"img--noscript card__img universal-image__image\"\nalt=\"close up view of Bacon-Garlic Green Beans with lemon zest on a plate\"\n/\u003e\n\n\n\n \n\n\n\n\n\n\n\n\nBacon-Garlic Green Beans\n\n\n\n\n\n\n\n\n\n\n\n\n\n\n\n\n\n\n\n27\n\nRatings\n\n\n \n\n\n\n\n\n\n\u003cimg\nsrc=\"https://www.allrecipes.com/thmb/-nxAkw5QL57OriJY7svEn9Gnsgg=/282x188/filters:no_upscale():max_bytes(150000):strip_icc():format(webp)/4462281-1c34a4da6d9e47419ca2e8727411b08d.jpg\"\nwidth=\"282\"\nheight=\"188\"\nclass=\"img--noscript card__img universal-image__image\"\n/\u003e\n\n\n\n \n\n\n\n\n\n\n\n\nGreen Beans\n\n\n\n\n\n\n\n\n\n\n\n\n\n\n\n\n\n\n\n53\n\nRatings\n\n\n \n\n\n\n\n \n\n\n Allrecipes\n\n\n \nNewsletters\n \n\nFollow Us\n\n\n \n\n\n \n\n \n\n\n \n\n \n\n\n \n\n \n\n\n \n\n \n\n\n \n\n \n\n\n \n\n \n\n\nDinners\nMeals\nIngredients\nOccasions\nCuisines\nKitchen Tips\nNews\nFeatures \n About Us\n \n\n Editorial Process\n \n\n Privacy Policy\n \n\n Product Vetting\n \n\n Terms of Service\n \n\n Advertise\n \n\n Careers\n \n\n Contact\n \n\n Your Privacy Choices\n  \n\n\n\n \n\n \n\n \n \n\n \n\n\n\n\n\nAllrecipes\nis part of the Dotdash Meredith publishing family.\n\n\n\n\n \n\n\nDialog Heading\n\n\n\n\n\n\n\n \n\n\n \n\n\nNewsletter Sign Up\n\n\n\n\n\n\n\n \n\n \n\n\nNewsletter Sign Up\n\n\n\n\n\n\n\n \n\n\n\n\n\n\n\n\n\n\nMntl.utilities.scriptsOnLoad(document.querySelectorAll('script[data-glb-js=\"bottom\"]'), function() {\nvar Mntl = window.Mntl || {};\nwindow.Mntl = window.Mntl || {};\nwindow.Mntl.affiliatePlugins = window.Mntl.affiliatePlugins || [];\nwindow.Mntl.affiliateLinkRewriter.setMappings( {\nDOC_ID: '6583946'\n,SITE: 'allrecipes'\n,REQUEST_ID: 'n402c0ba57e514963b1c9d1180c8eb3d204'\n}\n);\nwindow.Mntl.affiliatePlugins.push(window.Mntl.affiliateLinkRewriter.processLink);window.Mntl.externalizeLinks.init();(function (Mntl) {\nMntl.digioh = {\nscript: null,\nbrandId: null,\ninitialized: false,\ninit() {\nif (this.initialized) return;\nconst brandId = '47b4a4dd-ffd7-43db-8118-8002b7c15352';\nconst digiohFastActivation = 'false';\nconst lightboxJs = digiohFastActivation === 'true' ? '/lightbox_speed.js' : '/lightbox_inline.js';\n// eslint-disable-next-line prefer-template\nconst script = 'https://www.lightboxcdn.com/vendor/' + brandId + lightboxJs;\nthis.brandId = brandId;\nthis.script = script;\nthis.initialized = true;\n},\nload(callback) {\nthis.init();\nif (callback) {\nMntl.utilities.loadExternalJS({ src: this.script }, callback);\n} else {\nMntl.utilities.loadExternalJS({ src: this.script });\n}\n}\n};\n})(window.Mntl || {});\nMntl.digiohTimerDelay = parseFloat('0') * 1000;\n(function(Mntl) {\nconst setup = {\"clickToInitialize\":false,\"playlistUrl\":\"https:\\/\\/cdn.jwplayer.com\\/v2\\/playlists\\/fV1m0Jmn\",\"documentDescription\":\"This+green+bean+casserole+with+bacon+and+Cheddar+is+the+perfect+holiday+side+dish%2C+but+your+family+will+enjoy+it+as+part+of+any+weeknight+dinner.\",\"skin\":{\"name\":\"mantle\"},\"mute\":true,\"advertising\":{\"client\":\"googima\",\"vpaidmode\":\"enabled\",\"rules\":{\"frequency\":1},\"forceNonLinearFullSlot\":true,\"vpaidcontrols\":true,\"autoplayadsmuted\":true},\"autostart\":true,\"nextUpDisplay\":true,\"preload\":\"metadata\",\"aspectratio\":\"16:9\",\"pauseotherplayers\":\"true\",\"cast\":{},\"recsPlaylistId\":\"ZBQZ5egR\",\"width\":\"100%\",\"documentTitle\":\"Bacon+%26amp%3B+Cheddar+Green+Bean+Casserole\"};\n// JW player requires `playlist` to be populated for contextual playlists\nsetup.playlist = setup.playlistUrl;\nconst isImmediateAutoplay = false;\nconst playInView = 0;\nconst encodedPageURL = encodeURIComponent(window.location);\nconst domain = Mntl.utilities.getDomain();\nconst iuPath = '/' + Mntl.GPT.getDfpId() + '/ddm.' + domain.replace('.com', '.video') + (Mntl.GPT.isMobile() ? '.mob' : '');\nfunction formatAdSizeArray(sizeArr) {\nreturn sizeArr.map(function(sz) {\nreturn sz.join('x');\n}).join('|');\n}\n// Assign a randomly-generated, eight character, alpha-numeric value to this property.\nsetup.advertising.adscheduleid = Math.random().toString(36).substr(2,8);\n// muid - used for audience targeting\nsetup.advertising.ppid = '233c6dd5-6319-4bd8-b55a-d8ecf5ff962e';\nlet custParams = '';\ncustParams += '\u0026' + encodeURIComponent('slot') + '=' + encodeURIComponent('broadmatch');\nconst inFocus = window \u0026\u0026 window.document \u0026\u0026 window.document.hasFocus();\nconst durationParams = Mntl.JWPlayer.getDurationParams(0, true);\ncustParams += '\u0026ttid=' + setup.mediaid;\ncustParams += '\u0026play=' + Mntl.JWPlayer.getCustomPlayValue(setup.autostart, isImmediateAutoplay, playInView);\ncustParams += '\u0026in_focus=' + inFocus;\ncustParams += '\u0026videoduration=' + durationParams.duration;\ncustParams += '\u0026duration_over=' + durationParams.durationOver;\ncustParams += '\u0026duration_under=' + durationParams.durationUnder;\nsetup.advertising.schedule = [{\n\"offset\": \"pre\",\n\"tag\": [\n'https://securepubads.g.doubleclick.net/gampad/ads?',\n'sz=',\nformatAdSizeArray([[640, 360]]),\n'\u0026iu=',\niuPath,\n'\u0026env=vp\u0026hl=en\u0026gdfp_req=1\u0026impl=s\u0026output=xml_vast2\u0026unviewed_position_start=1\u0026lid=',\n'\u0026url=',\nencodedPageURL,\n'\u0026description_url=',\nencodedPageURL,\n'\u0026correlator=',\nMath.floor(Date.now() / 1000),\n'\u0026cust_params=',\nMntl.GPT.serializeAllTargeting(),\nencodeURIComponent(custParams),\n'\u0026ad_rule=1'\n].join('')\n}];\nMntl.JWPlayer.init({\naccountKey: \"oxY0/BqWBX09BISmLN4/xuTz4IdZy713Cdjj4GyHOiYCUCyJ\",\nadSizes: [[640, 360]],\ndefer: true,\ndeferOnRFDS: false,\ndisplayMode: \"none\",\ndivId: \"mntl-jwplayer-broad__video_1-0\",\nenableBiddingWithTCData: false,\nenableTVPEngagementBtns: false,\neventCategoryType: \"Trending\",\nintersectionMargin: \"250px\",\nisImmediateAutoplay: isImmediateAutoplay,\nisImmediateStickyDisabled: false,\nisIntersectionDisabled: false,\nisMobileAdhesive: false,\nisBroadVideo: true,\nisPlaylist: true,\nmediaSize: 1080,\nplayerId: \"aiy6MJ4O\",\nplayInView: playInView,\nshowCaptions: true,\nslot: \"broadmatch\",\nrtbVideoConfig: {\"maxduration\":60,\"minduration\":0,\"plcmt\":2},\nuseDynamicVideoSizes: true,\nskipExistingMediaContent: false,\nstickyplay: false,\nuseMotionThumbnails: false\n}, setup );\n}(window.Mntl || {}));\n});\n\n\nBy clicking “Accept All Cookies”, you agree to the storing of cookies on your device to enhance site navigation, analyze site usage, and assist in our marketing efforts. Cookies Settings Accept All Cookies",
  "url": "https://www.allrecipes.com/recipe/258600/bacon-cheddar-green-bean-casserole",
  "image": "https://www.allrecipes.com/thmb/s1sKDfYJXV9nQEtkh6cSxx2SUQE=/1500x0/filters:no_upscale():max_bytes(150000):strip_icc()/4528705-bacon-cheddar-green-bean-casserole-Del-Monte-4x3-1-48958c6f695d4ab7827fecb82ec3b00d.jpg",
  "name": "Del Monte",
  "prep_time": "10 min",
  "cook_time": "30 min",
  "total_time": "40 min",
  "calories": "195",
  "servings": "",
  "ingredients": "Green beans: You'll need four cans of green beans (use your favorite variety, such as French-style or farmhouse cut).;Canned soup: Two cans of cream of mushroom soup add richness and savory flavor.;French-fried onions: French-fried onions lend flavor and welcome crunch.;Milk: Use whole, low-fat, or your favorite milk alternative.;Cheese: Pre-shredded Cheddar cheese will work, but it's always best to grate your own block.;Bacon: This green bean casserole calls for six strips of cooked bacon. Try baking the bacon in the oven to ensure it's extra crispy (and to cut down on mess).;Pepper: The casserole is simply seasoned with black pepper. There's no need to add salt, as canned soup contains plenty.",
  "instructions": "Make the casserole: Combine the beans, soup, milk, and pepper in a bowl. Add 1 ⅓ cups French-fried onions and ½ of the Cheddar cheese. Crumble five slices of bacon and stir into the green bean mixture.;Bake the casserole: Transfer to a baking dish and bake in a preheated oven until the casserole is hot and bubbly. Remove from the oven and stir.;Add topping and finish: Sprinkle with the remaining cheese and onions. Crumble the remaining piece of bacon, then sprinkle the crumbles on top. Return to the oven and continue baking until the onions are golden brown.;Preheat the oven to 350 degrees F (175 degrees C).;Combine green beans, condensed soup, milk, and pepper in a large bowl. Add 1 1/3 cups French-fried onions and 1/2 of the Cheddar cheese.;Crumble 5 slices of bacon; add to the green bean mixture and mix until well combined. Transfer to a 3-quart baking dish.;Bake in the preheated oven for until hot and bubbly, about 25 minutes.;Remove from the oven and stir. Sprinkle with the remaining Cheddar and onions. Crumble remaining slice of bacon over top.;Return to the oven and bake until onions are golden brown, about 5 more minutes.",
  "source_site": "www.allrecipes.com",
  "crawl_date": "2025-04-26T00:18:34.9544883-04:00"
}