{
  "id": "m_QKCl1NR",
  "title": "Simple Shepherd's Pie",
  "description": "Here is a shepherd's pie, made easy, that your family will love.",
  "body": "​ \n\n \n\n \n\n \n\n \n\n \n\n \n\n \n\n \n\n \n\n \n\n \n\n \n\n \n\n \n\n \n\n \n\n \n\n \n\n \n\n \n\n \n\n \n\n \n\n \n\n \n\n \n\n \n\n\n\n\n\u003ciframe src=\"//www.googletagmanager.com/ns.html?id=GTM-P3X3VT7\" height=\"0\" width=\"0\" style=\"display:none;visibility:hidden\"\u003e\u003c/iframe\u003e\n\nSkip to content\n\n\n\n\n\n\n\n\n\n\n\n\n\n\n Allrecipes\n\n\n \n \n\n\n\n\n\n\n \n\n\n\n\n\n\nSearch\n\n\n\n\n\n\n\n\n\n\n\n\n\n \n\n\n\nPlease fill out this field.\n\n\n\n\n\n\nSearch the site\n\n\n\n\n\n\n\n\n \n\n\n\nPlease fill out this field.\n\n\n\n\n\n \n\n\n\nLog In\n\n \n\n\nMy Account\n\n\n\n\n\n\n\n My Profile\n \n\n Add a Recipe\n \n\n Saved Recipes \u0026 Collections\n \n\n Account Settings\n \n\n Help\n \n\n Log Out\n \n\n\n\n\n\nMagazine\n\n\n\n\n\n\n\n Subscribe\n \n\n Manage Your Subscription\n \n\n Give a Gift Subscription\n \n\n Get Help\n \n\n\n\nNewsletters\n\n\n Sweepstakes\n \n\n\n\n\n\n\n\n\n\n\n\n\n\n\n\n\n\n\n\n\n\n Allrecipes\n\n\n \n\n\n\n\n\nSearch\n\n\n\n\n\n\n\n\n \n\n\n\nPlease fill out this field.\n\n\n\n\n\n\nDinners\n\n\n\n\n\n\n\n\n\n\n\nDinners\n\n\n\n 5-Ingredient Dinners\n \n\n One-Pot Meals\n \n\n Quick \u0026 Easy\n \n\n 30-Minute Meals\n \n\n Family Dinners\n \n\n Soups, Stews \u0026 Chili\n \n\n Comfort Food\n \n\n Main Dishes\n \n\n Sheet Pan Dinners\n \n\n View All\n \n\n\n\n\n\nMeals\n\n\n\n\n\n\n\n\n\n\n\nMeals\n\n\n\n Breakfast \u0026 Brunch\n \n\n Lunch\n \n\n Healthy\n \n\n Appetizers \u0026 Snacks\n \n\n Salads\n \n\n Side Dishes\n \n\n Soups\n \n\n Bread\n \n\n Drinks\n \n\n Desserts\n \n\n View All\n \n\n\n\n\n\nIngredients\n\n\n\n\n\n\n\n\n\n\n\nIngredients\n\n\n\n Chicken\n \n\n Beef\n \n\n Pork\n \n\n Seafood\n \n\n Pasta\n \n\n Fruits\n \n\n Vegetables\n \n\n View All\n \n\n\n\n\n\nOccasions\n\n\n\n\n\n\n\n\n\n\n\nOccasions\n\n\n\n Kentucky Derby Recipes\n \n\n Cinco de Mayo Recipes\n \n\n Mother's Day Recipes\n \n\n Memorial Day Recipes\n \n\n View All\n \n\n\n\n\n\nCuisines\n\n\n\n\n\n\n\n\n\n\n\nCuisines\n\n\n\n Mexican\n \n\n Italian\n \n\n Chinese\n \n\n Indian\n \n\n German\n \n\n Greek\n \n\n Filipino\n \n\n Japanese\n \n\n View All\n \n\n\n\n\n\nKitchen Tips\n\n\n\n\n\n\n\n\n\n\n\nKitchen Tips\n\n\n\n Instant Pot\n \n\n Air Fryer\n \n\n Slow Cooker\n \n\n Our Favorite Products\n \n\n BBQ \u0026 Grilling\n \n\n Cooking by Equipment\n \n\n Ingredient Substitutions\n \n\n View All\n \n\n\n\n\n\nNews\n\n\n\n\n\n\n\n\n\n\n\nNews\n\n\n\n Celebrity \u0026 Entertainment\n \n\n Fast Food\n \n\n Grocery\n \n\n Recalls\n \n\n Trends\n \n\n View All\n \n\n\n\n\n\nFeatures\n\n\n\n\n\n\n\n\n\n\n\nFeatures\n\n\n\n Dinner Fix\n \n\n Sweet Spot\n \n\n In the Kitchen\n \n\n\n\n\n\nAbout Us\n\n\n\n\n\n\n\n\n\n\n\nAbout Us\n\n\n\n About Allrecipes\n \n\n Allstars\n \n\n How to Add a Recipe\n \n\n\n\n\n GET THE MAGAZINE\n \n\n \n\n\n\n\n\n\n\n \n\n\n\nLog In\n\n \n\n\nMy Account\n\n\n\n\n\n\n\n\n\n\n\nMy Account\n\n\n\n My Profile\n \n\n Add a Recipe\n \n\n Saved Recipes \u0026 Collections\n \n\n Account Settings\n \n\n Help\n \n\n Log Out\n \n\n\n\n\n\nMagazine\n\n\n\n\n\n\n\n\n\n\n\nMagazine\n\n\n\n Subscribe\n \n\n Manage Your Subscription\n \n\n Give a Gift Subscription\n \n\n Get Help\n \n\n\n\nNewsletters\n\n\n Sweepstakes\n \n\n\n\n\n\n\n\n\n\n\n\n\n\nFollow Us\n\n\n \n\n\n \n\n \n\n\n \n\n \n\n\n \n\n \n\n\n \n\n \n\n\n \n\n \n\n\n \n\n\n \n\n\n\n\n Dinners\n\n\n\n 5-Ingredient Dinners\n \n\n One-Pot Meals\n \n\n Quick \u0026 Easy\n \n\n 30-Minute Meals\n \n\n Family Dinners\n \n\n Soups, Stews \u0026 Chili\n \n\n Comfort Food\n \n\n Main Dishes\n \n\n Sheet Pan Dinners\n \n\n View All\n \n\n\n\n Meals\n\n\n\n Breakfast \u0026 Brunch\n \n\n Lunch\n \n\n Healthy\n \n\n Appetizers \u0026 Snacks\n \n\n Salads\n \n\n Side Dishes\n \n\n Soups\n \n\n Bread\n \n\n Drinks\n \n\n Desserts\n \n\n View All\n \n\n\n\n Ingredients\n\n\n\n Chicken\n \n\n Beef\n \n\n Pork\n \n\n Seafood\n \n\n Pasta\n \n\n Fruits\n \n\n Vegetables\n \n\n View All\n \n\n\n\n Occasions\n\n\n\n Kentucky Derby Recipes\n \n\n Cinco de Mayo Recipes\n \n\n Mother's Day Recipes\n \n\n Memorial Day Recipes\n \n\n View All\n \n\n\n\n Cuisines\n\n\n\n Mexican\n \n\n Italian\n \n\n Chinese\n \n\n Indian\n \n\n German\n \n\n Greek\n \n\n Filipino\n \n\n Japanese\n \n\n View All\n \n\n\n\n Kitchen Tips\n\n\n\n Instant Pot\n \n\n Air Fryer\n \n\n Slow Cooker\n \n\n Our Favorite Products\n \n\n BBQ \u0026 Grilling\n \n\n Cooking by Equipment\n \n\n Ingredient Substitutions\n \n\n View All\n \n\n\n\n News\n\n\n\n Celebrity \u0026 Entertainment\n \n\n Fast Food\n \n\n Grocery\n \n\n Recalls\n \n\n Trends\n \n\n View All\n \n\n\n\n Features\n\n\n\n Dinner Fix\n \n\n Sweet Spot\n \n\n In the Kitchen\n \n\n\n\n\n\n About Us\n\n\n\n The Allrecipes Allstars\n \n\n How to Add a Recipe\n \n\n\nGET THE MAGAZINE\n\n\n\n\n\n\n\nRecipes\n\n\n\nDinner\n\nSimple Shepherd's Pie\n\n\n\n\n\n\n\n\n\n\n\n\n\n\n\n\n\n4.5\n(575)\n434 Reviews\n248 Photos\nHere is a shepherd's pie, made easy, that your family will love.\n\nSubmitted by\nCampbell's Kitchen\n\nUpdated on April 22, 2022\n\n \n \nSave\n\n\n\n\n\n\n\n\nRate\n\n\n\n\n\n \nPrint\n\n\n\n\n\n\n\n\n\n\nShare\n\n\n\n\n\n \n\n\n\n\n\n\n\n\n\n\n\n\n\n\n\n\n\n\n\n\n\n\n\n\n\n\n\n\n \n\n\n\n\nClose\n\n\n\n \n\n\n\n\u003cimg\nsrc=\"https://www.allrecipes.com/thmb/pLd9VlZ2hKGOgkCAFQq6Ruok4qY=/1500x0/filters:no_upscale():max_bytes(150000):strip_icc():format(webp)/5773537-a8796d82d78b486fa664c56e229284af.jpg\"\nwidth=\"3024\"\nheight=\"3024\"\nclass=\"loaded primary-img--noscript primary-image__image mntl-primary-image--blurry\"\nsrcset=\"https://www.allrecipes.com/thmb/iAAqoqWilsEZ2kt0gloiaZzJ6io=/750x0/filters:no_upscale():max_bytes(150000):strip_icc():format(webp)/5773537-a8796d82d78b486fa664c56e229284af.jpg 750w\"\nsizes=\"750px\"\n/\u003e\n\n \n\n Add Photo\n\n\n\n\n248\n\n\n\n248\n\n\n\n248\n\n\n\n248\n\n\n\n \n\nPrep Time:\n20 mins\n\n\nCook Time:\n15 mins\n\n\nTotal Time:\n35 mins\n\n\nServings:\n4 \n\n\nYield:\n4 servings\n\n\nJump to Nutrition Facts\n\n\n\n\n\n \n\n\n\nCook Mode\n(Keep screen awake)\n\nIngredients\n \n\n\n\n\n\n\n1x\n\n\n\n\n\n\n\n\n2x\n\n\n\n\n\n\n\n\n4x\n\n\n\n \n\n\n\nOops! Something went wrong. Our team is working on it.\n\n\n\nOriginal recipe (1X) yields 4 servings\n \n\n1 pound ground beef\n\n\n1 medium onion, chopped\n\n\n1 (10.75 ounce) can  Campbell's® Condensed Cream of Mushroom Soup (Regular or 98% Fat Free)\n\n\n1 tablespoon ketchup\n\n\n⅛ teaspoon ground black pepper\n\n\n1 cup frozen peas and carrots\n\n\n1 cup milk\n\n\n2 tablespoons butter\n\n\n1 ⅓ cups instant mashed potato flakes or buds\n\n\n\nDirections\n\n\n Cook beef and onion in 10-inch skillet over medium-high heat until well browned, stirring to break up meat. Pour off fat.\n\n\n\n\n Stir soup, ketchup, black pepper and peas and carrots into skillet. Spoon beef mixture in 9-inch pie plate.\n\n\n\n\n Heat milk and butter in 2-quart saucepan over medium-high heat to a boil. Remove from heat. Slowly stir in potatoes. Spoon potatoes over beef mixture.\n\n\n\n\n Bake at 400 degrees F for 15 minutes or until potatoes are lightly browned.\n\n\n\n\n I Made It\n\n\n\n\n \nPrint\n\n\n\n\n\n\n\n1,793\nhome cooks made it!\n\nNutrition Facts (per serving)\n\n\n\n474\nCalories\n\n\n29g \nFat\n\n\n29g \nCarbs\n\n\n24g \nProtein\n\n\n\n\n\n \nShow Full Nutrition Label\nHide Full Nutrition Label\n\n\n\n\n\n\nNutrition Facts\n\n\n\nServings Per Recipe\n4\n\n\n\n\nCalories\n474\n\n\n\n\n\n% Daily Value *\n\n\n\nTotal Fat\n29g\n\n\n37%\n\n\n\n\nSaturated Fat\n12g\n\n\n62%\n\n\n\n\nCholesterol\n93mg\n\n\n31%\n\n\n\n\nSodium\n755mg\n\n\n33%\n\n\n\n\nTotal Carbohydrate\n29g\n\n\n11%\n\n\n\n\nDietary Fiber\n4g\n\n\n15%\n\n\n\n\nTotal Sugars\n6g\n\n\n\n\nProtein\n24g\n\n\n49%\n\n\n\n\nVitamin C\n20mg\n\n\n22%\n\n\n\n\nCalcium\n103mg\n\n\n8%\n\n\n\n\nIron\n3mg\n\n\n14%\n\n\n\n\nPotassium\n632mg\n\n\n13%\n\n\n\n\n* Percent Daily Values are based on a 2,000 calorie diet. Your daily values may be higher or lower depending on your calorie needs.\n** Nutrient information is not available for all ingredients. Amount is based on available nutrient data.\n(-) Information is not currently available for this nutrient. If you are following a medically restrictive diet, please consult your doctor or registered dietitian before preparing this recipe for personal consumption. \n\n\n\n\n\n\n\n\n\n\n\n\n\n\n\n\n\n\n\n\n\n\n\n\n\n\n\n\n \n\n\n\n\n\n\n\n\n Add Your Photo\n\n\n\n\n \nPhotos of Simple Shepherd's Pie\n \n01\nof 248\n\n\n\n\n\n\n\n\n\n\n\nPhoto by \nAllrecipes Member\n\n \n\n \n02\nof 248\n\n\n\n\n\n\n\n\n\n\n\nPhoto by \nTony Cook\n\n\n\n\n\n\n\n\n\n\n\n\n\n\n\n\n\n08/22/2022\nFast and easy delicious dish . The whole family loves this. Another go to meal \n\n \n03\nof 248\n\n\n\n\n\n\n\n\n\n\n\nPhoto by \nlarryd_fuller\n09/05/2021\n \n\n \n04\nof 248\n\n\n\n\n\n\n\n\n\n\n\nPhoto by \nMimsy Jem\n08/27/2021\n \n\n \n05\nof 248\n\n\n\n\n\n\n\n\n\n\n\nPhoto by \nastoppiello\n08/22/2021\n \n\n \n06\nof 248\n\n\n\n\n\n\n\n\n\n\n\nPhoto by \nastoppiello\n08/22/2021\n \n\n \n07\nof 248\n\n\n\n\n\n\n\n\n\n\n\nPhoto by \nshanhelman\n08/19/2021\n \n\n \n08\nof 248\n\n\n\n\n\n\n\n\n\n\n\nPhoto by \nScott Highbarger\n\n\n\n\n\n\n\n\n\n\n\n\n\n\n\n\n\n06/15/2021\nSon and I love this. Super easy! \n\n \n09\nof 248\n\n\n\n\n\n\n\n\n\n\n\nPhoto by \nMelodie Caners\n04/21/2021\n \n\n \n10\nof 248\n\n\n\n\n\n\n\n\n\n\n\nPhoto by \njmerrill42\n04/11/2021\n \n\n\n1\n\n\n2\n\n\n3\n\n\n4\n\n\n5\n\n\n\nNext\n\n\n\n\n\n\n \n\n\n\n\n\nYou’ll Also Love\n\n\n\n\n\n\u003cimg\nsrc=\"https://www.allrecipes.com/thmb/YU2uMU48wwkiody6Cbsr6Q-F-CE=/282x188/filters:no_upscale():max_bytes(150000):strip_icc():format(webp)/985254-a1b052bd548744cc8743cff8631f4c25.jpg\"\nwidth=\"282\"\nheight=\"188\"\nclass=\"img--noscript card__img universal-image__image\"\n/\u003e\n\n\n\n \n\n\n\n\n\n\n\n\nSimply Potatoes® Easy Shepherd's Pie\n\n\n\n\n\n\n\n\n\n\n\n\n\n\n\n\n\n\n\n43\n\nRatings\n\n\n \n\n\n\n\n\n\n\u003cimg\nsrc=\"https://www.allrecipes.com/thmb/qaTSq_rF35RCVkOEAN2u3CKJxbI=/282x188/filters:no_upscale():max_bytes(150000):strip_icc():format(webp)/ALR-180735-traditional-style-vegan-shepherds-pie-VAT-4x3-1-adc03ea164ce4e469ffba34bc945232a.jpg\"\nwidth=\"282\"\nheight=\"188\"\nclass=\"img--noscript card__img universal-image__image\"\nalt=\"Shepherd’s pie in a bowl topped with shredded cheddar cheese.\"\n/\u003e\n\n\n\n \n\n\n\n\n\n\n\n\nVegan Shepherd's Pie\n\n\n\n\n\n\n\n\n\n\n\n\n\n\n\n\n\n\n\n266\n\nRatings\n\n\n \n\n\n\n\n\n\n\u003cimg\nsrc=\"https://www.allrecipes.com/thmb/p3zUnGkP3yPBKlu4hbkqo9IH1XY=/282x188/filters:no_upscale():max_bytes(150000):strip_icc():format(webp)/Shepherds-Pie-Mexicana-1x1-1-bd3b1b1bc70143a288f6099883dabde5.jpg\"\nwidth=\"282\"\nheight=\"188\"\nclass=\"img--noscript card__img universal-image__image\"\nalt=\"shepherd\u0026#39;s pie with peas, corn and ground beef\"\n/\u003e\n\n\n\n \n\n\n\n\n\n\n\n\nShepherd's Pie Mexicana\n\n\n\n\n\n\n\n\n\n\n\n\n\n\n\n\n\n\n\n26\n\nRatings\n\n\n \n\n\n\n\n\n\n\u003cimg\nsrc=\"https://www.allrecipes.com/thmb/R9nJc68BtTahc4bgHY-MSmsW26A=/282x188/filters:no_upscale():max_bytes(150000):strip_icc():format(webp)/588413-f550d61287d940bbbff9ca49d4c947da.jpg\"\nwidth=\"282\"\nheight=\"188\"\nclass=\"img--noscript card__img universal-image__image\"\n/\u003e\n\n\n\n \n\n\n\n\n\n\n\n\nMexican Shepherd's Pie\n\n\n\n\n\n\n\n\n\n\n\n\n\n\n\n\n\n\n\n443\n\nRatings\n\n\n \n\n\n\n\n\n\n\u003cimg\nsrc=\"https://www.allrecipes.com/thmb/Lr3OocfAtQJfoI2EMRw1yNoTUNU=/282x188/filters:no_upscale():max_bytes(150000):strip_icc():format(webp)/3111921-6e9b6cda29544b2a9f47169c9e3de26e.jpg\"\nwidth=\"282\"\nheight=\"188\"\nclass=\"img--noscript card__img universal-image__image\"\n/\u003e\n\n\n\n \n\n\n\n\n\n\n\n\nWeeknight Shepherd's Pie\n\n\n\n\n\n\n\n\n\n\n\n\n\n\n\n\n\n\n\n6\n\nRatings\n\n\n \n\n\n\n\n\n\n\u003cimg\nsrc=\"https://www.allrecipes.com/thmb/k5KNnxCCPG_Aq2goYME4S2tCHfY=/282x188/filters:no_upscale():max_bytes(150000):strip_icc():format(webp)/2354454-c2f294eefab04bfe889e89892eadf5c3.jpg\"\nwidth=\"282\"\nheight=\"188\"\nclass=\"img--noscript card__img universal-image__image\"\n/\u003e\n\n\n\n \n\n\n\n\n\n\n\n\nSophie's Shepherd's Pie\n\n\n\n\n\n\n\n\n\n\n\n\n\n\n\n\n\n\n\n17\n\nRatings\n\n\n \n\n\n\n\n\n\n\u003cimg\nsrc=\"https://www.allrecipes.com/thmb/5mpCzlSEaVx9pU2sN0jAJMI7ToE=/282x188/filters:no_upscale():max_bytes(150000):strip_icc():format(webp)/6323907-a2c4021376854a53afb3baad88ae2ef6.jpg\"\nwidth=\"282\"\nheight=\"188\"\nclass=\"img--noscript card__img universal-image__image\"\n/\u003e\n\n\n\n \n\n\n\n\n\n\n\n\nPuerto Rican Shepherd Pie (Pastelon)\n\n\n\n\n\n\n\n\n\n\n\n\n\n\n\n\n\n\n\n23\n\nRatings\n\n\n \n\n\n\n\n\n\n\u003cimg\nsrc=\"https://www.allrecipes.com/thmb/Hd768d96fwLZTvRo7zdQWFTPaS4=/282x188/filters:no_upscale():max_bytes(150000):strip_icc():format(webp)/739108-814f74f7c9e340e881ef1c3b7b089009.jpg\"\nwidth=\"282\"\nheight=\"188\"\nclass=\"img--noscript card__img universal-image__image\"\n/\u003e\n\n\n\n \n\n\n\n\n\n\n\n\nShepherd's Pie V\n\n\n\n\n\n\n\n\n\n\n\n\n\n\n\n\n\n\n\n142\n\nRatings\n\n\n \n\n\n\n\n\n\n\n\n\n\u003cimg\nsrc=\"https://www.allrecipes.com/thmb/MCQGEcLoMC_93uyV5jlGDdi_bPU=/282x188/filters:no_upscale():max_bytes(150000):strip_icc():format(webp)/704719-d0b7ac1ab6934daa8952da2db148601a.jpg\"\nwidth=\"282\"\nheight=\"188\"\nclass=\"img--noscript card__img universal-image__image\"\n/\u003e\n\n\n\n \n\n\n\n\n\n\n\n\nShortcut Shepherd's Pie\n\n\n\n\n\n\n\n\n\n\n\n\n\n\n\n\n\n\n\n584\n\nRatings\n\n\n \n\n\n\n\n\n\n\u003cimg\nsrc=\"https://www.allrecipes.com/thmb/Ur-CZT7ZmSdHcggDNpYSjWPsbw0=/282x188/filters:no_upscale():max_bytes(150000):strip_icc():format(webp)/6454544-56b6c6bc2167474dac292652250322e8.jpg\"\nwidth=\"282\"\nheight=\"188\"\nclass=\"img--noscript card__img universal-image__image\"\n/\u003e\n\n\n\n \n\n\n\n\n\n\n\n\nLaurie's Shepherd's Pie\n\n\n\n\n\n\n\n\n\n\n\n\n\n\n\n\n\n\n\n168\n\nRatings\n\n\n \n\n\n\n\n\n\n\u003cimg\nsrc=\"https://www.allrecipes.com/thmb/kmcv4rWyb6NaqQHCE4DFuBuUnoo=/282x188/filters:no_upscale():max_bytes(150000):strip_icc():format(webp)/9053358-a40a2912c5c840acaa2661d2c79d19c5.jpg\"\nwidth=\"282\"\nheight=\"188\"\nclass=\"img--noscript card__img universal-image__image\"\n/\u003e\n\n\n\n \n\n\n\n\n\n\n\n\nTraditional Shepherd's Pie\n\n\n\n\n\n\n\n\n\n\n\n\n\n\n\n\n\n\n\n18\n\nRatings\n\n\n \n\n\n\n\n\n\n\u003cimg\nsrc=\"https://www.allrecipes.com/thmb/P57ELPy6xUWg3bj7ROwSyZVVLM0=/282x188/filters:no_upscale():max_bytes(150000):strip_icc():format(webp)/1070666-13a23dc13af44498870e123c14583328.jpg\"\nwidth=\"282\"\nheight=\"188\"\nclass=\"img--noscript card__img universal-image__image\"\n/\u003e\n\n\n\n \n\n\n\n\n\n\n\n\nMarie's Shepherd's Pie\n\n\n\n\n\n\n\n\n\n\n\n\n\n\n\n\n\n\n\n82\n\nRatings\n\n\n \n\n\n\n\n\n\n\u003cimg\nsrc=\"https://www.allrecipes.com/thmb/BEVZY9nTcHQZB7tL1nldtZsFJOM=/282x188/filters:no_upscale():max_bytes(150000):strip_icc():format(webp)/3067211-f7f4663af75c4933863f6f271a7ed60e.jpg\"\nwidth=\"282\"\nheight=\"188\"\nclass=\"img--noscript card__img universal-image__image\"\n/\u003e\n\n\n\n \n\n\n\n\n\n\n\n\nJ. J.'s Shepherd's Pie\n\n\n\n\n\n\n\n\n\n\n\n\n\n\n\n\n\n\n\n6\n\nRatings\n\n\n \n\n\n\n\n\n\n\u003cimg\nsrc=\"https://www.allrecipes.com/thmb/Ta8w2IWgxbl-xm2b-stMeWbCDUk=/282x188/filters:no_upscale():max_bytes(150000):strip_icc():format(webp)/4476430-d78c06c85ff249449cce10f5c32b8894.jpg\"\nwidth=\"282\"\nheight=\"188\"\nclass=\"img--noscript card__img universal-image__image\"\n/\u003e\n\n\n\n \n\n\n\n\n\n\n\n\nVegetable Shepherd's Pie with Baked Beans\n\n\n\n\n\n\n\n\n\n\n\n\n\n\n\n\n\n\n\n5\n\nRatings\n\n\n \n\n\n\n\n\n\n\u003cimg\nsrc=\"https://www.allrecipes.com/thmb/toeOOps3jF7CUgFESXJD-E10td0=/282x188/filters:no_upscale():max_bytes(150000):strip_icc():format(webp)/728436-steffs-shepherd-pie-Melissa-Goff-4x3-1-d95cc946b7474032919b14dc8d60d9a3.jpg\"\nwidth=\"282\"\nheight=\"188\"\nclass=\"img--noscript card__img universal-image__image\"\nalt=\"close up view of a Shepherd Pie garnished with fresh herbs in a yellow and white baking dish\"\n/\u003e\n\n\n\n \n\n\n\n\n\n\n\n\nSteff's Shepherd Pie\n\n\n\n\n\n\n\n\n\n\n\n\n\n\n\n\n\n\n\n581\n\nRatings\n\n\n \n\n\n\n\n\n\n\u003cimg\nsrc=\"https://www.allrecipes.com/thmb/0ISt9iU4WnQ0OVfH9sb3PQMsuNs=/282x188/filters:no_upscale():max_bytes(150000):strip_icc():format(webp)/5022505-f381a2b139e4468cb704356f0a9f1255.jpg\"\nwidth=\"282\"\nheight=\"188\"\nclass=\"img--noscript card__img universal-image__image\"\n/\u003e\n\n\n\n \n\n\n\n\n\n\n\n\nHealthy Shepherd's Pie with Ground Turkey\n\n\n\n\n\n\n\n\n\n\n\n\n\n\n\n\n\n\n\n4\n\nRatings\n\n\n \n\n\n\n\n \n\n\n Allrecipes\n\n\n \nNewsletters\n \n\nFollow Us\n\n\n \n\n\n \n\n \n\n\n \n\n \n\n\n \n\n \n\n\n \n\n \n\n\n \n\n \n\n\n \n\n \n\n\nDinners\nMeals\nIngredients\nOccasions\nCuisines\nKitchen Tips\nNews\nFeatures \n About Us\n \n\n Editorial Process\n \n\n Privacy Policy\n \n\n Product Vetting\n \n\n Terms of Service\n \n\n Advertise\n \n\n Careers\n \n\n Contact\n \n\n Your Privacy Choices\n  \n\n\n\n \n\n \n\n \n \n\n \n\n\n\n\n\nAllrecipes\nis part of the Dotdash Meredith publishing family.\n\n\n\n\n \n\n\nDialog Heading\n\n\n\n\n\n\n\n \n\n\n \n\n\nNewsletter Sign Up\n\n\n\n\n\n\n\n \n\n \n\n\nNewsletter Sign Up\n\n\n\n\n\n\n\n \n\n\n\n\n\n\n\n\n\n\nMntl.utilities.scriptsOnLoad(document.querySelectorAll('script[data-glb-js=\"bottom\"]'), function() {\nvar Mntl = window.Mntl || {};\nwindow.Mntl = window.Mntl || {};\nwindow.Mntl.affiliatePlugins = window.Mntl.affiliatePlugins || [];\nwindow.Mntl.affiliateLinkRewriter.setMappings( {\nDOC_ID: '6603326'\n,SITE: 'allrecipes'\n,REQUEST_ID: 'n2aa85e92e5dc47ee970db19cdfc5432b04'\n}\n);\nwindow.Mntl.affiliatePlugins.push(window.Mntl.affiliateLinkRewriter.processLink);window.Mntl.externalizeLinks.init();(function (Mntl) {\nMntl.digioh = {\nscript: null,\nbrandId: null,\ninitialized: false,\ninit() {\nif (this.initialized) return;\nconst brandId = '47b4a4dd-ffd7-43db-8118-8002b7c15352';\nconst digiohFastActivation = 'false';\nconst lightboxJs = digiohFastActivation === 'true' ? '/lightbox_speed.js' : '/lightbox_inline.js';\n// eslint-disable-next-line prefer-template\nconst script = 'https://www.lightboxcdn.com/vendor/' + brandId + lightboxJs;\nthis.brandId = brandId;\nthis.script = script;\nthis.initialized = true;\n},\nload(callback) {\nthis.init();\nif (callback) {\nMntl.utilities.loadExternalJS({ src: this.script }, callback);\n} else {\nMntl.utilities.loadExternalJS({ src: this.script });\n}\n}\n};\n})(window.Mntl || {});\nMntl.digiohTimerDelay = parseFloat('0') * 1000;\n(function(Mntl) {\nconst setup = {\"clickToInitialize\":false,\"playlistUrl\":\"https:\\/\\/cdn.jwplayer.com\\/v2\\/playlists\\/fV1m0Jmn\",\"documentDescription\":\"Here+is+a+shepherd%26%2339%3Bs+pie%2C+made+easy%2C+that+your+family+will+love.\",\"skin\":{\"name\":\"mantle\"},\"mute\":true,\"advertising\":{\"client\":\"googima\",\"vpaidmode\":\"enabled\",\"rules\":{\"frequency\":1},\"forceNonLinearFullSlot\":true,\"vpaidcontrols\":true,\"autoplayadsmuted\":true},\"autostart\":true,\"nextUpDisplay\":true,\"preload\":\"metadata\",\"aspectratio\":\"16:9\",\"pauseotherplayers\":\"true\",\"cast\":{},\"recsPlaylistId\":\"ZBQZ5egR\",\"width\":\"100%\",\"documentTitle\":\"Simple+Shepherd%26%2339%3Bs+Pie\"};\n// JW player requires `playlist` to be populated for contextual playlists\nsetup.playlist = setup.playlistUrl;\nconst isImmediateAutoplay = false;\nconst playInView = 0;\nconst encodedPageURL = encodeURIComponent(window.location);\nconst domain = Mntl.utilities.getDomain();\nconst iuPath = '/' + Mntl.GPT.getDfpId() + '/ddm.' + domain.replace('.com', '.video') + (Mntl.GPT.isMobile() ? '.mob' : '');\nfunction formatAdSizeArray(sizeArr) {\nreturn sizeArr.map(function(sz) {\nreturn sz.join('x');\n}).join('|');\n}\n// Assign a randomly-generated, eight character, alpha-numeric value to this property.\nsetup.advertising.adscheduleid = Math.random().toString(36).substr(2,8);\n// muid - used for audience targeting\nsetup.advertising.ppid = '0a66b24e-7272-4f45-856a-40d8f835d39e';\nlet custParams = '';\ncustParams += '\u0026' + encodeURIComponent('slot') + '=' + encodeURIComponent('broadmatch');\nconst inFocus = window \u0026\u0026 window.document \u0026\u0026 window.document.hasFocus();\nconst durationParams = Mntl.JWPlayer.getDurationParams(0, true);\ncustParams += '\u0026ttid=' + setup.mediaid;\ncustParams += '\u0026play=' + Mntl.JWPlayer.getCustomPlayValue(setup.autostart, isImmediateAutoplay, playInView);\ncustParams += '\u0026in_focus=' + inFocus;\ncustParams += '\u0026videoduration=' + durationParams.duration;\ncustParams += '\u0026duration_over=' + durationParams.durationOver;\ncustParams += '\u0026duration_under=' + durationParams.durationUnder;\nsetup.advertising.schedule = [{\n\"offset\": \"pre\",\n\"tag\": [\n'https://securepubads.g.doubleclick.net/gampad/ads?',\n'sz=',\nformatAdSizeArray([[640, 360]]),\n'\u0026iu=',\niuPath,\n'\u0026env=vp\u0026hl=en\u0026gdfp_req=1\u0026impl=s\u0026output=xml_vast2\u0026unviewed_position_start=1\u0026lid=',\n'\u0026url=',\nencodedPageURL,\n'\u0026description_url=',\nencodedPageURL,\n'\u0026correlator=',\nMath.floor(Date.now() / 1000),\n'\u0026cust_params=',\nMntl.GPT.serializeAllTargeting(),\nencodeURIComponent(custParams),\n'\u0026ad_rule=1'\n].join('')\n}];\nMntl.JWPlayer.init({\naccountKey: \"oxY0/BqWBX09BISmLN4/xuTz4IdZy713Cdjj4GyHOiYCUCyJ\",\nadSizes: [[640, 360]],\ndefer: true,\ndeferOnRFDS: false,\ndisplayMode: \"none\",\ndivId: \"mntl-jwplayer-broad__video_1-0\",\nenableBiddingWithTCData: false,\nenableTVPEngagementBtns: false,\neventCategoryType: \"Trending\",\nintersectionMargin: \"250px\",\nisImmediateAutoplay: isImmediateAutoplay,\nisImmediateStickyDisabled: false,\nisIntersectionDisabled: false,\nisMobileAdhesive: false,\nisBroadVideo: true,\nisPlaylist: true,\nmediaSize: 1080,\nplayerId: \"aiy6MJ4O\",\nplayInView: playInView,\nshowCaptions: true,\nslot: \"broadmatch\",\nrtbVideoConfig: {\"maxduration\":60,\"minduration\":0,\"plcmt\":2},\nuseDynamicVideoSizes: true,\nskipExistingMediaContent: false,\nstickyplay: false,\nuseMotionThumbnails: false\n}, setup );\n}(window.Mntl || {}));\n});\n\n\nBy clicking “Accept All Cookies”, you agree to the storing of cookies on your device to enhance site navigation, analyze site usage, and assist in our marketing efforts. Cookies Settings Accept All Cookies",
  "url": "https://www.allrecipes.com/recipe/178992/shepherds-pie",
  "image": "https://www.allrecipes.com/thmb/AoMEHMN9KVwegl_J-Or5HGrX5OI=/1500x0/filters:no_upscale():max_bytes(150000):strip_icc()/5773537-a8796d82d78b486fa664c56e229284af.jpg",
  "name": "Campbell's Kitchen",
  "prep_time": "20 min",
  "cook_time": "15 min",
  "total_time": "35 min",
  "calories": "474",
  "servings": "",
  "ingredients": "Ingredients mentioned in page",
  "instructions": "Cook beef and onion in 10-inch skillet over medium-high heat until well browned, stirring to break up meat. Pour off fat.;Stir soup, ketchup, black pepper and peas and carrots into skillet. Spoon beef mixture in 9-inch pie plate.;Heat milk and butter in 2-quart saucepan over medium-high heat to a boil. Remove from heat. Slowly stir in potatoes. Spoon potatoes over beef mixture.;Bake at 400 degrees F for 15 minutes or until potatoes are lightly browned.",
  "source_site": "www.allrecipes.com",
  "crawl_date": "2025-04-26T00:18:48.7709317-04:00"
}