{
  "id": "nJVlP_JHR",
  "title": "Spicy Grilled Shrimp Recipe",
  "description": "This grilled shrimp recipe with paprika, cayenne pepper, garlic, and lemon is quick, easy, and perfect for sharing at your next summer barbeque.",
  "body": "​ \n\n \n\n \n\n \n\n \n\n \n\n \n\n \n\n \n\n \n\n \n\n \n\n \n\n \n\n \n\n \n\n \n\n \n\n \n\n \n\n \n\n \n\n \n\n \n\n \n\n \n\n \n\n \n\n\n\n\n\u003ciframe src=\"//www.googletagmanager.com/ns.html?id=GTM-P3X3VT7\" height=\"0\" width=\"0\" style=\"display:none;visibility:hidden\"\u003e\u003c/iframe\u003e\n\nSkip to content\n\n\n\n\n\n\n\n\n\n\n\n\n\n\n Allrecipes\n\n\n \n \n\n\n\n\n\n\n \n\n\n\n\n\n\nSearch\n\n\n\n\n\n\n\n\n\n\n\n\n\n \n\n\n\nPlease fill out this field.\n\n\n\n\n\n\nSearch the site\n\n\n\n\n\n\n\n\n \n\n\n\nPlease fill out this field.\n\n\n\n\n\n \n\n\n\nLog In\n\n \n\n\nMy Account\n\n\n\n\n\n\n\n My Profile\n \n\n Add a Recipe\n \n\n Saved Recipes \u0026 Collections\n \n\n Account Settings\n \n\n Help\n \n\n Log Out\n \n\n\n\n\n\nMagazine\n\n\n\n\n\n\n\n Subscribe\n \n\n Manage Your Subscription\n \n\n Give a Gift Subscription\n \n\n Get Help\n \n\n\n\nNewsletters\n\n\n Sweepstakes\n \n\n\n\n\n\n\n\n\n\n\n\n\n\n\n\n\n\n\n\n\n\n Allrecipes\n\n\n \n\n\n\n\n\nSearch\n\n\n\n\n\n\n\n\n \n\n\n\nPlease fill out this field.\n\n\n\n\n\n\nDinners\n\n\n\n\n\n\n\n\n\n\n\nDinners\n\n\n\n 5-Ingredient Dinners\n \n\n One-Pot Meals\n \n\n Quick \u0026 Easy\n \n\n 30-Minute Meals\n \n\n Family Dinners\n \n\n Soups, Stews \u0026 Chili\n \n\n Comfort Food\n \n\n Main Dishes\n \n\n Sheet Pan Dinners\n \n\n View All\n \n\n\n\n\n\nMeals\n\n\n\n\n\n\n\n\n\n\n\nMeals\n\n\n\n Breakfast \u0026 Brunch\n \n\n Lunch\n \n\n Healthy\n \n\n Appetizers \u0026 Snacks\n \n\n Salads\n \n\n Side Dishes\n \n\n Soups\n \n\n Bread\n \n\n Drinks\n \n\n Desserts\n \n\n View All\n \n\n\n\n\n\nIngredients\n\n\n\n\n\n\n\n\n\n\n\nIngredients\n\n\n\n Chicken\n \n\n Beef\n \n\n Pork\n \n\n Seafood\n \n\n Pasta\n \n\n Fruits\n \n\n Vegetables\n \n\n View All\n \n\n\n\n\n\nOccasions\n\n\n\n\n\n\n\n\n\n\n\nOccasions\n\n\n\n Kentucky Derby Recipes\n \n\n Cinco de Mayo Recipes\n \n\n Mother's Day Recipes\n \n\n Memorial Day Recipes\n \n\n View All\n \n\n\n\n\n\nCuisines\n\n\n\n\n\n\n\n\n\n\n\nCuisines\n\n\n\n Mexican\n \n\n Italian\n \n\n Chinese\n \n\n Indian\n \n\n German\n \n\n Greek\n \n\n Filipino\n \n\n Japanese\n \n\n View All\n \n\n\n\n\n\nKitchen Tips\n\n\n\n\n\n\n\n\n\n\n\nKitchen Tips\n\n\n\n Instant Pot\n \n\n Air Fryer\n \n\n Slow Cooker\n \n\n Our Favorite Products\n \n\n BBQ \u0026 Grilling\n \n\n Cooking by Equipment\n \n\n Ingredient Substitutions\n \n\n View All\n \n\n\n\n\n\nNews\n\n\n\n\n\n\n\n\n\n\n\nNews\n\n\n\n Celebrity \u0026 Entertainment\n \n\n Fast Food\n \n\n Grocery\n \n\n Recalls\n \n\n Trends\n \n\n View All\n \n\n\n\n\n\nFeatures\n\n\n\n\n\n\n\n\n\n\n\nFeatures\n\n\n\n Dinner Fix\n \n\n Sweet Spot\n \n\n In the Kitchen\n \n\n\n\n\n\nAbout Us\n\n\n\n\n\n\n\n\n\n\n\nAbout Us\n\n\n\n About Allrecipes\n \n\n Allstars\n \n\n How to Add a Recipe\n \n\n\n\n\n GET THE MAGAZINE\n \n\n \n\n\n\n\n\n\n\n \n\n\n\nLog In\n\n \n\n\nMy Account\n\n\n\n\n\n\n\n\n\n\n\nMy Account\n\n\n\n My Profile\n \n\n Add a Recipe\n \n\n Saved Recipes \u0026 Collections\n \n\n Account Settings\n \n\n Help\n \n\n Log Out\n \n\n\n\n\n\nMagazine\n\n\n\n\n\n\n\n\n\n\n\nMagazine\n\n\n\n Subscribe\n \n\n Manage Your Subscription\n \n\n Give a Gift Subscription\n \n\n Get Help\n \n\n\n\nNewsletters\n\n\n Sweepstakes\n \n\n\n\n\n\n\n\n\n\n\n\n\n\nFollow Us\n\n\n \n\n\n \n\n \n\n\n \n\n \n\n\n \n\n \n\n\n \n\n \n\n\n \n\n \n\n\n \n\n\n \n\n\n\n\n Dinners\n\n\n\n 5-Ingredient Dinners\n \n\n One-Pot Meals\n \n\n Quick \u0026 Easy\n \n\n 30-Minute Meals\n \n\n Family Dinners\n \n\n Soups, Stews \u0026 Chili\n \n\n Comfort Food\n \n\n Main Dishes\n \n\n Sheet Pan Dinners\n \n\n View All\n \n\n\n\n Meals\n\n\n\n Breakfast \u0026 Brunch\n \n\n Lunch\n \n\n Healthy\n \n\n Appetizers \u0026 Snacks\n \n\n Salads\n \n\n Side Dishes\n \n\n Soups\n \n\n Bread\n \n\n Drinks\n \n\n Desserts\n \n\n View All\n \n\n\n\n Ingredients\n\n\n\n Chicken\n \n\n Beef\n \n\n Pork\n \n\n Seafood\n \n\n Pasta\n \n\n Fruits\n \n\n Vegetables\n \n\n View All\n \n\n\n\n Occasions\n\n\n\n Kentucky Derby Recipes\n \n\n Cinco de Mayo Recipes\n \n\n Mother's Day Recipes\n \n\n Memorial Day Recipes\n \n\n View All\n \n\n\n\n Cuisines\n\n\n\n Mexican\n \n\n Italian\n \n\n Chinese\n \n\n Indian\n \n\n German\n \n\n Greek\n \n\n Filipino\n \n\n Japanese\n \n\n View All\n \n\n\n\n Kitchen Tips\n\n\n\n Instant Pot\n \n\n Air Fryer\n \n\n Slow Cooker\n \n\n Our Favorite Products\n \n\n BBQ \u0026 Grilling\n \n\n Cooking by Equipment\n \n\n Ingredient Substitutions\n \n\n View All\n \n\n\n\n News\n\n\n\n Celebrity \u0026 Entertainment\n \n\n Fast Food\n \n\n Grocery\n \n\n Recalls\n \n\n Trends\n \n\n View All\n \n\n\n\n Features\n\n\n\n Dinner Fix\n \n\n Sweet Spot\n \n\n In the Kitchen\n \n\n\n\n\n\n About Us\n\n\n\n The Allrecipes Allstars\n \n\n How to Add a Recipe\n \n\n\nGET THE MAGAZINE\n\n\nNever lose a recipe: Join MyRecipes to save and find favorites from AR \u0026 beyond\n\n\n\n\n\n\n\n\n\n\nRecipes\n\n\n\nBBQ \u0026 Grilling\n\n\n\nSeafood\n\n\n\nShrimp\n\nSpicy Grilled Shrimp\n\n\n\n\n\n\n\n\n\n\n\n\n\n\n\n\n\n4.6\n(1,154)\n876 Reviews\n92 Photos\nThis grilled shrimp recipe is fast and easy to prepare and destined to be the hit of any barbeque. And, weather not permitting, the shrimp cook up great under the broiler, too.\n\nSubmitted by\nSUBEAST\n\nUpdated on May 2, 2024\n\n\n\nTested by\n Allrecipes Test Kitchen\n \n\n\n\nTested by\nAllrecipes Test Kitchen\n \nThe Allrecipes Test Kitchen staff are a team of culinary pros who make and vet recipes using only equipment you'd find in a home kitchen. Staff credentials vary but include training at the Culinary Institute of America; kitchen stints in fine dining restaurants; and countless hours in the test kitchen itself.\n\n\n\nMeet the Allrecipes Test Kitchen\n\n\n\n\n \n \nSave\n\n\n\n\n\n\n\n\nRate\n\n\n\n\n\n \nPrint\n\n\n\n\n\n\n\n\n\n\nShare\n\n\n\n\n\n \n\n\n\n\n\n\n\n\n\n\n\n\n\n\n\n\n\n\n\n\n\n\n\n\n\n\n\n\n \n\n \n\n Add Photo\n\n\n\n\n92\n\n\n\n\u003cimg\nsrc=\"https://www.allrecipes.com/thmb/QdOqmkQbJ2dfsFZcfzFeY44UO1E=/160x90/filters:no_upscale():max_bytes(150000):strip_icc():format(webp)/AR-12775-Spicy-Grilled-Shrimp-DDMFS-4x3-beauty-8ed5ea13f67841c39c12341bacfeb466.jpg\"\nwidth=\"160\"\nheight=\"90\"\nclass=\"img--noscript photo mntl-image universal-image__image\"\nalt=\"A platter of spicy grilled shrimp served with lemon wedges\"\n/\u003e\n\n\n92\n\n\n\n92\n\n\n\n92\n\n\n\n \n\nPrep Time:\n15 mins\n\n\nCook Time:\n5 mins\n\n\nTotal Time:\n20 mins\n\n\nServings:\n6 \n\n\nJump to Nutrition Facts\n\n Jump to recipe\n\n\n\n\n Turn up the heat with this easy and spicy grilled shrimp recipe. \n\n\n  How to Grill Shrimp  \n Ready to learn how to make this grilled shrimp recipe? You'll find a detailed ingredient list and step-by-step instructions in the recipe below, but let's go over the basics:\n\n\n  Grilled Shrimp Ingredients  \n Here are the ingredients you’ll need to make this restaurant-worthy grilled shrimp: \n\n\n\nSeasonings: This spicy grilled shrimp recipe is flavored with garlic, coarse salt, paprika, and cayenne pepper.\nOil: Olive oil locks in the moisture and gives the seasonings something to stick to. \nLemon: You’ll need lemon juice for flavor and lemon wedges for the garnish. \nShrimp: Buy your shrimp pre-peeled and deveined or do it yourself at home. \n\n\n  How to Cook Shrimp On the Grill  \n Here’s a brief overview of what you can expect when you make spicy grilled shrimp recipe: \n\n\n Make a paste with the garlic, oil, seasonings, and lemon juice. Toss the shrimp in the garlic paste until evenly coated. Grill the shrimp, then garnish with lemon wedges before serving.\n\n\n  How Long to Grill Shrimp  \n On a lightly oiled grill grate over medium heat, the shrimp should be fully cooked after about 2-3 minutes on each side. You’ll know the shrimp is done when it’s opaque. \n\n\n  What to Serve With Grilled Shrimp   \n Looking for serving inspiration? Explore our collection of 13 Best Side Dishes for Shrimp That Really Complete the Meal. Here are a few of the tasty recipes you’ll find: \n\n\n\nGrilled Fruit and Vegetable Kabobs\nOven-Roasted Red Potatoes\nRoquefort Pear Salad\n\n\n  How to Store Grilled Shrimp Leftovers  \n Store your grilled shrimp leftovers in an airtight container in the refrigerator for up to three days. Put them to good use by tossing them in one of our favorite Shrimp Salads. \n\n\n  Allrecipes Community Tips and Praise   \n “Great recipe and taste,” raves Craig deFreese. “I let the shrimp marinate for 30-40 minutes without the lemon juice. Great balance of flavors.”\n\n\n “This is my go-to recipe for shrimp,” says one Allrecipes community member. “I have taken the ingredients camping with me every summer. This is the one recipe my son requests I use whenever we grill.”\n\n\n “I added mixed vegetables, scrambled eggs, and sweet and sour sauce to the grilled shrimp and then spooned it over a bed of rice,” says Michel Taylor.\n\n\n Editorial contributions by Corey Williams\n\n\n\n\n \n\n\n\nCook Mode\n(Keep screen awake)\n\nIngredients\n \n\n\n\n\n\n\n1x\n\n\n\n\n\n\n\n\n2x\n\n\n\n\n\n\n\n\n4x\n\n\n\n \n\n\n\nOops! Something went wrong. Our team is working on it.\n\n\n\nOriginal recipe (1X) yields 6 servings\n \n\n1 large clove garlic\n\n\n1 teaspoon coarse salt\n\n\n1 teaspoon paprika\n\n\n½ teaspoon cayenne pepper\n\n\n2 tablespoons olive oil\n\n\n2 teaspoons lemon juice\n\n\n2 pounds large shrimp, peeled and deveined\n\n\n8 wedges lemon, for garnish\n\n\n\nDirections\n\n\n Gather the ingredients. Preheat a grill for medium heat.\n\n \n\n\n\n\u003cimg\nsrc=\"https://www.allrecipes.com/thmb/toN4xt8cWgMjL-QM1IMdXeAKcic=/1500x0/filters:no_upscale():max_bytes(150000):strip_icc():format(webp)/AR-12775-Spicy-Grilled-Shrimp-DDMFS-4x3-ingredients-236aa616202d4567b819e26fb29690aa.jpg\"\nwidth=\"4000\"\nheight=\"3000\"\nclass=\"img--noscript mntl-image mntl-image universal-image__image\"\nsrcset=\"https://www.allrecipes.com/thmb/JqMkdxC9T15bJ-hb-yCYNyakE44=/750x0/filters:no_upscale():max_bytes(150000):strip_icc():format(webp)/AR-12775-Spicy-Grilled-Shrimp-DDMFS-4x3-ingredients-236aa616202d4567b819e26fb29690aa.jpg 750w\"\nsizes=\"750px\"\nalt=\"Ingredients to make spicy grilled shrimp\"\n/\u003e\n\n \n A platter of spicy grilled shrimp served with lemon wedges\n\n\n\n\n Crush garlic and salt together in a small bowl with a fork.\n\n \n\n\n\n\u003cimg\nsrc=\"https://www.allrecipes.com/thmb/5smR4gdJSgn1BWbOOCk-K44NBXc=/1500x0/filters:no_upscale():max_bytes(150000):strip_icc():format(webp)/AR-12775-Spicy-Grilled-Shrimp-DDMFS-4x3-step-01-3921929f2bf64403bbe9891fa846c9f1.jpg\"\nwidth=\"4000\"\nheight=\"3000\"\nclass=\"img--noscript mntl-image mntl-image universal-image__image\"\nsrcset=\"https://www.allrecipes.com/thmb/Ch3hCaVG75Ajadwy_bbT7XFI5LY=/750x0/filters:no_upscale():max_bytes(150000):strip_icc():format(webp)/AR-12775-Spicy-Grilled-Shrimp-DDMFS-4x3-step-01-3921929f2bf64403bbe9891fa846c9f1.jpg 750w\"\nsizes=\"750px\"\nalt=\"A small glass bowl of crushed garlic with a fork\"\n/\u003e\n\n \n Dotdash Meredith Food Studios\n\n\n\n\n Mix in paprika and cayenne. Stir in olive oil and lemon juice to form a paste.\n\n \n\n\n\n\u003cimg\nsrc=\"https://www.allrecipes.com/thmb/lCtiwtvO-senEuLDWzaVxvc0XFo=/1500x0/filters:no_upscale():max_bytes(150000):strip_icc():format(webp)/AR-12775-Spicy-Grilled-Shrimp-DDMFS-4x3-step-02-05a09e41ed3f4a56abab20ac12913fbc.jpg\"\nwidth=\"4000\"\nheight=\"3000\"\nclass=\"img--noscript mntl-image mntl-image universal-image__image\"\nsrcset=\"https://www.allrecipes.com/thmb/Ac1-JDgfv9duU7FdHh9ATeZY9I8=/750x0/filters:no_upscale():max_bytes(150000):strip_icc():format(webp)/AR-12775-Spicy-Grilled-Shrimp-DDMFS-4x3-step-02-05a09e41ed3f4a56abab20ac12913fbc.jpg 750w\"\nsizes=\"750px\"\nalt=\"A small glass bowl with spicy garlic sauce\"\n/\u003e\n\n \n Dotdash Meredith Food Studios\n\n\n\n\n Combine garlic paste and shrimp in a large bowl and toss until shrimp are evenly coated.\n\n \n\n\n\n\u003cimg\nsrc=\"https://www.allrecipes.com/thmb/QbXsHMGdpjeXWTlZaYLU-Nmp5Uc=/1500x0/filters:no_upscale():max_bytes(150000):strip_icc():format(webp)/AR-12775-Spicy-Grilled-Shrimp-DDMFS-4x3-step-03-73f773cee0f040b8aeca9bc93ab60976.jpg\"\nwidth=\"4000\"\nheight=\"3000\"\nclass=\"img--noscript mntl-image mntl-image universal-image__image\"\nsrcset=\"https://www.allrecipes.com/thmb/00Uc2xldoawNJig0ZgoBS_AiPqs=/750x0/filters:no_upscale():max_bytes(150000):strip_icc():format(webp)/AR-12775-Spicy-Grilled-Shrimp-DDMFS-4x3-step-03-73f773cee0f040b8aeca9bc93ab60976.jpg 750w\"\nsizes=\"750px\"\nalt=\"A glass bowl with shrimp coated in spicy garlic sauce\"\n/\u003e\n\n \n Dotdash Meredith Food Studios\n\n\n\n\n Lightly oil the grill grate. Grill shrimp until opaque, 2 to 3 minutes per side.\n\n \n\n\n\n\u003cimg\nsrc=\"https://www.allrecipes.com/thmb/rKLy_iH_twtxVnobGl4rt369AIU=/1500x0/filters:no_upscale():max_bytes(150000):strip_icc():format(webp)/AR-12775-Spicy-Grilled-Shrimp-DDMFS-4x3-step-04-0eeacd8e748b4356a879f8b57a9a35c6.jpg\"\nwidth=\"4000\"\nheight=\"3000\"\nclass=\"img--noscript mntl-image mntl-image universal-image__image\"\nsrcset=\"https://www.allrecipes.com/thmb/1_hjIgpEXB0Li9TdVBC7fzJJV3w=/750x0/filters:no_upscale():max_bytes(150000):strip_icc():format(webp)/AR-12775-Spicy-Grilled-Shrimp-DDMFS-4x3-step-04-0eeacd8e748b4356a879f8b57a9a35c6.jpg 750w\"\nsizes=\"750px\"\nalt=\"Shrimp coated in spicy garlic sauce being grilled on grill grates\"\n/\u003e\n\n \n Dotdash Meredith Food Studios\n\n\n\n\n Transfer to a serving dish, garnish with lemon wedges, and serve.\n\n \n\n\n\n\u003cimg\nsrc=\"https://www.allrecipes.com/thmb/Ndt1OLJVNxdqt21aMPYCeJvjcaE=/1500x0/filters:no_upscale():max_bytes(150000):strip_icc():format(webp)/AR-12775-Spicy-Grilled-Shrimp-DDMFS-4x3-beauty-8ed5ea13f67841c39c12341bacfeb466.jpg\"\nwidth=\"4000\"\nheight=\"3000\"\nclass=\"img--noscript mntl-image mntl-image universal-image__image\"\nsrcset=\"https://www.allrecipes.com/thmb/whdwVTAq37bMK58g6defQ9nuccA=/750x0/filters:no_upscale():max_bytes(150000):strip_icc():format(webp)/AR-12775-Spicy-Grilled-Shrimp-DDMFS-4x3-beauty-8ed5ea13f67841c39c12341bacfeb466.jpg 750w\"\nsizes=\"750px\"\nalt=\"A platter of spicy grilled shrimp served with lemon wedges\"\n/\u003e\n\n \n Dotdash Meredith Food Studios\n\n\n\n\n  Editor's Note:  \n The salt amount has been reduced based on review feedback. The original recipe called for 1 tablespoon.\n\n I Made It\n\n\n\n\n \nPrint\n\n\n\n\n\n\n\n1,543\nhome cooks made it!\n\nNutrition Facts (per serving)\n\n\n\n164\nCalories\n\n\n6g \nFat\n\n\n3g \nCarbs\n\n\n25g \nProtein\n\n\n\n\n\n \nShow Full Nutrition Label\nHide Full Nutrition Label\n\n\n\n\n\n\nNutrition Facts\n\n\n\nServings Per Recipe\n6\n\n\n\n\nCalories\n164\n\n\n\n\n\n% Daily Value *\n\n\n\nTotal Fat\n6g\n\n\n8%\n\n\n\n\nSaturated Fat\n1g\n\n\n5%\n\n\n\n\nCholesterol\n230mg\n\n\n77%\n\n\n\n\nSodium\n586mg\n\n\n25%\n\n\n\n\nTotal Carbohydrate\n3g\n\n\n1%\n\n\n\n\nDietary Fiber\n1g\n\n\n4%\n\n\n\n\nTotal Sugars\n0g\n\n\n\n\nProtein\n25g\n\n\n50%\n\n\n\n\nVitamin C\n18mg\n\n\n20%\n\n\n\n\nCalcium\n60mg\n\n\n5%\n\n\n\n\nIron\n4mg\n\n\n22%\n\n\n\n\nPotassium\n259mg\n\n\n6%\n\n\n\n\n* Percent Daily Values are based on a 2,000 calorie diet. Your daily values may be higher or lower depending on your calorie needs.\n** Nutrient information is not available for all ingredients. Amount is based on available nutrient data.\n(-) Information is not currently available for this nutrient. If you are following a medically restrictive diet, please consult your doctor or registered dietitian before preparing this recipe for personal consumption. \n\n\n\n\n\n\n\n\n\n\n\n\n\n\n\n\n\n\n\n\n\n\n\n\n\n\n\n\n \n\n\n\n\n\n\n\n\n Add Your Photo\n\n\n\n\n \nPhotos of Spicy Grilled Shrimp\n \n01\nof 92\n\n\n\n\n\n\n\u003cimg\nsrc=\"https://www.allrecipes.com/thmb/7I6qWcCtMzT_PEUlbRSIRDhYsZY=/0x512/filters:no_upscale():max_bytes(150000):strip_icc():format(webp)/AR-12775-Spicy-Grilled-Shrimp-DDMFS-4x3-beauty-8ed5ea13f67841c39c12341bacfeb466.jpg\"\nwidth=\"4000\"\nheight=\"3000\"\nclass=\"img--noscript universal-image__image\"\nalt=\"A platter of spicy grilled shrimp served with lemon wedges\"\n/\u003e\n\n\n\n\n\n\n\nPhoto by \nDotdash Meredith Food Studios\n\n \n\n \n02\nof 92\n\n\n\n\n\n\n\n\n\n\n\nPhoto by \nBriefCod8166\n\n\n\n\n\n\n\n\n\n\n\n\n\n\n\n\n\n12/16/2022\nI pan fried mine, but, it was quite delicious. A little salty, but, perfect amount of spice! I will make this again. \n\n \n03\nof 92\n\n\n\n\n\n\n\n\n\n\n\nPhoto by \nDom Dumais\n\n\n\n\n\n\n\n\n\n\n\n\n\n\n\n\n\n09/22/2021\nI just made this on the grill for my wife and I. It was amazing. Thank you. \n\n \n04\nof 92\n\n\n\n\n\n\n\n\n\n\n\nPhoto by \nmichele\n\n\n\n\n\n\n\n\n\n\n\n\n\n\n\n\n\n04/25/2021\nvery good marinade! not too spicy but has a zip to it. thank you for the recipe, will definitely use again \n\n \n05\nof 92\n\n\n\n\n\n\n\n\n\n\n\nPhoto by \nAmalia\n04/17/2021\n \n\n \n06\nof 92\n\n\n\n\n\n\n\n\n\n\n\nPhoto by \nPauline T\n\n\n\n\n\n\n\n\n\n\n\n\n\n\n\n\n\n12/24/2020\nMade exactly as the recipe states. Delicious! \n\n \n07\nof 92\n\n\n\n\n\n\n\n\n\n\n\nPhoto by \nsuepat8126\n10/19/2020\n \n\n \n08\nof 92\n\n\n\n\n\n\n\n\n\n\n\nPhoto by \nsuepat8126\n10/19/2020\n \n\n \n09\nof 92\n\n\n\n\n\n\n\n\n\n\n\nPhoto by \nMamaMia57\n10/10/2020\n \n\n \n10\nof 92\n\n\n\n\n\n\n\n\n\n\n\nPhoto by \nRay\n08/17/2020\n \n\n\n1\n\n\n2\n\n\n3\n\n\n4\n\n\n5\n\n\n\nNext\n\n\n\n\n\n\n \n\n\n\n\n\nYou’ll Also Love\n\n\n\n\n\n\u003cimg\nsrc=\"https://www.allrecipes.com/thmb/-iIg_0D_uVy8-tfVF8-Zr958bm8=/282x188/filters:no_upscale():max_bytes(150000):strip_icc():format(webp)/1072828-maui-wowie-shrimp-Sherri-4x3-1-1da1897b573b420cb5f26fb58546fede.jpg\"\nwidth=\"282\"\nheight=\"188\"\nclass=\"img--noscript card__img universal-image__image\"\nalt=\"close up view of shrimp with fresh herbs on a white plate\"\n/\u003e\n\n\n\n \n\n\n\n\n\n\n\n\nMaui Wowie Shrimp\n\n\n\n\n\n\n\n\n\n\n\n\n\n\n\n\n\n\n\n66\n\nRatings\n\n\n \n\n\n\n\n\n\n\u003cimg\nsrc=\"https://www.allrecipes.com/thmb/nrMzpKmjE_rT8PTKJIcddudQiYo=/282x188/filters:no_upscale():max_bytes(150000):strip_icc():format(webp)/945189-5aa94753cc6b48debcc14489964c95c1.jpg\"\nwidth=\"282\"\nheight=\"188\"\nclass=\"img--noscript card__img universal-image__image\"\n/\u003e\n\n\n\n \n\n\n\n\n\n\n\n\nGarlicky Appetizer Shrimp Scampi\n\n\n\n\n\n\n\n\n\n\n\n\n\n\n\n\n\n\n\n183\n\nRatings\n\n\n \n\n\n\n\n\n\n\u003cimg\nsrc=\"https://www.allrecipes.com/thmb/21UkG_uRaBRo4OvM3y91dW9c1Q8=/282x188/filters:no_upscale():max_bytes(150000):strip_icc():format(webp)/997347-d2ff07998f4e45dd96a2c3b9a128c74e.jpg\"\nwidth=\"282\"\nheight=\"188\"\nclass=\"img--noscript card__img universal-image__image\"\n/\u003e\n\n\n\n \n\n\n\n\n\n\n\n\nFirecracker Grilled Alaska Salmon\n\n\n\n\n\n\n\n\n\n\n\n\n\n\n\n\n\n\n\n1,353\n\nRatings\n\n\n \n\n\n\n\n\n\n\u003cimg\nsrc=\"https://www.allrecipes.com/thmb/jlt0d74lvbUz-LZ6t33K_fGXzSk=/282x188/filters:no_upscale():max_bytes(150000):strip_icc():format(webp)/811142-amazing-spicy-grilled-shrimp-Sherri-1x1-1-e1085e93817b4cccbadd23e0adbd828d.jpg\"\nwidth=\"282\"\nheight=\"188\"\nclass=\"img--noscript card__img universal-image__image\"\nalt=\"close up view of Spicy Grilled Shrimp skewers on a white plate\"\n/\u003e\n\n\n\n \n\n\n\n\n\n\n\n\nAmazing Spicy Grilled Shrimp\n\n\n\n\n\n\n\n\n\n\n\n\n\n\n\n\n\n\n\n292\n\nRatings\n\n\n \n\n\n\n\n\n\n\u003cimg\nsrc=\"https://www.allrecipes.com/thmb/IUlMQtuBSf-wY3yqZtcdmemhh6Q=/282x188/filters:no_upscale():max_bytes(150000):strip_icc():format(webp)/341432-41b949153c7043cfa12d73ae2559dead.jpg\"\nwidth=\"282\"\nheight=\"188\"\nclass=\"img--noscript card__img universal-image__image\"\n/\u003e\n\n\n\n \n\n\n\n\n\n\n\n\nGrilled Salmon Fillets with a Lemon, Tarragon, and Garlic Sauce\n\n\n\n\n\n\n\n\n\n\n\n\n\n\n\n\n\n\n\n108\n\nRatings\n\n\n \n\n\n\n\n\n\n\u003cimg\nsrc=\"https://www.allrecipes.com/thmb/pWIEbePXDxWNUxYQBkDs83m5oZk=/282x188/filters:no_upscale():max_bytes(150000):strip_icc():format(webp)/143394-grilled-garlic-and-herb-shrimp-DDMFS-4x3-b4b4d4aab3a84cb5b071f3f1988431d5.jpg\"\nwidth=\"282\"\nheight=\"188\"\nclass=\"img--noscript card__img universal-image__image\"\nalt=\"looking at grilled garlic and herb shrimp on skewers with a lemon wedge on a platter \"\n/\u003e\n\n\n\n \n\n\n\n\n\n\n\n\nGrilled Garlic and Herb Shrimp\n\n\n\n\n\n\n\n\n\n\n\n\n\n\n\n\n\n\n\n388\n\nRatings\n\n\n \n\n\n\n\n\n\n\u003cimg\nsrc=\"https://www.allrecipes.com/thmb/SR-qQ1Bye6Yy7m9Ubgjn_tLq4Uw=/282x188/filters:no_upscale():max_bytes(150000):strip_icc():format(webp)/AR-221090-grilled-lemon-yogurt-chicken-4x3-6c457bbbe1f94ca7b445b6410fb6b1fe.jpg\"\nwidth=\"282\"\nheight=\"188\"\nclass=\"img--noscript card__img universal-image__image\"\nalt=\"A plate of grilled lemon yogurt chicken, served with a lemon wedge\"\n/\u003e\n\n\n\n \n\n\n\n\n\n\n\n\nGrilled Greek Yogurt Marinated Chicken\n\n\n\n\n\n\n\n\n\n\n\n\n\n\n\n\n\n\n\n214\n\nRatings\n\n\n \n\n\n\n\n\n\n\u003cimg\nsrc=\"https://www.allrecipes.com/thmb/Bux7Jfghgm2kL2BcN_ZIvA8JVGU=/282x188/filters:no_upscale():max_bytes(150000):strip_icc():format(webp)/5493511-695e179ff4534955b45d9cb42243deb9.jpg\"\nwidth=\"282\"\nheight=\"188\"\nclass=\"img--noscript card__img universal-image__image\"\n/\u003e\n\n\n\n \n\n\n\n\n\n\n\n\nShrimp Foil Packets\n\n\n\n\n\n\n\n\n\n\n\n\n\n\n\n\n\n\n\n4\n\nRatings\n\n\n \n\n\n\n\n\n\n\n\n\n\u003cimg\nsrc=\"https://www.allrecipes.com/thmb/UfrgW9TvEURoeN-riOPUEsJPHxw=/282x188/filters:no_upscale():max_bytes(150000):strip_icc():format(webp)/649895-edceec6636bb4c9da50aab49dd55622b.jpg\"\nwidth=\"282\"\nheight=\"188\"\nclass=\"img--noscript card__img universal-image__image\"\n/\u003e\n\n\n\n \n\n\n\n\n\n\n\n\nThe Juiciest Hamburgers Ever\n\n\n\n\n\n\n\n\n\n\n\n\n\n\n\n\n\n\n\n78\n\nRatings\n\n\n \n\n\n\n\n\n\n\u003cimg\nsrc=\"https://www.allrecipes.com/thmb/IDqKNW1VAJA5HiEfY1XiQWqxl94=/282x188/filters:no_upscale():max_bytes(150000):strip_icc():format(webp)/6847986-b1ab4295113d4dfbbfffa7f73825e62a.jpg\"\nwidth=\"282\"\nheight=\"188\"\nclass=\"img--noscript card__img universal-image__image\"\n/\u003e\n\n\n\n \n\n\n\n\n\n\n\n\nSimply Swordfish\n\n\n\n\n\n\n\n\n\n\n\n\n\n\n\n\n\n\n\n92\n\nRatings\n\n\n \n\n\n\n\n\n\n\u003cimg\nsrc=\"https://www.allrecipes.com/thmb/1FlnfTe5myuo9A5epdp2ayc0ITw=/282x188/filters:no_upscale():max_bytes(150000):strip_icc():format(webp)/2275687-77a1417155f748edbc8ad4179220e087.jpg\"\nwidth=\"282\"\nheight=\"188\"\nclass=\"img--noscript card__img universal-image__image\"\n/\u003e\n\n\n\n \n\n\n\n\n\n\n\n\nFire and Ice Smoked Salmon\n\n\n\n\n\n\n\n\n\n\n\n\n\n\n\n\n\n\n\n13\n\nRatings\n\n\n \n\n\n\n\n\n\n\u003cimg\nsrc=\"https://www.allrecipes.com/thmb/Vat-FYdQ4UYhS6zAc942iPbOGzg=/282x188/filters:no_upscale():max_bytes(150000):strip_icc():format(webp)/8286227-1dec02e265044ba690ffe4358622d9e2.jpg\"\nwidth=\"282\"\nheight=\"188\"\nclass=\"img--noscript card__img universal-image__image\"\n/\u003e\n\n\n\n \n\n\n\n\n\n\n\n\nEasy Grilled Shrimp\n\n\n\n\n\n\n\n\n\n\n\n\n\n\n\n\n\n\n\n1\n\nRating\n\n\n \n\n\n\n\n\n\n\u003cimg\nsrc=\"https://www.allrecipes.com/thmb/5QIfPzoqZMk3_iAR1kDJ_6bgGU4=/282x188/filters:no_upscale():max_bytes(150000):strip_icc():format(webp)/6785531-grilled-marinated-shrimp-Pat-J-1x1-1-3069b253b7ab43be9eafb468f96d2eec.jpg\"\nwidth=\"282\"\nheight=\"188\"\nclass=\"img--noscript card__img universal-image__image\"\nalt=\"close up view of Grilled Marinated Shrimp on skewers on a white platter\"\n/\u003e\n\n\n\n \n\n\n\n\n\n\n\n\nGrilled Marinated Shrimp\n\n\n\n\n\n\n\n\n\n\n\n\n\n\n\n\n\n\n\n1,710\n\nRatings\n\n\n \n\n\n\n\n\n\n\u003cimg\nsrc=\"https://www.allrecipes.com/thmb/NVhLBB040CjgexR3If8YHJyTzXU=/282x188/filters:no_upscale():max_bytes(150000):strip_icc():format(webp)/14527greek-chickenfabeveryday-886517f304824d9993a79b7665f3585c.jpg\"\nwidth=\"282\"\nheight=\"188\"\nclass=\"img--noscript card__img universal-image__image\"\nalt=\"Greek chicken on white plate with twigs of rosemary and half a lemon\"\n/\u003e\n\n\n\n \n\n\n\n\n\n\n\n\nGreek Chicken\n\n\n\n\n\n\n\n\n\n\n\n\n\n\n\n\n\n\n\n495\n\nRatings\n\n\n \n\n\n\n\n\n\n\u003cimg\nsrc=\"https://www.allrecipes.com/thmb/iBQC2u3_yXCccPAc6_YlmoaueGA=/282x188/filters:no_upscale():max_bytes(150000):strip_icc():format(webp)/2049210-7d4d39108c324fb282be8030be63559b.jpg\"\nwidth=\"282\"\nheight=\"188\"\nclass=\"img--noscript card__img universal-image__image\"\n/\u003e\n\n\n\n \n\n\n\n\n\n\n\n\nChef John's Grilled Jerk Pork Tenderloin\n\n\n\n\n\n\n\n\n\n\n\n\n\n\n\n\n\n\n\n44\n\nRatings\n\n\n \n\n\n\n\n\n\n\u003cimg\nsrc=\"https://www.allrecipes.com/thmb/u0bvj1xB7K_n68CXYC9sZXY6sqU=/282x188/filters:no_upscale():max_bytes(150000):strip_icc():format(webp)/36996-Grilled-Rock-Lobsters-109-4x3-fb4e7e3c2ea34a5b8de9caf3697ed5b9.jpg\"\nwidth=\"282\"\nheight=\"188\"\nclass=\"img--noscript card__img universal-image__image\"\nalt=\"Looking at a plate of two grilled rock lobster. \"\n/\u003e\n\n\n\n \n\n\n\n\n\n\n\n\nGrilled Lobster Tails\n\n\n\n\n\n\n\n\n\n\n\n\n\n\n\n\n\n\n\n487\n\nRatings\n\n\n \n\n\n\n\n \n\n\n Allrecipes\n\n\n \nNewsletters\n \n\nFollow Us\n\n\n \n\n\n \n\n \n\n\n \n\n \n\n\n \n\n \n\n\n \n\n \n\n\n \n\n \n\n\n \n\n \n\n\nDinners\nMeals\nIngredients\nOccasions\nCuisines\nKitchen Tips\nNews\nFeatures \n About Us\n \n\n Editorial Process\n \n\n Privacy Policy\n \n\n Product Vetting\n \n\n Terms of Service\n \n\n Advertise\n \n\n Careers\n \n\n Contact\n \n\n Your Privacy Choices\n  \n\n\n\n \n\n \n\n \n \n\n \n\n\n\n\n\nAllrecipes\nis part of the Dotdash Meredith publishing family.\n\n\n\n\n \n\n\nDialog Heading\n\n\n\n\n\n\n\n \n\n\n \n\n\nNewsletter Sign Up\n\n\n\n\n\n\n\n \n\n \n\n\nNewsletter Sign Up\n\n\n\n\n\n\n\n \n\n\n\n\n\n\n\n\n\n\nMntl.utilities.scriptsOnLoad(document.querySelectorAll('script[data-glb-js=\"bottom\"]'), function() {\nvar Mntl = window.Mntl || {};\nwindow.Mntl = window.Mntl || {};\nwindow.Mntl.affiliatePlugins = window.Mntl.affiliatePlugins || [];\nwindow.Mntl.affiliateLinkRewriter.setMappings( {\nDOC_ID: '6649139'\n,SITE: 'allrecipes'\n,REQUEST_ID: 'nc66a590317a74d42b3706ef9a31c9e0002'\n}\n);\nwindow.Mntl.affiliatePlugins.push(window.Mntl.affiliateLinkRewriter.processLink);window.Mntl.externalizeLinks.init();(function (Mntl) {\nMntl.digioh = {\nscript: null,\nbrandId: null,\ninitialized: false,\ninit() {\nif (this.initialized) return;\nconst brandId = '47b4a4dd-ffd7-43db-8118-8002b7c15352';\nconst digiohFastActivation = 'false';\nconst lightboxJs = digiohFastActivation === 'true' ? '/lightbox_speed.js' : '/lightbox_inline.js';\n// eslint-disable-next-line prefer-template\nconst script = 'https://www.lightboxcdn.com/vendor/' + brandId + lightboxJs;\nthis.brandId = brandId;\nthis.script = script;\nthis.initialized = true;\n},\nload(callback) {\nthis.init();\nif (callback) {\nMntl.utilities.loadExternalJS({ src: this.script }, callback);\n} else {\nMntl.utilities.loadExternalJS({ src: this.script });\n}\n}\n};\n})(window.Mntl || {});\nMntl.digiohTimerDelay = parseFloat('0') * 1000;\n(function(Mntl) {\nconst setup = {\"clickToInitialize\":false,\"skin\":{\"name\":\"mantle\"},\"mute\":true,\"advertising\":{\"client\":\"googima\",\"vpaidmode\":\"enabled\",\"rules\":{\"frequency\":1},\"forceNonLinearFullSlot\":true,\"vpaidcontrols\":true,\"autoplayadsmuted\":true},\"autostart\":true,\"mediaid\":\"q9HZCGso\",\"preload\":\"metadata\",\"autoPause\":{\"pauseAds\":true,\"viewability\":true},\"aspectratio\":\"16:9\",\"pauseotherplayers\":\"true\",\"cast\":{},\"recsPlaylistId\":\"ZBQZ5egR\",\"width\":\"100%\"};\n// JW player requires `playlist` to be populated for contextual playlists\nsetup.playlist = setup.playlistUrl;\nconst isImmediateAutoplay = true;\nconst playInView = 30;\nconst encodedPageURL = encodeURIComponent(window.location);\nconst domain = Mntl.utilities.getDomain();\nconst iuPath = '/' + Mntl.GPT.getDfpId() + '/ddm.' + domain.replace('.com', '.video') + (Mntl.GPT.isMobile() ? '.mob' : '');\nfunction formatAdSizeArray(sizeArr) {\nreturn sizeArr.map(function(sz) {\nreturn sz.join('x');\n}).join('|');\n}\n// Assign a randomly-generated, eight character, alpha-numeric value to this property.\nsetup.advertising.adscheduleid = Math.random().toString(36).substr(2,8);\n// muid - used for audience targeting\nsetup.advertising.ppid = '1c3c8ae2-1783-4930-8ca6-55534b7286b2';\nlet custParams = '';\ncustParams += '\u0026' + encodeURIComponent('slot') + '=' + encodeURIComponent('primary');\nconst inFocus = window \u0026\u0026 window.document \u0026\u0026 window.document.hasFocus();\nconst durationParams = Mntl.JWPlayer.getDurationParams(152065, false);\ncustParams += '\u0026ttid=' + setup.mediaid;\ncustParams += '\u0026play=' + Mntl.JWPlayer.getCustomPlayValue(setup.autostart, isImmediateAutoplay, playInView);\ncustParams += '\u0026in_focus=' + inFocus;\ncustParams += '\u0026videoduration=' + durationParams.duration;\ncustParams += '\u0026duration_over=' + durationParams.durationOver;\ncustParams += '\u0026duration_under=' + durationParams.durationUnder;\ncustParams += '\u0026frnch=' + 'Recipes in Motion';\ncustParams += '\u0026tags=' + encodeURIComponent(\"live,vp_allrecipes,ramp,rim,12/11/12\");\nsetup.advertising.schedule = [{\n\"offset\": \"pre\",\n\"tag\": [\n'https://securepubads.g.doubleclick.net/gampad/ads?',\n'sz=',\nformatAdSizeArray([[640, 360]]),\n'\u0026iu=',\niuPath,\n'\u0026env=vp\u0026hl=en\u0026gdfp_req=1\u0026impl=s\u0026output=xml_vast2\u0026unviewed_position_start=1\u0026lid=',\n'\u0026url=',\nencodedPageURL,\n'\u0026description_url=',\nencodedPageURL,\n'\u0026correlator=',\nMath.floor(Date.now() / 1000),\n'\u0026cust_params=',\nMntl.GPT.serializeAllTargeting(),\nencodeURIComponent(custParams),\n'\u0026ad_rule=1'\n].join('')\n}];\nMntl.JWPlayer.init({\naccountKey: \"oxY0/BqWBX09BISmLN4/xuTz4IdZy713Cdjj4GyHOiYCUCyJ\",\nadSizes: [[640, 360]],\ndefer: true,\ndeferOnRFDS: true,\ndisplayMode: \"none\",\ndivId: \"article__primary-video-jw_1-0\",\nenableBiddingWithTCData: false,\nenableTVPEngagementBtns: false,\neventCategoryType: \"Primary\",\nintersectionMargin: \"250px\",\nisImmediateAutoplay: isImmediateAutoplay,\nisImmediateStickyDisabled: false,\nisIntersectionDisabled: true,\nisMobileAdhesive: false,\nisBroadVideo: false,\nisPlaylist: false,\nmediaSize: 1080,\nplayerId: \"aiy6MJ4O\",\nplayInView: playInView,\nshowCaptions: true,\nslot: \"primary\",\nrtbVideoConfig: {\"maxduration\":60,\"minduration\":0,\"plcmt\":2},\nuseDynamicVideoSizes: true,\nskipExistingMediaContent: false,\nstickyplay: true,\nuseMotionThumbnails: false\n}, setup );\n}(window.Mntl || {}));\n(function(Mntl) {\nMntl.Tooltip.init({\ndefaultPositionX: \"auto\",\ndefaultPositionY: \"auto\"\n});\n})(window.Mntl || {});\n});\n\n\nBy clicking “Accept All Cookies”, you agree to the storing of cookies on your device to enhance site navigation, analyze site usage, and assist in our marketing efforts. Cookies Settings Accept All Cookies",
  "url": "https://www.allrecipes.com/recipe/12775/spicy-grilled-shrimp",
  "image": "https://www.allrecipes.com/thmb/Yqwd7DLvmuT-UfO0xCRWD0AJ5II=/1500x0/filters:no_upscale():max_bytes(150000):strip_icc()/AR-12775-Spicy-Grilled-Shrimp-DDMFS-2x1-beauty-d113874b9f8d4521ac6a958f7c2b700a.jpg",
  "name": "SUBEAST",
  "prep_time": "15 min",
  "cook_time": "5 min",
  "total_time": "20 min",
  "calories": "164",
  "servings": "6",
  "ingredients": "Seasonings: This spicy grilled shrimp recipe is flavored with garlic, coarse salt, paprika, and cayenne pepper.;Oil: Olive oil locks in the moisture and gives the seasonings something to stick to.;Lemon: You’ll need lemon juice for flavor and lemon wedges for the garnish.;Shrimp: Buy your shrimp pre-peeled and deveined or do it yourself at home.",
  "instructions": "Make a paste with the garlic, oil, seasonings, and lemon juice.;Toss the shrimp in the garlic paste until evenly coated.;Grill the shrimp, then garnish with lemon wedges before serving.;Gather the ingredients. Preheat a grill for medium heat. \u003cimg src=\"https://www.allrecipes.com/thmb/toN4xt8cWgMjL-QM1IMdXeAKcic=/1500x0/filters:no_upscale():max_bytes(150000):strip_icc():format(webp)/AR-12775-Spicy-Grilled-Shrimp-DDMFS-4x3-ingredients-236aa616202d4567b819e26fb29690aa.jpg\" width=\"4000\" height=\"3000\" class=\"img--noscript mntl-image mntl-image universal-image__image\" srcset=\"https://www.allrecipes.com/thmb/JqMkdxC9T15bJ-hb-yCYNyakE44=/750x0/filters:no_upscale():max_bytes(150000):strip_icc():format(webp)/AR-12775-Spicy-Grilled-Shrimp-DDMFS-4x3-ingredients-236aa616202d4567b819e26fb29690aa.jpg 750w\" sizes=\"750px\" alt=\"Ingredients to make spicy grilled shrimp\" /\u003e A platter of spicy grilled shrimp served with lemon wedges;Crush garlic and salt together in a small bowl with a fork. \u003cimg src=\"https://www.allrecipes.com/thmb/5smR4gdJSgn1BWbOOCk-K44NBXc=/1500x0/filters:no_upscale():max_bytes(150000):strip_icc():format(webp)/AR-12775-Spicy-Grilled-Shrimp-DDMFS-4x3-step-01-3921929f2bf64403bbe9891fa846c9f1.jpg\" width=\"4000\" height=\"3000\" class=\"img--noscript mntl-image mntl-image universal-image__image\" srcset=\"https://www.allrecipes.com/thmb/Ch3hCaVG75Ajadwy_bbT7XFI5LY=/750x0/filters:no_upscale():max_bytes(150000):strip_icc():format(webp)/AR-12775-Spicy-Grilled-Shrimp-DDMFS-4x3-step-01-3921929f2bf64403bbe9891fa846c9f1.jpg 750w\" sizes=\"750px\" alt=\"A small glass bowl of crushed garlic with a fork\" /\u003e Dotdash Meredith Food Studios;Mix in paprika and cayenne. Stir in olive oil and lemon juice to form a paste. \u003cimg src=\"https://www.allrecipes.com/thmb/lCtiwtvO-senEuLDWzaVxvc0XFo=/1500x0/filters:no_upscale():max_bytes(150000):strip_icc():format(webp)/AR-12775-Spicy-Grilled-Shrimp-DDMFS-4x3-step-02-05a09e41ed3f4a56abab20ac12913fbc.jpg\" width=\"4000\" height=\"3000\" class=\"img--noscript mntl-image mntl-image universal-image__image\" srcset=\"https://www.allrecipes.com/thmb/Ac1-JDgfv9duU7FdHh9ATeZY9I8=/750x0/filters:no_upscale():max_bytes(150000):strip_icc():format(webp)/AR-12775-Spicy-Grilled-Shrimp-DDMFS-4x3-step-02-05a09e41ed3f4a56abab20ac12913fbc.jpg 750w\" sizes=\"750px\" alt=\"A small glass bowl with spicy garlic sauce\" /\u003e Dotdash Meredith Food Studios;Combine garlic paste and shrimp in a large bowl and toss until shrimp are evenly coated. \u003cimg src=\"https://www.allrecipes.com/thmb/QbXsHMGdpjeXWTlZaYLU-Nmp5Uc=/1500x0/filters:no_upscale():max_bytes(150000):strip_icc():format(webp)/AR-12775-Spicy-Grilled-Shrimp-DDMFS-4x3-step-03-73f773cee0f040b8aeca9bc93ab60976.jpg\" width=\"4000\" height=\"3000\" class=\"img--noscript mntl-image mntl-image universal-image__image\" srcset=\"https://www.allrecipes.com/thmb/00Uc2xldoawNJig0ZgoBS_AiPqs=/750x0/filters:no_upscale():max_bytes(150000):strip_icc():format(webp)/AR-12775-Spicy-Grilled-Shrimp-DDMFS-4x3-step-03-73f773cee0f040b8aeca9bc93ab60976.jpg 750w\" sizes=\"750px\" alt=\"A glass bowl with shrimp coated in spicy garlic sauce\" /\u003e Dotdash Meredith Food Studios;Lightly oil the grill grate. Grill shrimp until opaque, 2 to 3 minutes per side. \u003cimg src=\"https://www.allrecipes.com/thmb/rKLy_iH_twtxVnobGl4rt369AIU=/1500x0/filters:no_upscale():max_bytes(150000):strip_icc():format(webp)/AR-12775-Spicy-Grilled-Shrimp-DDMFS-4x3-step-04-0eeacd8e748b4356a879f8b57a9a35c6.jpg\" width=\"4000\" height=\"3000\" class=\"img--noscript mntl-image mntl-image universal-image__image\" srcset=\"https://www.allrecipes.com/thmb/1_hjIgpEXB0Li9TdVBC7fzJJV3w=/750x0/filters:no_upscale():max_bytes(150000):strip_icc():format(webp)/AR-12775-Spicy-Grilled-Shrimp-DDMFS-4x3-step-04-0eeacd8e748b4356a879f8b57a9a35c6.jpg 750w\" sizes=\"750px\" alt=\"Shrimp coated in spicy garlic sauce being grilled on grill grates\" /\u003e Dotdash Meredith Food Studios;Transfer to a serving dish, garnish with lemon wedges, and serve. \u003cimg src=\"https://www.allrecipes.com/thmb/Ndt1OLJVNxdqt21aMPYCeJvjcaE=/1500x0/filters:no_upscale():max_bytes(150000):strip_icc():format(webp)/AR-12775-Spicy-Grilled-Shrimp-DDMFS-4x3-beauty-8ed5ea13f67841c39c12341bacfeb466.jpg\" width=\"4000\" height=\"3000\" class=\"img--noscript mntl-image mntl-image universal-image__image\" srcset=\"https://www.allrecipes.com/thmb/whdwVTAq37bMK58g6defQ9nuccA=/750x0/filters:no_upscale():max_bytes(150000):strip_icc():format(webp)/AR-12775-Spicy-Grilled-Shrimp-DDMFS-4x3-beauty-8ed5ea13f67841c39c12341bacfeb466.jpg 750w\" sizes=\"750px\" alt=\"A platter of spicy grilled shrimp served with lemon wedges\" /\u003e Dotdash Meredith Food Studios",
  "source_site": "www.allrecipes.com",
  "crawl_date": "2025-04-25T22:24:20.5170013-04:00"
}