{
  "id": "Q3ikC_1HR",
  "title": "Authentic German Potato Salad Recipe",
  "description": "Bacon gives this warm German potato salad recipe a boost of flavor. Vinegar and sugar in the dressing are the perfect combination of salty and sweet.",
  "body": "​ \n\n \n\n \n\n \n\n \n\n \n\n \n\n \n\n \n\n \n\n \n\n \n\n \n\n \n\n \n\n \n\n \n\n \n\n \n\n \n\n \n\n \n\n \n\n \n\n \n\n \n\n \n\n \n\n \n\n\n\n\n\u003ciframe src=\"//www.googletagmanager.com/ns.html?id=GTM-P3X3VT7\" height=\"0\" width=\"0\" style=\"display:none;visibility:hidden\"\u003e\u003c/iframe\u003e\n\nSkip to content\n\n\n\n\n\n\n\n\n\n\n\n\n\n\n Allrecipes\n\n\n \n \n\n\n\n\n\n\n \n\n\n\n\n\n\nSearch\n\n\n\n\n\n\n\n\n\n\n\n\n\n \n\n\n\nPlease fill out this field.\n\n\n\n\n\n\nSearch the site\n\n\n\n\n\n\n\n\n \n\n\n\nPlease fill out this field.\n\n\n\n\n\n \n\n\n\nLog In\n\n \n\n\nMy Account\n\n\n\n\n\n\n\n My Profile\n \n\n Add a Recipe\n \n\n Saved Recipes \u0026 Collections\n \n\n Account Settings\n \n\n Help\n \n\n Log Out\n \n\n\n\n\n\nMagazine\n\n\n\n\n\n\n\n Subscribe\n \n\n Manage Your Subscription\n \n\n Give a Gift Subscription\n \n\n Get Help\n \n\n\n\nNewsletters\n\n\n Sweepstakes\n \n\n\n\n\n\n\n\n\n\n\n\n\n\n\n\n\n\n\n\n\n\n Allrecipes\n\n\n \n\n\n\n\n\nSearch\n\n\n\n\n\n\n\n\n \n\n\n\nPlease fill out this field.\n\n\n\n\n\n\nDinners\n\n\n\n\n\n\n\n\n\n\n\nDinners\n\n\n\n 5-Ingredient Dinners\n \n\n One-Pot Meals\n \n\n Quick \u0026 Easy\n \n\n 30-Minute Meals\n \n\n Family Dinners\n \n\n Soups, Stews \u0026 Chili\n \n\n Comfort Food\n \n\n Main Dishes\n \n\n Sheet Pan Dinners\n \n\n View All\n \n\n\n\n\n\nMeals\n\n\n\n\n\n\n\n\n\n\n\nMeals\n\n\n\n Breakfast \u0026 Brunch\n \n\n Lunch\n \n\n Healthy\n \n\n Appetizers \u0026 Snacks\n \n\n Salads\n \n\n Side Dishes\n \n\n Soups\n \n\n Bread\n \n\n Drinks\n \n\n Desserts\n \n\n View All\n \n\n\n\n\n\nIngredients\n\n\n\n\n\n\n\n\n\n\n\nIngredients\n\n\n\n Chicken\n \n\n Beef\n \n\n Pork\n \n\n Seafood\n \n\n Pasta\n \n\n Fruits\n \n\n Vegetables\n \n\n View All\n \n\n\n\n\n\nOccasions\n\n\n\n\n\n\n\n\n\n\n\nOccasions\n\n\n\n Kentucky Derby Recipes\n \n\n Cinco de Mayo Recipes\n \n\n Mother's Day Recipes\n \n\n Memorial Day Recipes\n \n\n View All\n \n\n\n\n\n\nCuisines\n\n\n\n\n\n\n\n\n\n\n\nCuisines\n\n\n\n Mexican\n \n\n Italian\n \n\n Chinese\n \n\n Indian\n \n\n German\n \n\n Greek\n \n\n Filipino\n \n\n Japanese\n \n\n View All\n \n\n\n\n\n\nKitchen Tips\n\n\n\n\n\n\n\n\n\n\n\nKitchen Tips\n\n\n\n Instant Pot\n \n\n Air Fryer\n \n\n Slow Cooker\n \n\n Our Favorite Products\n \n\n BBQ \u0026 Grilling\n \n\n Cooking by Equipment\n \n\n Ingredient Substitutions\n \n\n View All\n \n\n\n\n\n\nNews\n\n\n\n\n\n\n\n\n\n\n\nNews\n\n\n\n Celebrity \u0026 Entertainment\n \n\n Fast Food\n \n\n Grocery\n \n\n Recalls\n \n\n Trends\n \n\n View All\n \n\n\n\n\n\nFeatures\n\n\n\n\n\n\n\n\n\n\n\nFeatures\n\n\n\n Dinner Fix\n \n\n Sweet Spot\n \n\n In the Kitchen\n \n\n\n\n\n\nAbout Us\n\n\n\n\n\n\n\n\n\n\n\nAbout Us\n\n\n\n About Allrecipes\n \n\n Allstars\n \n\n How to Add a Recipe\n \n\n\n\n\n GET THE MAGAZINE\n \n\n \n\n\n\n\n\n\n\n \n\n\n\nLog In\n\n \n\n\nMy Account\n\n\n\n\n\n\n\n\n\n\n\nMy Account\n\n\n\n My Profile\n \n\n Add a Recipe\n \n\n Saved Recipes \u0026 Collections\n \n\n Account Settings\n \n\n Help\n \n\n Log Out\n \n\n\n\n\n\nMagazine\n\n\n\n\n\n\n\n\n\n\n\nMagazine\n\n\n\n Subscribe\n \n\n Manage Your Subscription\n \n\n Give a Gift Subscription\n \n\n Get Help\n \n\n\n\nNewsletters\n\n\n Sweepstakes\n \n\n\n\n\n\n\n\n\n\n\n\n\n\nFollow Us\n\n\n \n\n\n \n\n \n\n\n \n\n \n\n\n \n\n \n\n\n \n\n \n\n\n \n\n \n\n\n \n\n\n \n\n\n\n\n Dinners\n\n\n\n 5-Ingredient Dinners\n \n\n One-Pot Meals\n \n\n Quick \u0026 Easy\n \n\n 30-Minute Meals\n \n\n Family Dinners\n \n\n Soups, Stews \u0026 Chili\n \n\n Comfort Food\n \n\n Main Dishes\n \n\n Sheet Pan Dinners\n \n\n View All\n \n\n\n\n Meals\n\n\n\n Breakfast \u0026 Brunch\n \n\n Lunch\n \n\n Healthy\n \n\n Appetizers \u0026 Snacks\n \n\n Salads\n \n\n Side Dishes\n \n\n Soups\n \n\n Bread\n \n\n Drinks\n \n\n Desserts\n \n\n View All\n \n\n\n\n Ingredients\n\n\n\n Chicken\n \n\n Beef\n \n\n Pork\n \n\n Seafood\n \n\n Pasta\n \n\n Fruits\n \n\n Vegetables\n \n\n View All\n \n\n\n\n Occasions\n\n\n\n Kentucky Derby Recipes\n \n\n Cinco de Mayo Recipes\n \n\n Mother's Day Recipes\n \n\n Memorial Day Recipes\n \n\n View All\n \n\n\n\n Cuisines\n\n\n\n Mexican\n \n\n Italian\n \n\n Chinese\n \n\n Indian\n \n\n German\n \n\n Greek\n \n\n Filipino\n \n\n Japanese\n \n\n View All\n \n\n\n\n Kitchen Tips\n\n\n\n Instant Pot\n \n\n Air Fryer\n \n\n Slow Cooker\n \n\n Our Favorite Products\n \n\n BBQ \u0026 Grilling\n \n\n Cooking by Equipment\n \n\n Ingredient Substitutions\n \n\n View All\n \n\n\n\n News\n\n\n\n Celebrity \u0026 Entertainment\n \n\n Fast Food\n \n\n Grocery\n \n\n Recalls\n \n\n Trends\n \n\n View All\n \n\n\n\n Features\n\n\n\n Dinner Fix\n \n\n Sweet Spot\n \n\n In the Kitchen\n \n\n\n\n\n\n About Us\n\n\n\n The Allrecipes Allstars\n \n\n How to Add a Recipe\n \n\n\nGET THE MAGAZINE\n\n\n\n\n\n\n\nRecipes\n\n\n\nSalad\n\n\n\nPotato Salad Recipes\n\n\n\nNo Mayo\n\nAuthentic German Potato Salad\n\n\n\n\n\n\n\n\n\n\n\n\n\n\n\n\n\n4.8\n(1,624)\n1,286 Reviews\n218 Photos\nThis is my mother's recipe for authentic German potato salad. Everyone, German or not, loves it. It is easy to double the recipe as well. I often bring it to potlucks, and we also have it at home on special occasions. There are usually no leftovers, but if there are, they don't last long!\n\nSubmitted by\nAngela Louise Miller\n\nUpdated on April 8, 2025\n\n\n\nTested by\n Allrecipes Test Kitchen\n \n\n\n\nTested by\nAllrecipes Test Kitchen\n \nThe Allrecipes Test Kitchen staff are a team of culinary pros who make and vet recipes using only equipment you'd find in a home kitchen. Staff credentials vary but include training at the Culinary Institute of America; kitchen stints in fine dining restaurants; and countless hours in the test kitchen itself.\n\n\n\nMeet the Allrecipes Test Kitchen\n\n\n\n\n \n \nSave\n\n\n\n\n\n\n\n\nRate\n\n\n\n\n\n \nPrint\n\n\n\n\n\n\n\n\n\n\nShare\n\n\n\n\n\n \n\n\n\n\n\n\n\n\n\n\n\n\n\n\n\n\n\n\n\n\n\n\n\n\n\n\n\n\n \n\n \n\n Add Photo\n\n\n\n\n218\n\n\n\n\u003cimg\nsrc=\"https://www.allrecipes.com/thmb/EW-vGTCNxY6KmNIYKHHMUDuT8kE=/160x90/filters:no_upscale():max_bytes(150000):strip_icc():format(webp)/JF_83097-Authentic-German-Potato-Salad-4x3_0564-d3a46edfe7784159aea8ba2a3b81bb58.jpg\"\nwidth=\"160\"\nheight=\"90\"\nclass=\"img--noscript photo mntl-image universal-image__image\"\nalt=\"Authentic German Potato Salad garnished with fresh herbs in a bowl with a spoon \"\n/\u003e\n\n\n218\n\n\n\n218\n\n\n\n218\n\n\n\n \n\nPrep Time:\n15 mins\n\n\nCook Time:\n25 mins\n\n\nTotal Time:\n40 mins\n\n\nServings:\n4 \n\n\nJump to Nutrition Facts\n\n Jump to recipe\n\n\n\n\n This warm German potato salad features tender potatoes in a flavorful bacon vinaigrette. \n\n\n  What Is German Potato Salad?  \n Unlike mayonnaise-based American potato salads, German potato salad is tossed in a vinegar-based dressing made with bacon drippings. It is usually served warm instead of cold, but some people prefer to serve it at room temperature.\n\n\n  How to Make German Potato Salad  \n You'll find a detailed ingredient list and step-by-step instructions in the recipe below, but let's go over the basics:\n\n\n  German Potato Salad Ingredients  \n These are the ingredients you’ll need to make this authentic German potato salad recipe: \n\n\n Potatoes: We recommend using waxy potatoes (such as New Potatoes) because they hold their shape well. Yukon Gold, an all-purpose variety, is also a good choice. Bacon: Bacon (and its grease) adds tons of flavor to this hearty German potato salad. Onion: An onion, cooked in bacon grease, lends even more complexity and flavor. Vinegar: White vinegar adds tanginess that cuts through the richness from the potatoes and bacon. Sugar: A bit of white sugar gives this savory potato salad subtle sweetness. Seasonings and herbs: This German potato salad is perfectly seasoned with salt, pepper, and fresh parsley.\n\n\n Learn more: What Are the Best Potatoes for Potato Salad?\n\n\n  How Do You Make German Potato Salad?   \n Here’s a brief overview of what you can expect when you make this homemade German potato salad:\n\n\n Boil, drain, and cool the diced and peeled potatoes. Fry the bacon in a skillet, then cook the onion in the bacon grease. Add the vinegar, sugar, water, salt, and pepper and bring to a boil. Add the potatoes and ½ of the bacon to the boiling liquid. When heated through, transfer the potatoes to a serving dish. Garnish with remaining bacon and parsley. \n\n\n  What to Serve With German Potato Salad  \n This German potato salad would be the perfect addition to any potluck or picnic spread. In need of some more inspiration? Explore our collection of 15 Best Potluck Side Dishes Are So Good Everyone Will Be Begging You for the Recipes. Here are a few of the crowd-pleasing recipes you’ll find: \n\n\n\nClassic Macaroni Salad\nSquash Casserole\nPerfect Summer Fruit Salad\n\n\n  How Long Does German Potato Salad Last?   \n You can store your leftover German potato salad in a shallow, airtight container for up to five days. Reheat gently in the oven, covered with foil, to prevent the potatoes from drying out. \n\n\n  Can You Freeze German Potato Salad?   \n German potato salads freeze better than their mayonnaise-based counterparts. Freeze the (completely cooled) potato salad for up to three months, then thaw in the fridge and reheat in the oven.  \n\n\n  Allrecipes Community Tips and Praise  \n “Absolutely delicious,” raves krnanderson2901. “Some German potato salad recipes that I have tried don't have enough tang, but this one has that tangy, bacon flavor I love!”\n\n\n “I made this tonight and it was outstanding,” according to Tom McCullough Sr. “Didn't have any white wine vinegar so I substituted plain white vinegar and a quarter cup of pinot grigio. Dicing the potatoes before cooking and it cut down on cooking time! This recipe is a keeper!”\n\n\n “Our family includes picky eaters,” says one Allrecipes community member. “This was an absolute hit with everyone!! The use of the bacon fat to sauté the onions makes this so flavorful!”\n\n\n Editorial contributions by Corey Williams\n\n\n\n\n \n\n\n\nCook Mode\n(Keep screen awake)\n\nIngredients\n \n\n\n\n\n\n\n1x\n\n\n\n\n\n\n\n\n2x\n\n\n\n\n\n\n\n\n4x\n\n\n\n \n\n\n\nOops! Something went wrong. Our team is working on it.\n\n\n\nOriginal recipe (1X) yields 4 servings\n \n\n3 cups diced peeled potatoes\n\n\n4 slices bacon\n\n\n1 small onion, diced\n\n\n¼ cup white vinegar\n\n\n2 tablespoons water\n\n\n1 ½ tablespoons white sugar, or more to taste\n\n\n1 teaspoon salt\n\n\n⅛ teaspoon ground black pepper\n\n\n1 tablespoon chopped fresh parsley\n\n\n\nDirections\n\n\n Gather the ingredients.\n\n \n\n\n\n\u003cimg\nsrc=\"https://www.allrecipes.com/thmb/KR1Wki5SDOx_ylVibATqtg0h1Bg=/1500x0/filters:no_upscale():max_bytes(150000):strip_icc():format(webp)/83097-Authentic-German-Potato-Salad-Ingredients_0489-59c79eb4e77545c8a9e34b117025cd3c.jpg\"\nwidth=\"4000\"\nheight=\"3000\"\nclass=\"img--noscript mntl-image mntl-image universal-image__image\"\nsrcset=\"https://www.allrecipes.com/thmb/GdVlb1Wp0jrw_8rjQCB3Lq0RIDg=/750x0/filters:no_upscale():max_bytes(150000):strip_icc():format(webp)/83097-Authentic-German-Potato-Salad-Ingredients_0489-59c79eb4e77545c8a9e34b117025cd3c.jpg 750w\"\nsizes=\"750px\"\nalt=\"Authentic German Potato Salad ingredients on a marble counter \"\n/\u003e\n\n \n Dotdash Meredith Food Studios\n\n\n\n\n Place potatoes in a large pot and add water to cover by at least 1 to 2 inches; bring to a boil. Cook until potatoes are easily pierced with a fork, about 10 minutes. Drain, and set aside to cool.\n\n \n\n\n\n\u003cimg\nsrc=\"https://www.allrecipes.com/thmb/Mj5BahFJyKAQEPh9Pw7Da1cT6ng=/1500x0/filters:no_upscale():max_bytes(150000):strip_icc():format(webp)/83097-Authentic-German-Potato-Salad-Step-1_0492-a49b6b3ca2f3412bab9348aefe884f4d.jpg\"\nwidth=\"4000\"\nheight=\"3000\"\nclass=\"img--noscript mntl-image mntl-image universal-image__image\"\nsrcset=\"https://www.allrecipes.com/thmb/ci9Wm-vY-52WWHbOcloVJLKblr0=/750x0/filters:no_upscale():max_bytes(150000):strip_icc():format(webp)/83097-Authentic-German-Potato-Salad-Step-1_0492-a49b6b3ca2f3412bab9348aefe884f4d.jpg 750w\"\nsizes=\"750px\"\nalt=\"Diced potatoes in a metal colander \"\n/\u003e\n\n \n Dotdash Meredith Food Studios\n\n\n\n\n While the potatoes are cooking, place bacon in a large, deep skillet over medium-high heat. Fry until browned and crisp, 10 to 12 minutes, turning as needed. Transfer bacon to a paper towel-lined plate and crumble when cool enough to handle. Leave bacon grease in the skillet.\n\n \n\n\n\n\u003cimg\nsrc=\"https://www.allrecipes.com/thmb/Vfb7eN0N3Pgnf7zTncqcpfaHLwU=/1500x0/filters:no_upscale():max_bytes(150000):strip_icc():format(webp)/83097-Authentic-German-Potato-Salad-Step-2_0501-9f46942e676043e59881989063116b40.jpg\"\nwidth=\"4000\"\nheight=\"3000\"\nclass=\"img--noscript mntl-image mntl-image universal-image__image\"\nsrcset=\"https://www.allrecipes.com/thmb/DuMuH1c9jI6K5Yv3jWDk94D_rCc=/750x0/filters:no_upscale():max_bytes(150000):strip_icc():format(webp)/83097-Authentic-German-Potato-Salad-Step-2_0501-9f46942e676043e59881989063116b40.jpg 750w\"\nsizes=\"750px\"\nalt=\"Bacon cooking in a pan on a burner next to a plate with paper towels \"\n/\u003e\n\n \n Dotdash Meredith Food Studios\n\n\n\n\n Cook onion in the bacon grease over medium heat until browned, 6 to 8 minutes. Add vinegar, sugar, water, salt, and pepper to the pan and bring to a boil.\n\n \n\n\n\n\u003cimg\nsrc=\"https://www.allrecipes.com/thmb/r_T2juDXsu-W__ZcsWJCGxd-_Yw=/1500x0/filters:no_upscale():max_bytes(150000):strip_icc():format(webp)/83097-Authentic-German-Potato-Salad-Step-3b_0509-4f402c8061f94bd38e5f607f5cdbd293.jpg\"\nwidth=\"4000\"\nheight=\"3000\"\nclass=\"img--noscript mntl-image mntl-image universal-image__image\"\nsrcset=\"https://www.allrecipes.com/thmb/pYKQWw6cKyvActXMpydFO83bEZM=/750x0/filters:no_upscale():max_bytes(150000):strip_icc():format(webp)/83097-Authentic-German-Potato-Salad-Step-3b_0509-4f402c8061f94bd38e5f607f5cdbd293.jpg 750w\"\nsizes=\"750px\"\nalt=\"Onions cooking in bacon grease in a pan on a burner with a spatula, next to bacon on a plate \"\n/\u003e\n\n \n Dotdash Meredith Food Studios\n\n\n\n\n Once boiling, add potatoes, and 1/2 of the crumbled bacon. Cook until heated through, 3 to 4 minutes.\n\n \n\n\n\n\u003cimg\nsrc=\"https://www.allrecipes.com/thmb/BzqqBtwxnD_CujbZCa6OndTUdjM=/1500x0/filters:no_upscale():max_bytes(150000):strip_icc():format(webp)/83097-Authentic-German-Potato-Salad-Step-4a_0510-bbc85c9bfbea4ed2a1b5ce6422fec37b.jpg\"\nwidth=\"4000\"\nheight=\"3000\"\nclass=\"img--noscript mntl-image mntl-image universal-image__image\"\nsrcset=\"https://www.allrecipes.com/thmb/LjjENibtTRissfwGGsO7GFD4AHs=/750x0/filters:no_upscale():max_bytes(150000):strip_icc():format(webp)/83097-Authentic-German-Potato-Salad-Step-4a_0510-bbc85c9bfbea4ed2a1b5ce6422fec37b.jpg 750w\"\nsizes=\"750px\"\nalt=\"Onions, potatoes and bacon in a pan on a burner \"\n/\u003e\n\n \n Dotdash Meredith Food Studios\n\n\n\n\n Transfer warm potato salad to a serving dish and sprinkle remaining crumbled bacon over top. Garnish with parsley and serve warm.\n\n \n\n\n\n\u003cimg\nsrc=\"https://www.allrecipes.com/thmb/eRW1kFp4Cfw_cLh5G2SUbfDS3Uk=/1500x0/filters:no_upscale():max_bytes(150000):strip_icc():format(webp)/JF_83097-Authentic-German-Potato-Salad-4x3_0564-d3a46edfe7784159aea8ba2a3b81bb58.jpg\"\nwidth=\"4000\"\nheight=\"3000\"\nclass=\"img--noscript mntl-image mntl-image universal-image__image\"\nsrcset=\"https://www.allrecipes.com/thmb/xkC5hEsYFi6MOCHCG8znTMZLM8A=/750x0/filters:no_upscale():max_bytes(150000):strip_icc():format(webp)/JF_83097-Authentic-German-Potato-Salad-4x3_0564-d3a46edfe7784159aea8ba2a3b81bb58.jpg 750w\"\nsizes=\"750px\"\nalt=\"Authentic German Potato Salad garnished with fresh herbs in a bowl with a spoon \"\n/\u003e\n\n \n Dotdash Meredith Food Studios\n\n\n\n\n From the Editor\nThe original recipe calls for 3 tablespoons sugar but some reviewers think that's too sweet. Best to start with 1 ½ tablespoons and add more to suit your taste.\n\n\n\n\n I Made It\n\n\n\n\n \nPrint\n\n\n\n\n\n\n\n2,708\nhome cooks made it!\n\nNutrition Facts (per serving)\n\n\n\n183\nCalories\n\n\n4g \nFat\n\n\n32g \nCarbs\n\n\n5g \nProtein\n\n\n\n\n\n \nShow Full Nutrition Label\nHide Full Nutrition Label\n\n\n\n\n\n\nNutrition Facts\n\n\n\nServings Per Recipe\n4\n\n\n\n\nCalories\n183\n\n\n\n\n\n% Daily Value *\n\n\n\nTotal Fat\n4g\n\n\n5%\n\n\n\n\nSaturated Fat\n1g\n\n\n7%\n\n\n\n\nCholesterol\n10mg\n\n\n3%\n\n\n\n\nSodium\n796mg\n\n\n35%\n\n\n\n\nTotal Carbohydrate\n32g\n\n\n12%\n\n\n\n\nDietary Fiber\n2g\n\n\n8%\n\n\n\n\nTotal Sugars\n11g\n\n\n\n\nProtein\n5g\n\n\n11%\n\n\n\n\nVitamin C\n10mg\n\n\n11%\n\n\n\n\nCalcium\n16mg\n\n\n1%\n\n\n\n\nIron\n1mg\n\n\n3%\n\n\n\n\nPotassium\n426mg\n\n\n9%\n\n\n\n\n* Percent Daily Values are based on a 2,000 calorie diet. Your daily values may be higher or lower depending on your calorie needs.\n** Nutrient information is not available for all ingredients. Amount is based on available nutrient data.\n(-) Information is not currently available for this nutrient. If you are following a medically restrictive diet, please consult your doctor or registered dietitian before preparing this recipe for personal consumption. \n\n\n\n\n\n\n\n\n\n\n\n\n\n\n\n\n\n\n\n\n\n\n\n\n\n\n\n\n \n\n\n\n\n\n\n\n\n Add Your Photo\n\n\n\n\n \nPhotos of Authentic German Potato Salad\n \n01\nof 218\n\n\n\n\n\n\n\u003cimg\nsrc=\"https://www.allrecipes.com/thmb/N_1UmJebpgwe3kjPDhZfDLv9VxI=/0x512/filters:no_upscale():max_bytes(150000):strip_icc():format(webp)/JF_83097-Authentic-German-Potato-Salad-4x3_0564-d3a46edfe7784159aea8ba2a3b81bb58.jpg\"\nwidth=\"4000\"\nheight=\"3000\"\nclass=\"img--noscript universal-image__image\"\nalt=\"Authentic German Potato Salad garnished with fresh herbs in a bowl with a spoon \"\n/\u003e\n\n\n\n\n\n\n\nPhoto by \nDotdash Meredith Food Studios\n\n \n\n \n02\nof 218\n\n\n\n\n\n\n\n\n\n\n\nPhoto by \nDiana\n\n\n\n\n\n\n\n\n\n\n\n\n\n\n\n\n\n11/21/2024\n\n\n\nA keeper!\n\n\n\nEasy to follow\n\n\n\nGreat flavors\n\n\n\nWorth the effort \n\n \n03\nof 218\n\n\n\n\n\n\n\n\n\n\n\nPhoto by \nLoriLee\n\n\n\n\n\n\n\n\n\n\n\n\n\n\n\n\n\n09/29/2024\n\n\n\nFamily favorite\nI grew up on authentic German food and this tastes just like my Grandmother’s potato salad. I used red potatoes and increased the liquid by 50% because the potatoes soaked up the liquid. If you like German potato salad this is the real deal! Simple and easy…wunderbar! \n\n \n04\nof 218\n\n\n\n\n\n\n\n\n\n\n\nPhoto by \nLivelyCane7650\n\n\n\n\n\n\n\n\n\n\n\n\n\n\n\n\n\n09/14/2024\n\n\n\nA keeper!\n\n\n\nGreat flavors\n\n\n\nEasy to follow\n\n\n\nCrowd-pleaser\nThis is the first time I've made German potato salad. I searched until I found this recipe. I doubled the recipe for a large dinner party but could have made even a larger batch!I did add 2 t. of Dijon mustard, and 1.5 T of chopped chives, which other recipes had these listed in their ingredients.I placed the vinegar, sugar (only 2 T), water, salt, pepper and Dijon in a measuring cup, stirring to combine, and then poured all of it into the Dutch oven (I don’t have a deep skillet).I loved the flavors of the 'sauce'.I couldn't find any waxy potatoes; and the package of Yukon Gold was a 5-pound bag! I used red potatoes and kept the skins on.This was a hit!! \n\n \n05\nof 218\n\n\n\n\n\n\n\n\n\n\n\nPhoto by \nPaul Khoo\n\n\n\n\n\n\n\n\n\n\n\n\n\n\n\n\n\n12/16/2023\nI thought it was really great considering the few ingredients that make it.I used 1-1/2 tablespoons of sugar + 1 teaspoon instead of the 3 recommended in the video.I like freshly ground black pepper so I didn’t pay much attention to the 1/8 teaspoon which is nothing.When I make next time, I will not crisp the bacon.Once again, a great recipe! \n\n \n06\nof 218\n\n\n\n\n\n\n\n\n\n\n\nPhoto by \nSusan\n\n\n\n\n\n\n\n\n\n\n\n\n\n\n\n\n\n10/15/2023\nI am making g this for 12 guess. So I x3 everything. Questions...3 onions med size seem to much? It is 2 cups. Extra bacon for garnish. How much bacon grease is too much??I have 1/2 cup. Don't want a greaseySalad. \n\n \n07\nof 218\n\n\n\n\n\n\n\n\n\n\n\nPhoto by \nrhelmig\n\n\n\n\n\n\n\n\n\n\n\n\n\n\n\n\n\n01/23/2023\nJust like my German Grandmother used to make! Followed the recipe exactly. I might add a little more vinegar next time. \n\n \n08\nof 218\n\n\n\n\n\n\n\n\n\n\n\nPhoto by \nAquaNori2790\n\n\n\n\n\n\n\n\n\n\n\n\n\n\n\n\n\n08/21/2022\n \n\n \n09\nof 218\n\n\n\n\n\n\n\n\n\n\n\nPhoto by \nManCanCook\n\n\n\n\n\n\n\n\n\n\n\n\n\n\n\n\n\n07/27/2022\nSimply delicious!! I didn't change anything, well, I did leave a little skin on the red potatoes... still was awesome! \n\n \n10\nof 218\n\n\n\n\n\n\n\n\n\n\n\nPhoto by \nCopperMash2137\n\n\n\n\n\n\n\n\n\n\n\n\n\n\n\n\n\n07/14/2022\nI was using up odds and ends and had to use some red onion and green onion, but it tasted great and was easy to make. \n\n\n1\n\n\n2\n\n\n3\n\n\n4\n\n\n5\n\n\n\nNext\n\n\n\n\n\n\n \n\n\n\n\n\nYou’ll Also Love\n\n\n\n\n\n\u003cimg\nsrc=\"https://www.allrecipes.com/thmb/es7pdSaDcD_OoZeH-GCZ0PV9_S4=/282x188/filters:no_upscale():max_bytes(150000):strip_icc():format(webp)/4021618-1fc749c18bfe4e1191d301109ac0cfcf.jpg\"\nwidth=\"282\"\nheight=\"188\"\nclass=\"img--noscript card__img universal-image__image\"\n/\u003e\n\n\n\n \n\n\n\n\n\n\n\n\nGerman Potato Salad\n\n\n\n\n\n\n\n\n\n\n\n\n\n\n\n\n\n\n\n422\n\nRatings\n\n\n \n\n\n\n\n\n\n\u003cimg\nsrc=\"https://www.allrecipes.com/thmb/rZZbsElky8AhWULXbl0GFubWZy4=/282x188/filters:no_upscale():max_bytes(150000):strip_icc():format(webp)/8410927-armenian-style-potato-salad-chef-john-IMG-8986-4x3-b00a5dbbd28847a490a19db3a2f176ed.jpg\"\nwidth=\"282\"\nheight=\"188\"\nclass=\"img--noscript card__img universal-image__image\"\nalt=\"a close up view of Armenian style potato salad in a large, wide bowl. \"\n/\u003e\n\n\n\n \n\n\n\n\n\n\n\n\nArmenian-Style Potato Salad\n\n\n\n\n\n\n\n\n\n\n\n\n\n\n\n\n\n\n\n6\n\nRatings\n\n\n \n\n\n\n\n\n\n\u003cimg\nsrc=\"https://www.allrecipes.com/thmb/2MA0r7KWtkKKglld_H_L-Zq01iE=/282x188/filters:no_upscale():max_bytes(150000):strip_icc():format(webp)/9198476-03b942ecce384907bc52c256b9972d3f.jpg\"\nwidth=\"282\"\nheight=\"188\"\nclass=\"img--noscript card__img universal-image__image\"\n/\u003e\n\n\n\n \n\n\n\n\n\n\n\n\nLow-Carb Hot Dog and Dipping Sauce\n\n\n\n\n\n\n\n\n\n\n\n\n\n\n\n\n\n\n\n10\n\nRatings\n\n\n \n\n\n\n\n\n\n\u003cimg\nsrc=\"https://www.allrecipes.com/thmb/1PWuhVOlx0A0P0vav6jiFCYdu6Q=/282x188/filters:no_upscale():max_bytes(150000):strip_icc():format(webp)/9420862-219f7a94394f4c4ab8d186ac1831019b.jpg\"\nwidth=\"282\"\nheight=\"188\"\nclass=\"img--noscript card__img universal-image__image\"\n/\u003e\n\n\n\n \n\n\n\n\n\n\n\n\nSchwabischer Kartoffelsalat (German Potato Salad - Swabian-Style)\n\n\n\n\n\n\n\n\n\n\n\n\n\n\n\n\n\n\n\n18\n\nRatings\n\n\n \n\n\n\n\n\n\n\u003cimg\nsrc=\"https://www.allrecipes.com/thmb/F-IolvXOx_53MekE_86fsMGTwFw=/282x188/filters:no_upscale():max_bytes(150000):strip_icc():format(webp)/968107-3abc4fce096f41058035d54be49a1ccd.jpg\"\nwidth=\"282\"\nheight=\"188\"\nclass=\"img--noscript card__img universal-image__image\"\n/\u003e\n\n\n\n \n\n\n\n\n\n\n\n\nOktoberfest Potato Salad\n\n\n\n\n\n\n\n\n\n\n\n\n\n\n\n\n\n\n\n28\n\nRatings\n\n\n \n\n\n\n\n\n\n\u003cimg\nsrc=\"https://www.allrecipes.com/thmb/5iSSZ-DFF-dJ1TpsKZlbq_002Lw=/282x188/filters:no_upscale():max_bytes(150000):strip_icc():format(webp)/5592005-3cb5463b32dd470eab60fdaeeebdd6d5.jpg\"\nwidth=\"282\"\nheight=\"188\"\nclass=\"img--noscript card__img universal-image__image\"\n/\u003e\n\n\n\n \n\n\n\n\n\n\n\n\nTraditional German Warm Potato Salad\n\n\n\n\n\n\n\n\n\n\n\n\n\n\n\n\n\n\n\n5\n\nRatings\n\n\n \n\n\n\n\n\n\n\u003cimg\nsrc=\"https://www.allrecipes.com/thmb/ubjAw8FzZ-AFN9n5yxu26nOVk6A=/282x188/filters:no_upscale():max_bytes(150000):strip_icc():format(webp)/5615052_Patate-Prezzemolate-Vegan-Italian-Potato-Salad-4x3-ec3a5db9b5374dea883f65085b6b3a04.jpg\"\nwidth=\"282\"\nheight=\"188\"\nclass=\"img--noscript card__img universal-image__image\"\nalt=\"a vinegar-based Italian Potato Salad (Patate Prezzemolate) tossed with chopped parsley and red pepper flakes, in a ceramic bowl with wooden salad tongs\"\n/\u003e\n\n\n\n \n\n\n\n\n\n\n\n\nPatate Prezzemolate (Italian Potato Salad)\n\n\n\n\n\n\n\n\n\n\n\n\n\n\n\n\n\n\n\n36\n\nRatings\n\n\n \n\n\n\n\n\n\n\u003cimg\nsrc=\"https://www.allrecipes.com/thmb/akeLoduFaWQNMrwBsf026xdu8Ig=/282x188/filters:no_upscale():max_bytes(150000):strip_icc():format(webp)/15048-6d8b6fa25be040a4a39320364e22585e.jpg\"\nwidth=\"282\"\nheight=\"188\"\nclass=\"img--noscript card__img universal-image__image\"\n/\u003e\n\n\n\n \n\n\n\n\n\n\n\n\nLiege Style Salad\n\n\n\n\n\n\n\n\n\n\n\n\n\n\n\n\n\n\n\n14\n\nRatings\n\n\n \n\n\n\n\n\n\n\n\n\n\u003cimg\nsrc=\"https://www.allrecipes.com/thmb/R56_84FRHBCWzfbTZHoVNTO6isU=/282x188/filters:no_upscale():max_bytes(150000):strip_icc():format(webp)/6178774-f5f69efe4d054f90b342ce192a234642.jpg\"\nwidth=\"282\"\nheight=\"188\"\nclass=\"img--noscript card__img universal-image__image\"\n/\u003e\n\n\n\n \n\n\n\n\n\n\n\n\nHot German Potato Salad II\n\n\n\n\n\n\n\n\n\n\n\n\n\n\n\n\n\n\n\n13\n\nRatings\n\n\n \n\n\n\n\n\n\n\u003cimg\nsrc=\"https://www.allrecipes.com/thmb/JsJPErCR2T__Ep-0qc1b0TcYnEg=/282x188/filters:no_upscale():max_bytes(150000):strip_icc():format(webp)/5692569-f50d2001c7cd46618e9d9898d2906e8b.jpg\"\nwidth=\"282\"\nheight=\"188\"\nclass=\"img--noscript card__img universal-image__image\"\n/\u003e\n\n\n\n \n\n\n\n\n\n\n\n\nGrilled German Potato Salad\n\n\n\n\n\n\n\n\n\n\n\n\n\n\n\n\n\n\n\n13\n\nRatings\n\n\n \n\n\n\n\n\n\n\u003cimg\nsrc=\"https://www.allrecipes.com/thmb/oMHhzg14cTxHAJ9rhjAD6LAK84M=/282x188/filters:no_upscale():max_bytes(150000):strip_icc():format(webp)/166236-b472ed0d16b64a229f15fe3724403ef2.jpg\"\nwidth=\"282\"\nheight=\"188\"\nclass=\"img--noscript card__img universal-image__image\"\n/\u003e\n\n\n\n \n\n\n\n\n\n\n\n\nHot German Potato Salad I\n\n\n\n\n\n\n\n\n\n\n\n\n\n\n\n\n\n\n\n13\n\nRatings\n\n\n \n\n\n\n\n\n\n\u003cimg\nsrc=\"https://www.allrecipes.com/thmb/IqO5FhLZpOkhXAv5B5dvoPV2_0U=/282x188/filters:no_upscale():max_bytes(150000):strip_icc():format(webp)/9104184-0743d8e994ab44e3948e8a68ee3a4c78.jpg\"\nwidth=\"282\"\nheight=\"188\"\nclass=\"img--noscript card__img universal-image__image\"\n/\u003e\n\n\n\n \n\n\n\n\n\n\n\n\nWarm Potato Salad with Olives\n\n \n\n\n\n\n\n\n\u003cimg\nsrc=\"https://www.allrecipes.com/thmb/DL_skZ7sjCE4fGaucWQOsDeDQG4=/282x188/filters:no_upscale():max_bytes(150000):strip_icc():format(webp)/215510-mediterranean-potato-salad-SunnyByrd-1x1-1-ec81a8121d0f40af89c1a510bf5439ee.jpg\"\nwidth=\"282\"\nheight=\"188\"\nclass=\"img--noscript card__img universal-image__image\"\nalt=\"close up view of Mediterranean Potato Salad with cucumbers, red onions, and peppers, on a plate\"\n/\u003e\n\n\n\n \n\n\n\n\n\n\n\n\nMediterranean Potato Salad\n\n\n\n\n\n\n\n\n\n\n\n\n\n\n\n\n\n\n\n92\n\nRatings\n\n\n \n\n\n\n\n\n\n\u003cimg\nsrc=\"https://www.allrecipes.com/thmb/TClFIHoTXb4Fd3b3UH7LF-LVPmE=/282x188/filters:no_upscale():max_bytes(150000):strip_icc():format(webp)/2209525-hot-german-potato-salad-iii-DeDe-1x1-1-49c05ec367d04fca982fbeabe5fcf4ea.jpg\"\nwidth=\"282\"\nheight=\"188\"\nclass=\"img--noscript card__img universal-image__image\"\nalt=\"close up view of Hot German Potato Salad in a white bowl\"\n/\u003e\n\n\n\n \n\n\n\n\n\n\n\n\nHot German Potato Salad\n\n\n\n\n\n\n\n\n\n\n\n\n\n\n\n\n\n\n\n1,001\n\nRatings\n\n\n \n\n\n\n\n\n\n\u003cimg\nsrc=\"https://www.allrecipes.com/thmb/2atuouOjmkrN6ikqMgw3P58tggs=/282x188/filters:no_upscale():max_bytes(150000):strip_icc():format(webp)/841945-49d8e19d36cd4b70ac508acb2e1752dc.jpg\"\nwidth=\"282\"\nheight=\"188\"\nclass=\"img--noscript card__img universal-image__image\"\n/\u003e\n\n\n\n \n\n\n\n\n\n\n\n\nPipirrana (Spanish Potato Salad)\n\n\n\n\n\n\n\n\n\n\n\n\n\n\n\n\n\n\n\n22\n\nRatings\n\n\n \n\n\n\n\n\n\n\u003cimg\nsrc=\"https://www.allrecipes.com/thmb/I4kIfEj7RO6st8oF2xbDERK4hbk=/282x188/filters:no_upscale():max_bytes(150000):strip_icc():format(webp)/4561197-ceebfe4e75d4478c811f033375cc9f4a.jpg\"\nwidth=\"282\"\nheight=\"188\"\nclass=\"img--noscript card__img universal-image__image\"\n/\u003e\n\n\n\n \n\n\n\n\n\n\n\n\nMom's Italian Potato Salad\n\n\n\n\n\n\n\n\n\n\n\n\n\n\n\n\n\n\n\n14\n\nRatings\n\n\n \n\n\n\n\n \n\n\n Allrecipes\n\n\n \nNewsletters\n \n\nFollow Us\n\n\n \n\n\n \n\n \n\n\n \n\n \n\n\n \n\n \n\n\n \n\n \n\n\n \n\n \n\n\n \n\n \n\n\nDinners\nMeals\nIngredients\nOccasions\nCuisines\nKitchen Tips\nNews\nFeatures \n About Us\n \n\n Editorial Process\n \n\n Privacy Policy\n \n\n Product Vetting\n \n\n Terms of Service\n \n\n Advertise\n \n\n Careers\n \n\n Contact\n \n\n Your Privacy Choices\n  \n\n\n\n \n\n \n\n \n \n\n \n\n\n\n\n\nAllrecipes\nis part of the Dotdash Meredith publishing family.\n\n\n\n\n \n\n\nDialog Heading\n\n\n\n\n\n\n\n \n\n\n \n\n\nNewsletter Sign Up\n\n\n\n\n\n\n\n \n\n \n\n\nNewsletter Sign Up\n\n\n\n\n\n\n\n \n\n\n\n\n\n\n\n\n\n\nMntl.utilities.scriptsOnLoad(document.querySelectorAll('script[data-glb-js=\"bottom\"]'), function() {\nvar Mntl = window.Mntl || {};\nwindow.Mntl = window.Mntl || {};\nwindow.Mntl.affiliatePlugins = window.Mntl.affiliatePlugins || [];\nwindow.Mntl.affiliateLinkRewriter.setMappings( {\nDOC_ID: '6648682'\n,SITE: 'allrecipes'\n,REQUEST_ID: 'n6db7e973c40a40a9880c79cd9334e65b04'\n}\n);\nwindow.Mntl.affiliatePlugins.push(window.Mntl.affiliateLinkRewriter.processLink);window.Mntl.externalizeLinks.init();(function (Mntl) {\nMntl.digioh = {\nscript: null,\nbrandId: null,\ninitialized: false,\ninit() {\nif (this.initialized) return;\nconst brandId = '47b4a4dd-ffd7-43db-8118-8002b7c15352';\nconst digiohFastActivation = 'false';\nconst lightboxJs = digiohFastActivation === 'true' ? '/lightbox_speed.js' : '/lightbox_inline.js';\n// eslint-disable-next-line prefer-template\nconst script = 'https://www.lightboxcdn.com/vendor/' + brandId + lightboxJs;\nthis.brandId = brandId;\nthis.script = script;\nthis.initialized = true;\n},\nload(callback) {\nthis.init();\nif (callback) {\nMntl.utilities.loadExternalJS({ src: this.script }, callback);\n} else {\nMntl.utilities.loadExternalJS({ src: this.script });\n}\n}\n};\n})(window.Mntl || {});\nMntl.digiohTimerDelay = parseFloat('0') * 1000;\n(function(Mntl) {\nconst setup = {\"clickToInitialize\":false,\"skin\":{\"name\":\"mantle\"},\"mute\":true,\"advertising\":{\"client\":\"googima\",\"vpaidmode\":\"enabled\",\"rules\":{\"frequency\":1},\"forceNonLinearFullSlot\":true,\"vpaidcontrols\":true,\"autoplayadsmuted\":true},\"autostart\":true,\"mediaid\":\"YgagJBG9\",\"preload\":\"metadata\",\"autoPause\":{\"pauseAds\":true,\"viewability\":true},\"aspectratio\":\"16:9\",\"pauseotherplayers\":\"true\",\"cast\":{},\"recsPlaylistId\":\"ZBQZ5egR\",\"width\":\"100%\"};\n// JW player requires `playlist` to be populated for contextual playlists\nsetup.playlist = setup.playlistUrl;\nconst isImmediateAutoplay = true;\nconst playInView = 30;\nconst encodedPageURL = encodeURIComponent(window.location);\nconst domain = Mntl.utilities.getDomain();\nconst iuPath = '/' + Mntl.GPT.getDfpId() + '/ddm.' + domain.replace('.com', '.video') + (Mntl.GPT.isMobile() ? '.mob' : '');\nfunction formatAdSizeArray(sizeArr) {\nreturn sizeArr.map(function(sz) {\nreturn sz.join('x');\n}).join('|');\n}\n// Assign a randomly-generated, eight character, alpha-numeric value to this property.\nsetup.advertising.adscheduleid = Math.random().toString(36).substr(2,8);\n// muid - used for audience targeting\nsetup.advertising.ppid = 'c5c00f22-aef9-4c48-afc8-8b256dc676eb';\nlet custParams = '';\ncustParams += '\u0026' + encodeURIComponent('slot') + '=' + encodeURIComponent('primary');\nconst inFocus = window \u0026\u0026 window.document \u0026\u0026 window.document.hasFocus();\nconst durationParams = Mntl.JWPlayer.getDurationParams(25409, false);\ncustParams += '\u0026ttid=' + setup.mediaid;\ncustParams += '\u0026play=' + Mntl.JWPlayer.getCustomPlayValue(setup.autostart, isImmediateAutoplay, playInView);\ncustParams += '\u0026in_focus=' + inFocus;\ncustParams += '\u0026videoduration=' + durationParams.duration;\ncustParams += '\u0026duration_over=' + durationParams.durationOver;\ncustParams += '\u0026duration_under=' + durationParams.durationUnder;\ncustParams += '\u0026frnch=' + 'Community Recipes';\ncustParams += '\u0026tags=' + encodeURIComponent(\"Authentic German Potato Salad,German Potato Salad,How to Make Authentic German Potato Salad,Potatoes,Stovetop,Stove Cooking,Bacon,Chopped Potatoes,Onion,White Vinegar,Easy Recipe,Boiled,Tender,Side Dish,Dinner,Potluck,German Cuisine,Family Friendly Recipes,Multi-generational Recipes,Experienced Skill Level,Community Recipes,Allrecipes,allrecipes.com,video,16x9,food,cooking,how to,how to make,unhosted,short form\");\nsetup.advertising.schedule = [{\n\"offset\": \"pre\",\n\"tag\": [\n'https://securepubads.g.doubleclick.net/gampad/ads?',\n'sz=',\nformatAdSizeArray([[640, 360]]),\n'\u0026iu=',\niuPath,\n'\u0026env=vp\u0026hl=en\u0026gdfp_req=1\u0026impl=s\u0026output=xml_vast2\u0026unviewed_position_start=1\u0026lid=',\n'\u0026url=',\nencodedPageURL,\n'\u0026description_url=',\nencodedPageURL,\n'\u0026correlator=',\nMath.floor(Date.now() / 1000),\n'\u0026cust_params=',\nMntl.GPT.serializeAllTargeting(),\nencodeURIComponent(custParams),\n'\u0026ad_rule=1'\n].join('')\n}];\nMntl.JWPlayer.init({\naccountKey: \"oxY0/BqWBX09BISmLN4/xuTz4IdZy713Cdjj4GyHOiYCUCyJ\",\nadSizes: [[640, 360]],\ndefer: true,\ndeferOnRFDS: true,\ndisplayMode: \"none\",\ndivId: \"article__primary-video-jw_1-0\",\nenableBiddingWithTCData: false,\nenableTVPEngagementBtns: false,\neventCategoryType: \"Primary\",\nintersectionMargin: \"250px\",\nisImmediateAutoplay: isImmediateAutoplay,\nisImmediateStickyDisabled: false,\nisIntersectionDisabled: true,\nisMobileAdhesive: false,\nisBroadVideo: false,\nisPlaylist: false,\nmediaSize: 1080,\nplayerId: \"aiy6MJ4O\",\nplayInView: playInView,\nshowCaptions: true,\nslot: \"primary\",\nrtbVideoConfig: {\"maxduration\":60,\"minduration\":0,\"plcmt\":2},\nuseDynamicVideoSizes: true,\nskipExistingMediaContent: false,\nstickyplay: true,\nuseMotionThumbnails: false\n}, setup );\n}(window.Mntl || {}));\n(function(Mntl) {\nMntl.Tooltip.init({\ndefaultPositionX: \"auto\",\ndefaultPositionY: \"auto\"\n});\n})(window.Mntl || {});\n});\n\n\nBy clicking “Accept All Cookies”, you agree to the storing of cookies on your device to enhance site navigation, analyze site usage, and assist in our marketing efforts. Cookies Settings Accept All Cookies",
  "url": "https://www.allrecipes.com/recipe/83097/authentic-german-potato-salad",
  "image": "https://www.allrecipes.com/thmb/G-mEkevL8aIWizpu0kWN36D4ouA=/1500x0/filters:no_upscale():max_bytes(150000):strip_icc()/JF_83097-Authentic-German-Potato-Salad-2x1_0562-1a13de26be004f91aa6d26afa9873289.jpg",
  "name": "Angela Louise Miller",
  "prep_time": "15 min",
  "cook_time": "25 min",
  "total_time": "40 min",
  "calories": "183",
  "servings": "4",
  "ingredients": "Potatoes: We recommend using waxy potatoes (such as New Potatoes) because they hold their shape well. Yukon Gold, an all-purpose variety, is also a good choice.;Bacon: Bacon (and its grease) adds tons of flavor to this hearty German potato salad.;Onion: An onion, cooked in bacon grease, lends even more complexity and flavor.;Vinegar: White vinegar adds tanginess that cuts through the richness from the potatoes and bacon.;Sugar: A bit of white sugar gives this savory potato salad subtle sweetness.;Seasonings and herbs: This German potato salad is perfectly seasoned with salt, pepper, and fresh parsley.",
  "instructions": "Gather the ingredients. \u003cimg src=\"https://www.allrecipes.com/thmb/KR1Wki5SDOx_ylVibATqtg0h1Bg=/1500x0/filters:no_upscale():max_bytes(150000):strip_icc():format(webp)/83097-Authentic-German-Potato-Salad-Ingredients_0489-59c79eb4e77545c8a9e34b117025cd3c.jpg\" width=\"4000\" height=\"3000\" class=\"img--noscript mntl-image mntl-image universal-image__image\" srcset=\"https://www.allrecipes.com/thmb/GdVlb1Wp0jrw_8rjQCB3Lq0RIDg=/750x0/filters:no_upscale():max_bytes(150000):strip_icc():format(webp)/83097-Authentic-German-Potato-Salad-Ingredients_0489-59c79eb4e77545c8a9e34b117025cd3c.jpg 750w\" sizes=\"750px\" alt=\"Authentic German Potato Salad ingredients on a marble counter \" /\u003e Dotdash Meredith Food Studios;Place potatoes in a large pot and add water to cover by at least 1 to 2 inches; bring to a boil. Cook until potatoes are easily pierced with a fork, about 10 minutes. Drain, and set aside to cool. \u003cimg src=\"https://www.allrecipes.com/thmb/Mj5BahFJyKAQEPh9Pw7Da1cT6ng=/1500x0/filters:no_upscale():max_bytes(150000):strip_icc():format(webp)/83097-Authentic-German-Potato-Salad-Step-1_0492-a49b6b3ca2f3412bab9348aefe884f4d.jpg\" width=\"4000\" height=\"3000\" class=\"img--noscript mntl-image mntl-image universal-image__image\" srcset=\"https://www.allrecipes.com/thmb/ci9Wm-vY-52WWHbOcloVJLKblr0=/750x0/filters:no_upscale():max_bytes(150000):strip_icc():format(webp)/83097-Authentic-German-Potato-Salad-Step-1_0492-a49b6b3ca2f3412bab9348aefe884f4d.jpg 750w\" sizes=\"750px\" alt=\"Diced potatoes in a metal colander \" /\u003e Dotdash Meredith Food Studios;While the potatoes are cooking, place bacon in a large, deep skillet over medium-high heat. Fry until browned and crisp, 10 to 12 minutes, turning as needed. Transfer bacon to a paper towel-lined plate and crumble when cool enough to handle. Leave bacon grease in the skillet. \u003cimg src=\"https://www.allrecipes.com/thmb/Vfb7eN0N3Pgnf7zTncqcpfaHLwU=/1500x0/filters:no_upscale():max_bytes(150000):strip_icc():format(webp)/83097-Authentic-German-Potato-Salad-Step-2_0501-9f46942e676043e59881989063116b40.jpg\" width=\"4000\" height=\"3000\" class=\"img--noscript mntl-image mntl-image universal-image__image\" srcset=\"https://www.allrecipes.com/thmb/DuMuH1c9jI6K5Yv3jWDk94D_rCc=/750x0/filters:no_upscale():max_bytes(150000):strip_icc():format(webp)/83097-Authentic-German-Potato-Salad-Step-2_0501-9f46942e676043e59881989063116b40.jpg 750w\" sizes=\"750px\" alt=\"Bacon cooking in a pan on a burner next to a plate with paper towels \" /\u003e Dotdash Meredith Food Studios;Cook onion in the bacon grease over medium heat until browned, 6 to 8 minutes. Add vinegar, sugar, water, salt, and pepper to the pan and bring to a boil. \u003cimg src=\"https://www.allrecipes.com/thmb/r_T2juDXsu-W__ZcsWJCGxd-_Yw=/1500x0/filters:no_upscale():max_bytes(150000):strip_icc():format(webp)/83097-Authentic-German-Potato-Salad-Step-3b_0509-4f402c8061f94bd38e5f607f5cdbd293.jpg\" width=\"4000\" height=\"3000\" class=\"img--noscript mntl-image mntl-image universal-image__image\" srcset=\"https://www.allrecipes.com/thmb/pYKQWw6cKyvActXMpydFO83bEZM=/750x0/filters:no_upscale():max_bytes(150000):strip_icc():format(webp)/83097-Authentic-German-Potato-Salad-Step-3b_0509-4f402c8061f94bd38e5f607f5cdbd293.jpg 750w\" sizes=\"750px\" alt=\"Onions cooking in bacon grease in a pan on a burner with a spatula, next to bacon on a plate \" /\u003e Dotdash Meredith Food Studios;Once boiling, add potatoes, and 1/2 of the crumbled bacon. Cook until heated through, 3 to 4 minutes. \u003cimg src=\"https://www.allrecipes.com/thmb/BzqqBtwxnD_CujbZCa6OndTUdjM=/1500x0/filters:no_upscale():max_bytes(150000):strip_icc():format(webp)/83097-Authentic-German-Potato-Salad-Step-4a_0510-bbc85c9bfbea4ed2a1b5ce6422fec37b.jpg\" width=\"4000\" height=\"3000\" class=\"img--noscript mntl-image mntl-image universal-image__image\" srcset=\"https://www.allrecipes.com/thmb/LjjENibtTRissfwGGsO7GFD4AHs=/750x0/filters:no_upscale():max_bytes(150000):strip_icc():format(webp)/83097-Authentic-German-Potato-Salad-Step-4a_0510-bbc85c9bfbea4ed2a1b5ce6422fec37b.jpg 750w\" sizes=\"750px\" alt=\"Onions, potatoes and bacon in a pan on a burner \" /\u003e Dotdash Meredith Food Studios;Transfer warm potato salad to a serving dish and sprinkle remaining crumbled bacon over top. Garnish with parsley and serve warm. \u003cimg src=\"https://www.allrecipes.com/thmb/eRW1kFp4Cfw_cLh5G2SUbfDS3Uk=/1500x0/filters:no_upscale():max_bytes(150000):strip_icc():format(webp)/JF_83097-Authentic-German-Potato-Salad-4x3_0564-d3a46edfe7784159aea8ba2a3b81bb58.jpg\" width=\"4000\" height=\"3000\" class=\"img--noscript mntl-image mntl-image universal-image__image\" srcset=\"https://www.allrecipes.com/thmb/xkC5hEsYFi6MOCHCG8znTMZLM8A=/750x0/filters:no_upscale():max_bytes(150000):strip_icc():format(webp)/JF_83097-Authentic-German-Potato-Salad-4x3_0564-d3a46edfe7784159aea8ba2a3b81bb58.jpg 750w\" sizes=\"750px\" alt=\"Authentic German Potato Salad garnished with fresh herbs in a bowl with a spoon \" /\u003e Dotdash Meredith Food Studios",
  "source_site": "www.allrecipes.com",
  "crawl_date": "2025-04-26T00:12:57.6893734-04:00"
}