{
  "id": "vUK69lJNg",
  "title": "Italian Pasta Salad Recipe",
  "description": "This Italian pasta salad with salami, mozzarella, bell pepper, and rotini pasta tossed in zesty Italian dressing is sure to be a summer favorite.",
  "body": "​ \n\n \n\n \n\n \n\n \n\n \n\n \n\n \n\n \n\n \n\n \n\n \n\n \n\n \n\n \n\n \n\n \n\n \n\n \n\n \n\n \n\n \n\n \n\n \n\n \n\n \n\n \n\n \n\n\n\n\n\u003ciframe src=\"//www.googletagmanager.com/ns.html?id=GTM-P3X3VT7\" height=\"0\" width=\"0\" style=\"display:none;visibility:hidden\"\u003e\u003c/iframe\u003e\n\nSkip to content\n\n\n\n\n\n\n\n\n\n\n\n\n\n\n Allrecipes\n\n\n \n \n\n\n\n\n\n\n \n\n\n\n\n\n\nSearch\n\n\n\n\n\n\n\n\n\n\n\n\n\n \n\n\n\nPlease fill out this field.\n\n\n\n\n\n\nSearch the site\n\n\n\n\n\n\n\n\n \n\n\n\nPlease fill out this field.\n\n\n\n\n\n \n\n\n\nLog In\n\n \n\n\nMy Account\n\n\n\n\n\n\n\n My Profile\n \n\n Add a Recipe\n \n\n Saved Recipes \u0026 Collections\n \n\n Account Settings\n \n\n Help\n \n\n Log Out\n \n\n\n\n\n\nMagazine\n\n\n\n\n\n\n\n Subscribe\n \n\n Manage Your Subscription\n \n\n Give a Gift Subscription\n \n\n Get Help\n \n\n\n\nNewsletters\n\n\n Sweepstakes\n \n\n\n\n\n\n\n\n\n\n\n\n\n\n\n\n\n\n\n\n\n\n Allrecipes\n\n\n \n\n\n\n\n\nSearch\n\n\n\n\n\n\n\n\n \n\n\n\nPlease fill out this field.\n\n\n\n\n\n\nDinners\n\n\n\n\n\n\n\n\n\n\n\nDinners\n\n\n\n 5-Ingredient Dinners\n \n\n One-Pot Meals\n \n\n Quick \u0026 Easy\n \n\n 30-Minute Meals\n \n\n Family Dinners\n \n\n Soups, Stews \u0026 Chili\n \n\n Comfort Food\n \n\n Main Dishes\n \n\n Sheet Pan Dinners\n \n\n View All\n \n\n\n\n\n\nMeals\n\n\n\n\n\n\n\n\n\n\n\nMeals\n\n\n\n Breakfast \u0026 Brunch\n \n\n Lunch\n \n\n Healthy\n \n\n Appetizers \u0026 Snacks\n \n\n Salads\n \n\n Side Dishes\n \n\n Soups\n \n\n Bread\n \n\n Drinks\n \n\n Desserts\n \n\n View All\n \n\n\n\n\n\nIngredients\n\n\n\n\n\n\n\n\n\n\n\nIngredients\n\n\n\n Chicken\n \n\n Beef\n \n\n Pork\n \n\n Seafood\n \n\n Pasta\n \n\n Fruits\n \n\n Vegetables\n \n\n View All\n \n\n\n\n\n\nOccasions\n\n\n\n\n\n\n\n\n\n\n\nOccasions\n\n\n\n Kentucky Derby Recipes\n \n\n Cinco de Mayo Recipes\n \n\n Mother's Day Recipes\n \n\n Memorial Day Recipes\n \n\n View All\n \n\n\n\n\n\nCuisines\n\n\n\n\n\n\n\n\n\n\n\nCuisines\n\n\n\n Mexican\n \n\n Italian\n \n\n Chinese\n \n\n Indian\n \n\n German\n \n\n Greek\n \n\n Filipino\n \n\n Japanese\n \n\n View All\n \n\n\n\n\n\nKitchen Tips\n\n\n\n\n\n\n\n\n\n\n\nKitchen Tips\n\n\n\n Instant Pot\n \n\n Air Fryer\n \n\n Slow Cooker\n \n\n Our Favorite Products\n \n\n BBQ \u0026 Grilling\n \n\n Cooking by Equipment\n \n\n Ingredient Substitutions\n \n\n View All\n \n\n\n\n\n\nNews\n\n\n\n\n\n\n\n\n\n\n\nNews\n\n\n\n Celebrity \u0026 Entertainment\n \n\n Fast Food\n \n\n Grocery\n \n\n Recalls\n \n\n Trends\n \n\n View All\n \n\n\n\n\n\nFeatures\n\n\n\n\n\n\n\n\n\n\n\nFeatures\n\n\n\n Dinner Fix\n \n\n Sweet Spot\n \n\n In the Kitchen\n \n\n\n\n\n\nAbout Us\n\n\n\n\n\n\n\n\n\n\n\nAbout Us\n\n\n\n About Allrecipes\n \n\n Allstars\n \n\n How to Add a Recipe\n \n\n\n\n\n GET THE MAGAZINE\n \n\n \n\n\n\n\n\n\n\n \n\n\n\nLog In\n\n \n\n\nMy Account\n\n\n\n\n\n\n\n\n\n\n\nMy Account\n\n\n\n My Profile\n \n\n Add a Recipe\n \n\n Saved Recipes \u0026 Collections\n \n\n Account Settings\n \n\n Help\n \n\n Log Out\n \n\n\n\n\n\nMagazine\n\n\n\n\n\n\n\n\n\n\n\nMagazine\n\n\n\n Subscribe\n \n\n Manage Your Subscription\n \n\n Give a Gift Subscription\n \n\n Get Help\n \n\n\n\nNewsletters\n\n\n Sweepstakes\n \n\n\n\n\n\n\n\n\n\n\n\n\n\nFollow Us\n\n\n \n\n\n \n\n \n\n\n \n\n \n\n\n \n\n \n\n\n \n\n \n\n\n \n\n \n\n\n \n\n\n \n\n\n\n\n Dinners\n\n\n\n 5-Ingredient Dinners\n \n\n One-Pot Meals\n \n\n Quick \u0026 Easy\n \n\n 30-Minute Meals\n \n\n Family Dinners\n \n\n Soups, Stews \u0026 Chili\n \n\n Comfort Food\n \n\n Main Dishes\n \n\n Sheet Pan Dinners\n \n\n View All\n \n\n\n\n Meals\n\n\n\n Breakfast \u0026 Brunch\n \n\n Lunch\n \n\n Healthy\n \n\n Appetizers \u0026 Snacks\n \n\n Salads\n \n\n Side Dishes\n \n\n Soups\n \n\n Bread\n \n\n Drinks\n \n\n Desserts\n \n\n View All\n \n\n\n\n Ingredients\n\n\n\n Chicken\n \n\n Beef\n \n\n Pork\n \n\n Seafood\n \n\n Pasta\n \n\n Fruits\n \n\n Vegetables\n \n\n View All\n \n\n\n\n Occasions\n\n\n\n Kentucky Derby Recipes\n \n\n Cinco de Mayo Recipes\n \n\n Mother's Day Recipes\n \n\n Memorial Day Recipes\n \n\n View All\n \n\n\n\n Cuisines\n\n\n\n Mexican\n \n\n Italian\n \n\n Chinese\n \n\n Indian\n \n\n German\n \n\n Greek\n \n\n Filipino\n \n\n Japanese\n \n\n View All\n \n\n\n\n Kitchen Tips\n\n\n\n Instant Pot\n \n\n Air Fryer\n \n\n Slow Cooker\n \n\n Our Favorite Products\n \n\n BBQ \u0026 Grilling\n \n\n Cooking by Equipment\n \n\n Ingredient Substitutions\n \n\n View All\n \n\n\n\n News\n\n\n\n Celebrity \u0026 Entertainment\n \n\n Fast Food\n \n\n Grocery\n \n\n Recalls\n \n\n Trends\n \n\n View All\n \n\n\n\n Features\n\n\n\n Dinner Fix\n \n\n Sweet Spot\n \n\n In the Kitchen\n \n\n\n\n\n\n About Us\n\n\n\n The Allrecipes Allstars\n \n\n How to Add a Recipe\n \n\n\nGET THE MAGAZINE\n\n\n\n\n\n\n\nRecipes\n\n\n\nSalad\n\n\n\nPasta Salad\n\n\n\nItalian Pasta Salad Recipes\n\nItalian Pasta Salad\n\n\n\n\n\n\n\n\n\n\n\n\n\n\n\n\n\n4.8\n(170)\n136 Reviews\n46 Photos\nThis Italian pasta salad that's loaded with tri-color rotini pasta, salami, bell peppers, and fresh mozzarella balls is quick to make and full of flavor for a delicious summertime salad.\n\nBy\nTrish\n\nUpdated on April 9, 2025\n\n \n \nSave\n\n\n\n\n\n\n\n\nRate\n\n\n\n\n\n \nPrint\n\n\n\n\n\n\n\n\n\n\nShare\n\n\n\n\n\n \n\n\n\n\n\n\n\n\n\n\n\n\n\n\n\n\n\n\n\n\n\n\n\n\n\n\n\n\n \n\n \n\n Add Photo\n\n\n\n\n46\n\n\n\n\u003cimg\nsrc=\"https://www.allrecipes.com/thmb/OzNNlk_37cvPEIawBVjTMIQmQVg=/160x90/filters:no_upscale():max_bytes(150000):strip_icc():format(webp)/222750-Quick-Italian-Pasta-Salad-DDMFS-3X4-0440-3fd1752b521542c49010e5ea07784d84.jpg\"\nwidth=\"160\"\nheight=\"90\"\nclass=\"img--noscript photo mntl-image universal-image__image\"\nalt=\"looking down at a bowl of Italian pasta salad \"\n/\u003e\n\n\n46\n\n\n\n46\n\n\n\n46\n\n\n\n \n\nPrep Time:\n15 mins\n\n\nCook Time:\n10 mins\n\n\nTotal Time:\n25 mins\n\n\nServings:\n12 \n\n\nJump to Nutrition Facts\n\n Jump to recipe\n\n\n\n\n This delicious Italian pasta salad comes together quickly with salami, fresh mozzarella, colorful bell pepper, and red onion, all tossed in Italian salad dressing. \n\n\n  How to Make Italian Pasta Salad  \n You'll find a detailed ingredient list and step-by-step instructions in the recipe below, but let's go over the basics:\n\n\n  Italian Pasta Salad Ingredients  \n These are the ingredients you’ll need to make this quick and easy Italian pasta salad recipe: \n\n\n Pasta: This colorful Italian pasta salad recipe starts with tri-color rotini pasta.Salami: Finely diced Italian salami lends meaty, salty flavor. Vegetables: You’ll need green and red bell peppers, a red onion, and canned black olives.Cheese: Small fresh mozzarella balls add creaminess and rich bursts of flavor. Shredded Parmesan cheese, meanwhile, is the perfect finishing touch. Dressing: You’ll need a cup of Italian-style dressing and three packages of dry Italian-style salad dressing mix.\n\n\n  How to Make Pasta Salad With Italian Dressing  \n Here’s a brief overview of what you can expect when you make this Italian pasta salad at home: \n\n\n Boil the pasta until tender-yet-firm.Combine the pasta, salami, veggies, and mozzarella in a bowl.Toss in salad dressing, then stir in the dressing mix. Sprinkle with Parmesan before serving. \n\n\n  Can You Make Italian Pasta Salad Ahead of Time?   \n This Italian pasta salad is a great make-ahead potluck dish. In fact, since the flavors will continue to meld as they sit together in the fridge, this dish might actually taste better if you make it a day in advance. \n\n\n  How to Store Italian Pasta Salad  \n Store your leftover Italian pasta salad in an airtight container in the refrigerator for up to five days. \n\n\n  Allrecipes Community Tips and Praise  \n “The best recipe ever,” raves The happy traveller. “My husband was licking the empty bowl. I added cherry tomatoes and will go lighter on the red onion next time.”\n\n\n “Delicious,” according to one Allrecipes community member. “Looking for a recipe for a summer family reunion, with no mayo. This was perfect! Even looks nice.”\n\n\n “Yummy and easy,” says another community member. “I don't worry about the color of the peppers — I use whatever I have on hand. Hubby isn't a fan of raw onions, so I add chopped chives instead which are much milder, but still give a hint of onion taste.”\n\n\n Editorial contributions by Corey Williams\n\n\n\n\n \n\n\n\nCook Mode\n(Keep screen awake)\n\nIngredients\n \n\n\n\n\n\n\n1x\n\n\n\n\n\n\n\n\n2x\n\n\n\n\n\n\n\n\n4x\n\n\n\n \n\n\n\nOops! Something went wrong. Our team is working on it.\n\n\n\nOriginal recipe (1X) yields 12 servings\n \n\n1 (12 ounce) package tri-color rotini pasta\n\n\n¾ pound Italian salami, finely diced\n\n\n½ green bell pepper, sliced\n\n\n½ red bell pepper, sliced\n\n\n½ red onion, chopped\n\n\n1 (6 ounce) can sliced black olives\n\n\n8 ounces small fresh mozzarella balls\n\n\n1 cup Italian-style salad dressing\n\n\n3 (.7 ounce) packages dry Italian-style salad dressing mix, or to taste\n\n\n½ cup shredded Parmesan cheese\n\n\n\nDirections\n\n\n Gather all ingredients.\n\n \n\n\n\n\u003cimg\nsrc=\"https://www.allrecipes.com/thmb/MEnUhMVM9ykeLIwekl-x1-H_f_U=/1500x0/filters:no_upscale():max_bytes(150000):strip_icc():format(webp)/222750-Quick-Italian-Pasta-Salad-DDMFS-Step-1-0415-ad656046c74240a29d965739e828e049.jpg\"\nwidth=\"4000\"\nheight=\"3000\"\nclass=\"img--noscript mntl-image mntl-image universal-image__image\"\nsrcset=\"https://www.allrecipes.com/thmb/5hNnCXqKQa4Bnn_R9qzAcwWFHw8=/750x0/filters:no_upscale():max_bytes(150000):strip_icc():format(webp)/222750-Quick-Italian-Pasta-Salad-DDMFS-Step-1-0415-ad656046c74240a29d965739e828e049.jpg 750w\"\nsizes=\"750px\"\nalt=\"ingredients gathered to make Italian pasta salad \"\n/\u003e\n\n \n Dotdash Meredith Food Studios\n\n\n\n\n Bring a large pot of lightly salted water to a boil. Cook rotini pasta at a boil until tender yet firm to the bite, about 8 minutes. Drain and rinse with cold water until cool.\n\n \n\n\n\n\u003cimg\nsrc=\"https://www.allrecipes.com/thmb/tfBCNuWd3TBgRbJNyerLCLWQKb0=/1500x0/filters:no_upscale():max_bytes(150000):strip_icc():format(webp)/222750-Quick-Italian-Pasta-Salad-DDMFS-Step-2-0434-5affbdaae8354255baebc00008b2fccb.jpg\"\nwidth=\"4000\"\nheight=\"3000\"\nclass=\"img--noscript mntl-image mntl-image universal-image__image\"\nsrcset=\"https://www.allrecipes.com/thmb/Y6Qsf8sj4R6xHMCVX2khY1umiUk=/750x0/filters:no_upscale():max_bytes(150000):strip_icc():format(webp)/222750-Quick-Italian-Pasta-Salad-DDMFS-Step-2-0434-5affbdaae8354255baebc00008b2fccb.jpg 750w\"\nsizes=\"750px\"\nalt=\"pasta drained and rinsed\"\n/\u003e\n\n \n Dotdash Meredith Food Studios\n\n\n\n\n Combine pasta, salami, bell peppers, onion, mozzarella balls, and olives in a large bowl. Add salad dressing and toss to coat.\n\n \n\n\n\n\u003cimg\nsrc=\"https://www.allrecipes.com/thmb/QQ1aIggX8I6opZoWrOhF8bVKhE8=/1500x0/filters:no_upscale():max_bytes(150000):strip_icc():format(webp)/222750-Quick-Italian-Pasta-Salad-DDMFS-Step-3-0437-000ab8e62c5147ecb0d3c0df0082fc6f.jpg\"\nwidth=\"4000\"\nheight=\"3000\"\nclass=\"img--noscript mntl-image mntl-image universal-image__image\"\nsrcset=\"https://www.allrecipes.com/thmb/XRJyz_vVz0gLEX5xqVMVjdBeLos=/750x0/filters:no_upscale():max_bytes(150000):strip_icc():format(webp)/222750-Quick-Italian-Pasta-Salad-DDMFS-Step-3-0437-000ab8e62c5147ecb0d3c0df0082fc6f.jpg 750w\"\nsizes=\"750px\"\nalt=\"all ingredients added to a large bowl, tossing to coat\"\n/\u003e\n\n \n Dotdash Meredith Food Studios\n\n\n\n\n Season pasta salad with dry salad dressing mix and stir to combine.\n\n \n\n\n\n\u003cimg\nsrc=\"https://www.allrecipes.com/thmb/sgXLg4oCqXIhY39g9sRRvcKYTRs=/1500x0/filters:no_upscale():max_bytes(150000):strip_icc():format(webp)/222750-Quick-Italian-Pasta-Salad-DDMFS-Step-4-0439-99ece3d0c3814c248214bfbdd34802dd.jpg\"\nwidth=\"4000\"\nheight=\"3000\"\nclass=\"img--noscript mntl-image mntl-image universal-image__image\"\nsrcset=\"https://www.allrecipes.com/thmb/BnGehnSMBIGtovAd5B_wFT-2WzQ=/750x0/filters:no_upscale():max_bytes(150000):strip_icc():format(webp)/222750-Quick-Italian-Pasta-Salad-DDMFS-Step-4-0439-99ece3d0c3814c248214bfbdd34802dd.jpg 750w\"\nsizes=\"750px\"\nalt=\"dry salad mix added to pasta salad\"\n/\u003e\n\n \n Dotdash Meredith Food Studios\n\n\n\n\n Sprinkle with Parmesan cheese before serving. Enjoy!\n\n \n\n\n\n\u003cimg\nsrc=\"https://www.allrecipes.com/thmb/WF-Y_9nLRpZkYORYywk5lJr4YIw=/1500x0/filters:no_upscale():max_bytes(150000):strip_icc():format(webp)/222750-Quick-Italian-Pasta-Salad-DDMFS-3X4-0440-3fd1752b521542c49010e5ea07784d84.jpg\"\nwidth=\"4000\"\nheight=\"3000\"\nclass=\"img--noscript mntl-image mntl-image universal-image__image\"\nsrcset=\"https://www.allrecipes.com/thmb/574VUoi37ca7gemwiDPBPtvczbo=/750x0/filters:no_upscale():max_bytes(150000):strip_icc():format(webp)/222750-Quick-Italian-Pasta-Salad-DDMFS-3X4-0440-3fd1752b521542c49010e5ea07784d84.jpg 750w\"\nsizes=\"750px\"\nalt=\"looking down at a large bowl of Italian pasta salad\"\n/\u003e\n\n \n Dotdash Meredith Food Studios\n\n\n\n\n I Made It\n\n\n\n\n \nPrint\n\n\n\n\n\n\n\n469\nhome cooks made it!\n\nNutrition Facts (per serving)\n\n\n\n371\nCalories\n\n\n21g \nFat\n\n\n29g \nCarbs\n\n\n15g \nProtein\n\n\n\n\n\n \nShow Full Nutrition Label\nHide Full Nutrition Label\n\n\n\n\n\n\nNutrition Facts\n\n\n\nServings Per Recipe\n12\n\n\n\n\nCalories\n371\n\n\n\n\n\n% Daily Value *\n\n\n\nTotal Fat\n21g\n\n\n27%\n\n\n\n\nSaturated Fat\n7g\n\n\n37%\n\n\n\n\nCholesterol\n46mg\n\n\n15%\n\n\n\n\nSodium\n1893mg\n\n\n82%\n\n\n\n\nTotal Carbohydrate\n29g\n\n\n11%\n\n\n\n\nDietary Fiber\n2g\n\n\n6%\n\n\n\n\nTotal Sugars\n5g\n\n\n\n\nProtein\n15g\n\n\n30%\n\n\n\n\nVitamin C\n11mg\n\n\n12%\n\n\n\n\nCalcium\n61mg\n\n\n5%\n\n\n\n\nIron\n2mg\n\n\n11%\n\n\n\n\nPotassium\n210mg\n\n\n4%\n\n\n\n\n* Percent Daily Values are based on a 2,000 calorie diet. Your daily values may be higher or lower depending on your calorie needs.\n** Nutrient information is not available for all ingredients. Amount is based on available nutrient data.\n(-) Information is not currently available for this nutrient. If you are following a medically restrictive diet, please consult your doctor or registered dietitian before preparing this recipe for personal consumption. \n\n\n\n\n\n\n\n\n\n\n\n\n\n\n\n\n\n\n\n\n\n\n\n\n\n\n\n\n \n\n\n\n\n\n\n\n\n Add Your Photo\n\n\n\n\n \nPhotos of Italian Pasta Salad\n \n01\nof 46\n\n\n\n\n\n\n\u003cimg\nsrc=\"https://www.allrecipes.com/thmb/jWmbmz5NbIOvGKTIpPsLSRLWDQg=/0x512/filters:no_upscale():max_bytes(150000):strip_icc():format(webp)/222750-Quick-Italian-Pasta-Salad-DDMFS-3X4-0440-3fd1752b521542c49010e5ea07784d84.jpg\"\nwidth=\"4000\"\nheight=\"3000\"\nclass=\"img--noscript universal-image__image\"\nalt=\"looking down at a bowl of Italian pasta salad \"\n/\u003e\n\n\n\n\n\n\n\nPhoto by \nDotdash Meredith Food Studios\n\n \n\n \n02\nof 46\n\n\n\n\n\n\n\n\n\n\n\nPhoto by \nCassie\n\n\n\n\n\n\n\n\n\n\n\n\n\n\n\n\n\n04/22/2024\n\n\n\nA keeper!\n\n\n\nGreat flavors\n\n\n\nFamily favorite\nEasy and so good! We couldn’t stop eating it! Added extra mozzarella, only 2 packets of Italian dressing mix and used red and yellow peppers and added extra Italian dressing! Definitely a keeper! \n\n \n03\nof 46\n\n\n\n\n\n\n\n\n\n\n\nPhoto by \nMichael DeLuca\n07/24/2021\n \n\n \n04\nof 46\n\n\n\n\n\n\n\n\n\n\n\nPhoto by \nSeanathon\n07/17/2021\n \n\n \n05\nof 46\n\n\n\n\n\n\n\n\n\n\n\nPhoto by \nMichelle Seace Traino\n\n\n\n\n\n\n\n\n\n\n\n\n\n\n\n\n\n05/20/2021\nOkay, before I review this, I have to add that my boyfriend made a recipe up in his head at work, and it turned out to be remarkably close to this one. I was at home looking on here for a recipe that would fit our tastes and found this one. While he was preparing the ingredients, I happen to notice that they were very similar to the ingredients in this recipe. Only a couple of things were different. He added pepperoni and cucumbers instead of the black olives and parmesan cheese and used a 16oz bottle of dressing and 1pkg of the dry instead of what this one called for. It was delicious. We loved it! We plan to follow this recipe next time so we can compare. I was just amazed at how much alike this recipe and his recipe were. Thanks so much to \"both\" creators. Soooo tasty! \n\n \n06\nof 46\n\n\n\n\n\n\n\n\n\n\n\nPhoto by \nHeather C\n\n\n\n\n\n\n\n\n\n\n\n\n\n\n\n\n\n10/05/2020\nFirst time making this type of salad. It was so good. I used red bell pepers instead of green ones. I didnt use olives or dry itailian mix. I only used about 1/2 cup dressing or less to my liking. Red onions gives it a bold spice but I love red onion so amount was great. Awesome recipe my family loved it. I will make again or for potluck for Thanksgiving. Yummy \n\n \n07\nof 46\n\n\n\n\n\n\n\n\n\n\n\nPhoto by \nDeanna Quade\n09/22/2020\n \n\n \n08\nof 46\n\n\n\n\n\n\n\n\n\n\n\nPhoto by \nDeanna Quade\n09/22/2020\n \n\n \n09\nof 46\n\n\n\n\n\n\n\n\n\n\n\nPhoto by \nDeanna Quade\n09/22/2020\n \n\n \n10\nof 46\n\n\n\n\n\n\n\n\n\n\n\nPhoto by \nkatidancer\n07/17/2020\n \n\n\n1\n\n\n2\n\n\n3\n\n\n4\n\n\n5\n\n\n\nNext\n\n\n\n\n\n\n \n\n\n\n\n\nYou’ll Also Love\n\n\n\n\n\n\u003cimg\nsrc=\"https://www.allrecipes.com/thmb/wXiDiwYIbI90erbq1F3Swz2zcFc=/282x188/filters:no_upscale():max_bytes(150000):strip_icc():format(webp)/8284085-87fece341e2c4862b587ab53df63868a.jpg\"\nwidth=\"282\"\nheight=\"188\"\nclass=\"img--noscript card__img universal-image__image\"\n/\u003e\n\n\n\n \n\n\n\n\n\n\n\n\nChef John's Antipasto Pasta Salad\n\n\n\n\n\n\n\n\n\n\n\n\n\n\n\n\n\n\n\n31\n\nRatings\n\n\n \n\n\n\n\n\n\n\u003cimg\nsrc=\"https://www.allrecipes.com/thmb/RUOAJ8n9pGsvND9XySvmM4OBnBM=/282x188/filters:no_upscale():max_bytes(150000):strip_icc():format(webp)/403812-04be4eaec22242949513eb1556ce01d9.jpg\"\nwidth=\"282\"\nheight=\"188\"\nclass=\"img--noscript card__img universal-image__image\"\n/\u003e\n\n\n\n \n\n\n\n\n\n\n\n\nFresh Mozzarella Pasta Salad\n\n\n\n\n\n\n\n\n\n\n\n\n\n\n\n\n\n\n\n89\n\nRatings\n\n\n \n\n\n\n\n\n\n\u003cimg\nsrc=\"https://www.allrecipes.com/thmb/RlT30-K2lSqGJnlq81PrDpVXeO8=/282x188/filters:no_upscale():max_bytes(150000):strip_icc():format(webp)/Italian-Deli-Pasta-Salad-1x1-1-4d6c8e61fd054b779d5168f10143b9ff.jpg\"\nwidth=\"282\"\nheight=\"188\"\nclass=\"img--noscript card__img universal-image__image\"\nalt=\"Italian Deli Pasta Salad\"\n/\u003e\n\n\n\n \n\n\n\n\n\n\n\n\nItalian Deli Pasta Salad\n\n\n\n\n\n\n\n\n\n\n\n\n\n\n\n\n\n\n\n5\n\nRatings\n\n\n \n\n\n\n\n\n\n\u003cimg\nsrc=\"https://www.allrecipes.com/thmb/vVBUMhWJmW0aK09TGSiPQTUm8NM=/282x188/filters:no_upscale():max_bytes(150000):strip_icc():format(webp)/970176-4081e729ebbc4d99b7a0b5ca257dbf24.jpg\"\nwidth=\"282\"\nheight=\"188\"\nclass=\"img--noscript card__img universal-image__image\"\n/\u003e\n\n\n\n \n\n\n\n\n\n\n\n\nItalian Pasta Salad II\n\n\n\n\n\n\n\n\n\n\n\n\n\n\n\n\n\n\n\n18\n\nRatings\n\n\n \n\n\n\n\n\n\n\u003cimg\nsrc=\"https://www.allrecipes.com/thmb/a-0fgDs2aHQyaM6sm7qr6SpNGQA=/282x188/filters:no_upscale():max_bytes(150000):strip_icc():format(webp)/1130096-e92187276a524205940f096ce5a1f9a9.jpg\"\nwidth=\"282\"\nheight=\"188\"\nclass=\"img--noscript card__img universal-image__image\"\n/\u003e\n\n\n\n \n\n\n\n\n\n\n\n\nPantry Pasta Salad\n\n\n\n\n\n\n\n\n\n\n\n\n\n\n\n\n\n\n\n1\n\nRating\n\n\n \n\n\n\n\n\n\n\u003cimg\nsrc=\"https://www.allrecipes.com/thmb/Sk0830UUsJTy0luGZgSN_y6tctM=/282x188/filters:no_upscale():max_bytes(150000):strip_icc():format(webp)/663977-salami-lovers-italian-pasta-salad-CookinBug-4x3-1-8b2ac8e2705b4df9a75dbbe8b478539c.jpg\"\nwidth=\"282\"\nheight=\"188\"\nclass=\"img--noscript card__img universal-image__image\"\nalt=\"close up view of Italian Pasta Salad with salami, black olives and peppers in a bowl\"\n/\u003e\n\n\n\n \n\n\n\n\n\n\n\n\nSalami Lover's Italian Pasta Salad\n\n\n\n\n\n\n\n\n\n\n\n\n\n\n\n\n\n\n\n42\n\nRatings\n\n\n \n\n\n\n\n\n\n\u003cimg\nsrc=\"https://www.allrecipes.com/thmb/JE4scsAV3vxAyPvEXfStWNyNam4=/282x188/filters:no_upscale():max_bytes(150000):strip_icc():format(webp)/1203068-4fb6192a6f98448ea47388162494d2ce.jpg\"\nwidth=\"282\"\nheight=\"188\"\nclass=\"img--noscript card__img universal-image__image\"\n/\u003e\n\n\n\n \n\n\n\n\n\n\n\n\nSimple Italian Pasta Salad\n\n\n\n\n\n\n\n\n\n\n\n\n\n\n\n\n\n\n\n10\n\nRatings\n\n\n \n\n\n\n\n\n\n\u003cimg\nsrc=\"https://www.allrecipes.com/thmb/BjBztC1Ud4vBCULs5fCYLMGqB10=/282x188/filters:no_upscale():max_bytes(150000):strip_icc():format(webp)/664489-1da22e35b5b14738aaa573705cf462bb.jpg\"\nwidth=\"282\"\nheight=\"188\"\nclass=\"img--noscript card__img universal-image__image\"\n/\u003e\n\n\n\n \n\n\n\n\n\n\n\n\nAmerican-Italian Pasta Salad\n\n\n\n\n\n\n\n\n\n\n\n\n\n\n\n\n\n\n\n215\n\nRatings\n\n\n \n\n\n\n\n\n\n\n\n\n\u003cimg\nsrc=\"https://www.allrecipes.com/thmb/IyoCBCkZh7R4UrxqEidk-wxThjk=/282x188/filters:no_upscale():max_bytes(150000):strip_icc():format(webp)/3871772-2ae34c76aa2047e8951afa2cf045c2d5.jpg\"\nwidth=\"282\"\nheight=\"188\"\nclass=\"img--noscript card__img universal-image__image\"\n/\u003e\n\n\n\n \n\n\n\n\n\n\n\n\nTortellini Salad\n\n\n\n\n\n\n\n\n\n\n\n\n\n\n\n\n\n\n\n174\n\nRatings\n\n\n \n\n\n\n\n\n\n\u003cimg\nsrc=\"https://www.allrecipes.com/thmb/_tauEDqdUZpvBLuSJDHbsHwfNP4=/282x188/filters:no_upscale():max_bytes(150000):strip_icc():format(webp)/52734-awesome-pasta-salad-DDMFS-4x3-c8a1726b60334919bacec53bd10c3f1a.jpg\"\nwidth=\"282\"\nheight=\"188\"\nclass=\"img--noscript card__img universal-image__image\"\nalt=\"close up on a large bowl of pasta salad, with pasta, tomatoes, salami, pepperoni, peppers and cheese \"\n/\u003e\n\n\n\n \n\n\n\n\n\n\n\n\nAwesome Pasta Salad\n\n\n\n\n\n\n\n\n\n\n\n\n\n\n\n\n\n\n\n726\n\nRatings\n\n\n \n\n\n\n\n\n\n\u003cimg\nsrc=\"https://www.allrecipes.com/thmb/yBFp20ljxIv8AIcTVOteWCryiv4=/282x188/filters:no_upscale():max_bytes(150000):strip_icc():format(webp)/8655863_Italian-Grinder-Pasta-Salad_Dotdash-Meredith-Food-Studios_4x3-1c587c4aba10480b96cf2ab3b5758d54.jpg\"\nwidth=\"282\"\nheight=\"188\"\nclass=\"img--noscript card__img universal-image__image\"\nalt=\"overhead view of rotini pasta salad in blue bowl with wooden spoon and olive colored napkin\"\n/\u003e\n\n\n\n \n\n\n\n\n\n\n\n\nItalian Grinder Pasta Salad\n\n\n\n\n\n\n\n\n\n\n\n\n\n\n\n\n\n\n\n6\n\nRatings\n\n\n \n\n\n\n\n\n\n\u003cimg\nsrc=\"https://www.allrecipes.com/thmb/v_OZsOS5nr1BNzhGe96NFWtDrFc=/282x188/filters:no_upscale():max_bytes(150000):strip_icc():format(webp)/1042457-1951260cf7ba46f5bc40a147f0d1eab6.jpg\"\nwidth=\"282\"\nheight=\"188\"\nclass=\"img--noscript card__img universal-image__image\"\n/\u003e\n\n\n\n \n\n\n\n\n\n\n\n\nOrzo and Tomato Salad with Feta Cheese\n\n\n\n\n\n\n\n\n\n\n\n\n\n\n\n\n\n\n\n276\n\nRatings\n\n\n \n\n\n\n\n\n\n\u003cimg\nsrc=\"https://www.allrecipes.com/thmb/APCqie8rjWkXBGGnPnuAQYHpCRo=/282x188/filters:no_upscale():max_bytes(150000):strip_icc():format(webp)/3896740-4e09e9b55d2b452ca52d9b00b57b5a64.jpg\"\nwidth=\"282\"\nheight=\"188\"\nclass=\"img--noscript card__img universal-image__image\"\n/\u003e\n\n\n\n \n\n\n\n\n\n\n\n\nPasta Fredda\n\n\n\n\n\n\n\n\n\n\n\n\n\n\n\n\n\n\n\n29\n\nRatings\n\n\n \n\n\n\n\n\n\n\u003cimg\nsrc=\"https://www.allrecipes.com/thmb/C8zIw2vifSxbu8umV_glsUCyVSw=/282x188/filters:no_upscale():max_bytes(150000):strip_icc():format(webp)/1719328-6933b6babaaa4774a26c645307995b0f.jpg\"\nwidth=\"282\"\nheight=\"188\"\nclass=\"img--noscript card__img universal-image__image\"\n/\u003e\n\n\n\n \n\n\n\n\n\n\n\n\nGorgonzola and Prosciutto Tortellini Salad\n\n\n\n\n\n\n\n\n\n\n\n\n\n\n\n\n\n\n\n3\n\nRatings\n\n\n \n\n\n\n\n\n\n\u003cimg\nsrc=\"https://www.allrecipes.com/thmb/MYuYCCMmlOMccxYIu5lmAK9_90k=/282x188/filters:no_upscale():max_bytes(150000):strip_icc():format(webp)/3646536-5d2242eab7e14cb8afd682f5d8be24b9.jpg\"\nwidth=\"282\"\nheight=\"188\"\nclass=\"img--noscript card__img universal-image__image\"\n/\u003e\n\n\n\n \n\n\n\n\n\n\n\n\nTuna Souvlaki Pasta Salad\n\n\n\n\n\n\n\n\n\n\n\n\n\n\n\n\n\n\n\n5\n\nRatings\n\n\n \n\n\n\n\n\n\n\u003cimg\nsrc=\"https://www.allrecipes.com/thmb/-Q5qXZRB0r9294ZKdM0HD30PM_c=/282x188/filters:no_upscale():max_bytes(150000):strip_icc():format(webp)/7051704-02c0666639d4411ca7fbe6763bc11010.jpg\"\nwidth=\"282\"\nheight=\"188\"\nclass=\"img--noscript card__img universal-image__image\"\n/\u003e\n\n\n\n \n\n\n\n\n\n\n\n\nPesto Surprise\n\n\n\n\n\n\n\n\n\n\n\n\n\n\n\n\n\n\n\n17\n\nRatings\n\n\n \n\n\n\n\n \n\n\n Allrecipes\n\n\n \nNewsletters\n \n\nFollow Us\n\n\n \n\n\n \n\n \n\n\n \n\n \n\n\n \n\n \n\n\n \n\n \n\n\n \n\n \n\n\n \n\n \n\n\nDinners\nMeals\nIngredients\nOccasions\nCuisines\nKitchen Tips\nNews\nFeatures \n About Us\n \n\n Editorial Process\n \n\n Privacy Policy\n \n\n Product Vetting\n \n\n Terms of Service\n \n\n Advertise\n \n\n Careers\n \n\n Contact\n \n\n Your Privacy Choices\n  \n\n\n\n \n\n \n\n \n \n\n \n\n\n\n\n\nAllrecipes\nis part of the Dotdash Meredith publishing family.\n\n\n\n\n \n\n\nDialog Heading\n\n\n\n\n\n\n\n \n\n\n \n\n\nNewsletter Sign Up\n\n\n\n\n\n\n\n \n\n \n\n\nNewsletter Sign Up\n\n\n\n\n\n\n\n \n\n\n\n\n\n\n\n\n\n\nMntl.utilities.scriptsOnLoad(document.querySelectorAll('script[data-glb-js=\"bottom\"]'), function() {\nvar Mntl = window.Mntl || {};\nwindow.Mntl = window.Mntl || {};\nwindow.Mntl.affiliatePlugins = window.Mntl.affiliatePlugins || [];\nwindow.Mntl.affiliateLinkRewriter.setMappings( {\nDOC_ID: '6589426'\n,SITE: 'allrecipes'\n,REQUEST_ID: 'n1eebabf42bf14a9a97b16c2dfa774a4304'\n}\n);\nwindow.Mntl.affiliatePlugins.push(window.Mntl.affiliateLinkRewriter.processLink);window.Mntl.externalizeLinks.init();(function (Mntl) {\nMntl.digioh = {\nscript: null,\nbrandId: null,\ninitialized: false,\ninit() {\nif (this.initialized) return;\nconst brandId = '47b4a4dd-ffd7-43db-8118-8002b7c15352';\nconst digiohFastActivation = 'false';\nconst lightboxJs = digiohFastActivation === 'true' ? '/lightbox_speed.js' : '/lightbox_inline.js';\n// eslint-disable-next-line prefer-template\nconst script = 'https://www.lightboxcdn.com/vendor/' + brandId + lightboxJs;\nthis.brandId = brandId;\nthis.script = script;\nthis.initialized = true;\n},\nload(callback) {\nthis.init();\nif (callback) {\nMntl.utilities.loadExternalJS({ src: this.script }, callback);\n} else {\nMntl.utilities.loadExternalJS({ src: this.script });\n}\n}\n};\n})(window.Mntl || {});\nMntl.digiohTimerDelay = parseFloat('0') * 1000;\n(function(Mntl) {\nconst setup = {\"clickToInitialize\":false,\"skin\":{\"name\":\"mantle\"},\"mute\":true,\"advertising\":{\"client\":\"googima\",\"vpaidmode\":\"enabled\",\"rules\":{\"frequency\":1},\"forceNonLinearFullSlot\":true,\"vpaidcontrols\":true,\"autoplayadsmuted\":true},\"autostart\":true,\"mediaid\":\"QPXmNIOG\",\"preload\":\"metadata\",\"autoPause\":{\"pauseAds\":true,\"viewability\":true},\"aspectratio\":\"16:9\",\"pauseotherplayers\":\"true\",\"cast\":{},\"recsPlaylistId\":\"ZBQZ5egR\",\"width\":\"100%\"};\n// JW player requires `playlist` to be populated for contextual playlists\nsetup.playlist = setup.playlistUrl;\nconst isImmediateAutoplay = true;\nconst playInView = 30;\nconst encodedPageURL = encodeURIComponent(window.location);\nconst domain = Mntl.utilities.getDomain();\nconst iuPath = '/' + Mntl.GPT.getDfpId() + '/ddm.' + domain.replace('.com', '.video') + (Mntl.GPT.isMobile() ? '.mob' : '');\nfunction formatAdSizeArray(sizeArr) {\nreturn sizeArr.map(function(sz) {\nreturn sz.join('x');\n}).join('|');\n}\n// Assign a randomly-generated, eight character, alpha-numeric value to this property.\nsetup.advertising.adscheduleid = Math.random().toString(36).substr(2,8);\n// muid - used for audience targeting\nsetup.advertising.ppid = 'e941fc3a-c2c3-45b8-8899-311727f2e7ff';\nlet custParams = '';\ncustParams += '\u0026' + encodeURIComponent('slot') + '=' + encodeURIComponent('primary');\nconst inFocus = window \u0026\u0026 window.document \u0026\u0026 window.document.hasFocus();\nconst durationParams = Mntl.JWPlayer.getDurationParams(39819, false);\ncustParams += '\u0026ttid=' + setup.mediaid;\ncustParams += '\u0026play=' + Mntl.JWPlayer.getCustomPlayValue(setup.autostart, isImmediateAutoplay, playInView);\ncustParams += '\u0026in_focus=' + inFocus;\ncustParams += '\u0026videoduration=' + durationParams.duration;\ncustParams += '\u0026duration_over=' + durationParams.durationOver;\ncustParams += '\u0026duration_under=' + durationParams.durationUnder;\ncustParams += '\u0026frnch=' + 'Community Recipes';\ncustParams += '\u0026tags=' + encodeURIComponent(\"recipe,video,home,how to,tutorial,cooking,quick,allrecipes,recipes,food,ar,tricks,tips,pasta,kitchen,favorite,season,what to make,appetizer,make,ideas,dinner,cheesy,community recipes,lunch,hacks,supper,best recipes,flavor,prep,cuisine,classic recipes,cook,fresh,entertaining,step by step,meal,dish,ingredients,homemade,dinner party,family,friends,prepare,perfect,best,30 minutes or less,boil,sides,buffet and potluck,experienced skill level,rotini,quick recipes,pasta salads,inspired cuisines,one can,cooking with canned goods,italian pasta salad,italian dressing,served at room temperature,cold salad,salami,balls,fresh mozzarella,italian inspired cuisine\");\nsetup.advertising.schedule = [{\n\"offset\": \"pre\",\n\"tag\": [\n'https://securepubads.g.doubleclick.net/gampad/ads?',\n'sz=',\nformatAdSizeArray([[640, 360]]),\n'\u0026iu=',\niuPath,\n'\u0026env=vp\u0026hl=en\u0026gdfp_req=1\u0026impl=s\u0026output=xml_vast2\u0026unviewed_position_start=1\u0026lid=',\n'\u0026url=',\nencodedPageURL,\n'\u0026description_url=',\nencodedPageURL,\n'\u0026correlator=',\nMath.floor(Date.now() / 1000),\n'\u0026cust_params=',\nMntl.GPT.serializeAllTargeting(),\nencodeURIComponent(custParams),\n'\u0026ad_rule=1'\n].join('')\n}];\nMntl.JWPlayer.init({\naccountKey: \"oxY0/BqWBX09BISmLN4/xuTz4IdZy713Cdjj4GyHOiYCUCyJ\",\nadSizes: [[640, 360]],\ndefer: true,\ndeferOnRFDS: true,\ndisplayMode: \"none\",\ndivId: \"article__primary-video-jw_1-0\",\nenableBiddingWithTCData: false,\nenableTVPEngagementBtns: false,\neventCategoryType: \"Primary\",\nintersectionMargin: \"250px\",\nisImmediateAutoplay: isImmediateAutoplay,\nisImmediateStickyDisabled: false,\nisIntersectionDisabled: true,\nisMobileAdhesive: false,\nisBroadVideo: false,\nisPlaylist: false,\nmediaSize: 1080,\nplayerId: \"aiy6MJ4O\",\nplayInView: playInView,\nshowCaptions: true,\nslot: \"primary\",\nrtbVideoConfig: {\"maxduration\":60,\"minduration\":0,\"plcmt\":2},\nuseDynamicVideoSizes: true,\nskipExistingMediaContent: false,\nstickyplay: true,\nuseMotionThumbnails: false\n}, setup );\n}(window.Mntl || {}));\n});\n\n\nBy clicking “Accept All Cookies”, you agree to the storing of cookies on your device to enhance site navigation, analyze site usage, and assist in our marketing efforts. Cookies Settings Accept All Cookies",
  "url": "https://www.allrecipes.com/recipe/222750/quick-italian-pasta-salad",
  "image": "https://www.allrecipes.com/thmb/8qkODnaZTsi-V6PYLoENPUnfh3E=/1500x0/filters:no_upscale():max_bytes(150000):strip_icc()/222750-Quick-Italian-Pasta-Salad-DDMFS-2x1-0443-63746a2576f6461aa8f56f541f45c19b.jpg",
  "name": "Trish",
  "prep_time": "15 min",
  "cook_time": "10 min",
  "total_time": "25 min",
  "calories": "371",
  "servings": "12",
  "ingredients": "Pasta: This colorful Italian pasta salad recipe starts with tri-color rotini pasta.;Salami: Finely diced Italian salami lends meaty, salty flavor.;Vegetables: You’ll need green and red bell peppers, a red onion, and canned black olives.;Cheese: Small fresh mozzarella balls add creaminess and rich bursts of flavor. Shredded Parmesan cheese, meanwhile, is the perfect finishing touch.;Dressing: You’ll need a cup of Italian-style dressing and three packages of dry Italian-style salad dressing mix.",
  "instructions": "Boil the pasta until tender-yet-firm.;Combine the pasta, salami, veggies, and mozzarella in a bowl.;Toss in salad dressing, then stir in the dressing mix.;Sprinkle with Parmesan before serving.;Gather all ingredients. \u003cimg src=\"https://www.allrecipes.com/thmb/MEnUhMVM9ykeLIwekl-x1-H_f_U=/1500x0/filters:no_upscale():max_bytes(150000):strip_icc():format(webp)/222750-Quick-Italian-Pasta-Salad-DDMFS-Step-1-0415-ad656046c74240a29d965739e828e049.jpg\" width=\"4000\" height=\"3000\" class=\"img--noscript mntl-image mntl-image universal-image__image\" srcset=\"https://www.allrecipes.com/thmb/5hNnCXqKQa4Bnn_R9qzAcwWFHw8=/750x0/filters:no_upscale():max_bytes(150000):strip_icc():format(webp)/222750-Quick-Italian-Pasta-Salad-DDMFS-Step-1-0415-ad656046c74240a29d965739e828e049.jpg 750w\" sizes=\"750px\" alt=\"ingredients gathered to make Italian pasta salad \" /\u003e Dotdash Meredith Food Studios;Bring a large pot of lightly salted water to a boil. Cook rotini pasta at a boil until tender yet firm to the bite, about 8 minutes. Drain and rinse with cold water until cool. \u003cimg src=\"https://www.allrecipes.com/thmb/tfBCNuWd3TBgRbJNyerLCLWQKb0=/1500x0/filters:no_upscale():max_bytes(150000):strip_icc():format(webp)/222750-Quick-Italian-Pasta-Salad-DDMFS-Step-2-0434-5affbdaae8354255baebc00008b2fccb.jpg\" width=\"4000\" height=\"3000\" class=\"img--noscript mntl-image mntl-image universal-image__image\" srcset=\"https://www.allrecipes.com/thmb/Y6Qsf8sj4R6xHMCVX2khY1umiUk=/750x0/filters:no_upscale():max_bytes(150000):strip_icc():format(webp)/222750-Quick-Italian-Pasta-Salad-DDMFS-Step-2-0434-5affbdaae8354255baebc00008b2fccb.jpg 750w\" sizes=\"750px\" alt=\"pasta drained and rinsed\" /\u003e Dotdash Meredith Food Studios;Combine pasta, salami, bell peppers, onion, mozzarella balls, and olives in a large bowl. Add salad dressing and toss to coat. \u003cimg src=\"https://www.allrecipes.com/thmb/QQ1aIggX8I6opZoWrOhF8bVKhE8=/1500x0/filters:no_upscale():max_bytes(150000):strip_icc():format(webp)/222750-Quick-Italian-Pasta-Salad-DDMFS-Step-3-0437-000ab8e62c5147ecb0d3c0df0082fc6f.jpg\" width=\"4000\" height=\"3000\" class=\"img--noscript mntl-image mntl-image universal-image__image\" srcset=\"https://www.allrecipes.com/thmb/XRJyz_vVz0gLEX5xqVMVjdBeLos=/750x0/filters:no_upscale():max_bytes(150000):strip_icc():format(webp)/222750-Quick-Italian-Pasta-Salad-DDMFS-Step-3-0437-000ab8e62c5147ecb0d3c0df0082fc6f.jpg 750w\" sizes=\"750px\" alt=\"all ingredients added to a large bowl, tossing to coat\" /\u003e Dotdash Meredith Food Studios;Season pasta salad with dry salad dressing mix and stir to combine. \u003cimg src=\"https://www.allrecipes.com/thmb/sgXLg4oCqXIhY39g9sRRvcKYTRs=/1500x0/filters:no_upscale():max_bytes(150000):strip_icc():format(webp)/222750-Quick-Italian-Pasta-Salad-DDMFS-Step-4-0439-99ece3d0c3814c248214bfbdd34802dd.jpg\" width=\"4000\" height=\"3000\" class=\"img--noscript mntl-image mntl-image universal-image__image\" srcset=\"https://www.allrecipes.com/thmb/BnGehnSMBIGtovAd5B_wFT-2WzQ=/750x0/filters:no_upscale():max_bytes(150000):strip_icc():format(webp)/222750-Quick-Italian-Pasta-Salad-DDMFS-Step-4-0439-99ece3d0c3814c248214bfbdd34802dd.jpg 750w\" sizes=\"750px\" alt=\"dry salad mix added to pasta salad\" /\u003e Dotdash Meredith Food Studios;Sprinkle with Parmesan cheese before serving. Enjoy! \u003cimg src=\"https://www.allrecipes.com/thmb/WF-Y_9nLRpZkYORYywk5lJr4YIw=/1500x0/filters:no_upscale():max_bytes(150000):strip_icc():format(webp)/222750-Quick-Italian-Pasta-Salad-DDMFS-3X4-0440-3fd1752b521542c49010e5ea07784d84.jpg\" width=\"4000\" height=\"3000\" class=\"img--noscript mntl-image mntl-image universal-image__image\" srcset=\"https://www.allrecipes.com/thmb/574VUoi37ca7gemwiDPBPtvczbo=/750x0/filters:no_upscale():max_bytes(150000):strip_icc():format(webp)/222750-Quick-Italian-Pasta-Salad-DDMFS-3X4-0440-3fd1752b521542c49010e5ea07784d84.jpg 750w\" sizes=\"750px\" alt=\"looking down at a large bowl of Italian pasta salad\" /\u003e Dotdash Meredith Food Studios",
  "source_site": "www.allrecipes.com",
  "crawl_date": "2025-04-26T00:12:01.1613438-04:00"
}